id,anio,producto_licitado_id,numero_partida,partida_especifica,clave,descripcion,precio_unitario,importe,iva,total,precio_alterno,referencia_codigo,clasificacion_principal_id
290,2025,93,34,244,BV78,"BLUSA DE VESTIR PARA DAMA, MANGA CORTA TIPO TULIPAN, COLOR CORAL, CONFECCIONADA EN TELA  100% POLIESTER, CUELLO FUSIONADO, SEIS BOTONES DE AJUSTE AL FRENTE,  Y BOTON DE REPUESTO, DOS PINZAS AL FRENTE Y DOS EN ESPALDA, CORTE CON SILUETA, FALDON CURVO, . SEG?N MUESTRA, BV78",697.99,697.99,111.68,809.67,,PC290,35
291,2025,145,86,244,CF02,"CONJUNTO DE 3 PIEZAS PARA DAMA: SACO CONFECCIONADO EN TELA  POLIESTER, FORRO POLIESTER, CUELLO REDONDO, LINEAS HORIZONTALES EN COLOR GRIS Y BEIGE, CORTE CON SILUETA Y TRES COSTURAS EN ESPALDA. FALDA: CONFECCIONADA EN TELA 100% P0LIESTER, COLOR GRIS OXFORD, CORTE RECTO,  CIERRE METALICO Y BOTON DE AJUSTE. BLUSA: CONFECCIONADA EN TELA 100% POLIESTER, COLOR HUESO, CUELLO TIPO SPORT CON CINTAS DECORATIVAS, DOS BOTONES DE AJUSTE CON CADENA, ESCOTE EN V, MANGA LARGA, PU?O FUSIONADO CON BOTON DE AJUSTE Y PLIEGUES, SEG?N MUESTRA CP02.",2275.47,2275.47,364.08,2639.55,,PC291,35
292,2025,103,44,244,CHALC05,"CHALECO PARA CABALLERO COLOR AZUL MARINO, CONFECCIONADO EN TELA 100%  POLIESTER, FORRO POLIESTER , CON DETALLES EN LINEAS PUNTEADAS, CUELLO ALTO, DOS BOLSILLOS AL FRENTE A LA ALTURA DEL ALDOMEN CON BIES COLOR ROJO, CIERRE  DE CARRO METALICO AL FRENTE COLOR ROJO, REPELENTE AL AGUA, BOLSA OCULTA DE LADO IZQUIERDO A LA ALTURA DEL ABDOMEN. SEG?N MUESTRA CHALC05.",795.50,795.50,127.28,922.78,,PC292,38
293,2025,103,44,244,CHALC02,"CHALECO PARA CABALLERO DOBLE VISTA COLOR NEGRO Y CAF?, CONFECCIONADO EN TELA  100% POLIESTER, FORRO P?LIESTER, CAPITONADO DE CUADROS , CUELLO ALTO, DOS BOLSILLOS AL FRENTE CON CIERRE A LA ALTURA DEL ABDOMEN, CIERRE DE CARRO METALICO AL FRENTE.DOS BOLSILLOS INTERNOS A LA ALTURA DEL ABDOMEN, REPELENTE AL AGUA. SEG?N MUESTRA CHALC02.",795.50,795.50,127.28,922.78,,PC293,38
294,2025,105,46,244,CHALC11,"CHALECO PARA CABALLERO COLOR AZUL ACERO, CONFECCIONADO EN TELA 100%  POLIESTER, FORRO POLIESTER, CUELLO ALTO , DOS BOLSILLOS AL FRENTE A LA ALTURA DEL ABDOMEN, CIERRE DE CARRO METALICO AL FRENTE, DOS BOLSAS OCULTAS EN INTERIOR A LA ALTURA DEL ABDOMEN. SEG?N MUESTRA CHALC11",836.05,836.05,133.77,969.82,,PC294,38
295,2025,105,46,244,CHALC14,"CHALECO PARA CABALLERO COLOR NEGRO, CONFECCIONADO EN TELA 100% POLIESTER, FORRO POLIESTER, DOS BOLSAS AL FRENTE CON BROCHE METALICO A LA ALTURA DEL ABDOMEN, DETALLE CAPITONADO HOTRIZONTAL EN HOMBROS, CIERRE DE CARRO METICO EN HOMBROS, BOLSA INTERNA OCULTA  AL ALTURA DEL PECHO  SEG?N MUESTRA CHALC14",836.05,836.05,133.77,969.82,,PC295,38
296,2025,105,46,244,CHALC12,"CHALECO PARA CABALLERO COLOR LADRILLO,  CONFECCIONADO EN TELA 100 % POLIESTER, FORRO POLIESTER,  DOS  BOLSAS AL FRENTE AL ALTURA DEL ABDOMEN, CUELLO ALTO, CIERRE DE CARRO METALICO ALFRENTE.SEG?N MUESTRA CHALC12",836.05,836.05,133.77,969.82,,PC296,38
297,2025,105,46,244,CHALC15,"CHALECO PARA CABALLERO COLOR AZUL MARINO, CONFECCIONADO EN TELA 100% POLIESTER, FORRO POLIESTER, DOS BOLSAS AL FRENTE CON BROCHE METALICO A LA ALTURA DEL ABDOMEN, DETALLE CAPITONADO HOTRIZONTAL EN HOMBROS, CIERRE DE CARRO METICO EN HOMBROS, BOLSA INTERNA OCULTA  AL ALTURA DEL PECHO  SEG?N MUESTRA CHALC14",836.05,836.05,133.77,969.82,,PC297,38
298,2025,106,47,244,CHALD05,"CHALECO PARA DAMA COLOR MALVA, CONFENCCIONADO EN TELA 100% POLIESTER, FORRO POLIESTER, CAPITONADO EN ROMBOS, BOLSAS AL FRENTE A LA ALTURA DEL ABDOMEN, CIERRE DE CARRO METALICO ALFRENTE, CUELLO ALTO, CON RESORTE EN LA PARTE DE ATRAS, REPELENTE AL AGUA.SEGUN MUESTRA CHALD05",818.66,818.66,130.99,949.65,,PC298,38
299,2025,106,47,244,CHALD03,"CHALECO PARA DAMA COLOR NEGRO, CONFECCIONADO EN TELA 100% POLIESTER, FORRO POLIESTER , CON DETALLES EN LINEAS PUNTEADAS, BOLSAS EN AL FRENTE A LA ALTURA DEL ABDOMEN, CIERRE DE CARRO METALICO ALFRENTE, REPELENTE AL AGUA.SEGUN MUESTRA CHALD03",818.66,818.66,130.99,949.65,,PC299,38
300,2025,107,48,244,CHALD14,"CHALECO PARA DAMA COLOR NEGRO, CONFECCIONADO EN TELA 100%  POLIESTER, FORRO POLIESTER, CAPITONADO ZIGZAG, DOS BOLSAS AL FRENTE CON CIERRE A LA ALTURA DEL ABDOMEN, CIERRE DE CARRO METALICO DE COLOR ROJO, DETALLES GRISES EN CINTURA DE AMBOS LADOS, RESORTE EN ESPALDA, CUELLO ALTO, CORTE CON SILUETA . SEG?N MUESTRA CHALD13",821.01,821.01,131.36,952.37,,PC300,38
301,2025,107,48,244,CHALD07,"CHALECO PARA DAMA COLOR AZUL MARINO, CONFECCIONADO EN TELA 100% POLIESTER, FORRO POLIESTER, CORTE CON SILUETA, CAPITONADO HORIZONTAL, BOLSAS AL FRENTE A LA ALTURA DEL ABDOMEN, CIERRE DE CARRO METALICO ALFRENTE, CUELLO TIPO MAO, CON RESORTE EN LA PARTE DE ATRAS, REPELENTE AL AGUA.SEGUN MUESTRA CHALD07",821.01,821.01,131.36,952.37,,PC301,38
302,2025,108,49,244,CHALD17,"CHALECO PARA DAMA COLOR CEREZA, CONFECCIONADO EN TELA 100% POLIESTER, FORRO POLIESTER, CAPITONADO EN PETALOS, CUELLO ALTO, CIERRE DE CARRO METALICO AL FRENTE , DOS BOLSILLOS AL FRENTE CON CIERRE A LA ALTURA DEL ABDOMEN, BOLSA INTERNA OCULTA EN AMBOS LADOS. SEG?N MUESTRA CHALD15",799.83,799.83,127.97,927.80,,PC302,38
303,2025,108,49,244,CHALD21,"CHALECO PARA DAMA COLOR ROJO, CONFECCIONADO EN TELA 100% POLIESTER, FORRO POLIESTER, CAPITONADO EN ROMBOS, DOS BOLSILLOS AL FRENTE CON CIERRE Y BIES PLASTICO A LA ALTURA DEL ABDOMEN, CIERRE DE ACRRO METALICO CON BIES PLASTICO EN COLOR NEGRO AL FRENTE, AJUSTE ELASTICO EN CINTURACON TOPE METALICO, CUELLO TIPO SPORT. SEG?N MUESTRA CHALD21",799.83,799.83,127.97,927.80,,PC303,38
304,2025,109,50,244,CHALR01,"CHALECO TIPO REPORTERO UNISEX COLOR KAKHI, CONFECCIONADO EN TELA GABARDINA ALGOD?N, CIERRE FROTAL, TRECE BOLSILLOS AL FRENTE, UNO EN ESPALDA Y TRES AL INTERIOR. SEG?N MUESTRA CHALR01.",528.08,528.08,84.49,612.57,,PC304,38
305,2025,95,36,244,CHC04,"CHAMARRA DE CABALLERO COLOR NEGRO, CONFECCIONADA EN TELA 100% POLIESTER, REPELENTE AL AGUA, FORRO POLIESTER, CAPITONADO EN HORIZONTAL, DOS BOLSILLOS DELANTEROS CON DOS BROCHES METALICOS  EN CADA BOLSA, CIERRE DE CARRO METALICO AL FRENTE, AJUSTE ELASTICO CON TOPE  PLASTICO EN GORRO, CIERRES Y BROCE METALICO PARA DESMONTAR. SEGUN MUESTRA CHC04.",919.07,919.07,147.05,1066.12,,PC305,37
306,2025,97,38,244,CHC15,"CHAMARRA DE CABALLERO COLOR AZUL MARINO/ ARENA,CONFECCIONADO EN TELA 92 %POLIESTER 8% POLIAMIDA, REPELENTE AL AGUA, FORRO POLIESTER, REPELENTE AL AGUA, DOS BOLSILLOS DELANTEROS A LA ALTURA DEL ABDOMEN, CIERRE DE ACRRO METALICO AL FRENTE, TEJIDO EN CUELLO, PU?OS Y PRETINA. SEG?N MUESTRA CHC15",959.83,959.83,153.57,1113.40,,PC306,37
307,2025,97,38,244,CHC17,"CHAMARRA PARA CABALLERO COLOR NARANJA, CONFECCIONADA EN TELA 100% POLIESTER, FORRO POLIESTER, DOS BOLSAS AL FRENTE A LA ALTURA DEL ABDOMEN, CIERRE  DE CARRO METALICO AL FRENTE, TEJIDO EN CUELLO,BOLSA INTERNA OCULTA A LA ALTURA DEL ABDOMNEN, PU?OS Y PRETINA CON DETALLES MULTICOLOR, SEG?N MUESTRA CHC17",959.83,959.83,153.57,1113.40,,PC307,37
308,2025,97,38,244,CHC14,"CHAMARRA DE CABALLERO COLOR AZUL MARINO,CONFECCIONADO EN TELA 100% POLIESTER, FORRO POLIESTER, CAPITONADO HORIZONTAL, REPELENTE AL AGUA, DOS BOLSILLOS DELANTEROS A LA ALTURA DEL ABDOMEN, CIERRE DE CARRO METALICO AL FRENTE, TEJIDO EN CUELLO, PU?OS Y PRETINA CON LINEAS MULTICOLOR, BOLSA INTERNA OCULTO A LA ALTURA DEL ABDOMEN. SEG?N MUESTRA CHC14.",959.83,959.83,153.57,1113.40,,PC308,37
309,2025,98,39,244,CHC25,"CHAMARRA DE CABALLERO COLOR AZUL MARINO, CONFECCIONADO EN TELA 100 % POLIESTER, REPELENTE AL AGUA, FORRO POLIESTER, DOS BOLSILLOS DELANTEROS CON CIERRE A LA ALTURA DEL ABDOMEN, CIERRE  DE CARRO METALICO AL FRENTE, CUELLO TIPO SPORT, TEJIDO EN CUELLO, PU?OS Y PRETINA, BOLSA OCULTA A LA ALTURA DEL PECHO DE LADO IZQUIERDO . SEG?N MUESTRA CHC25.",915.31,915.31,146.45,1061.76,,PC309,37
310,2025,99,40,244,CHD01,"CHAMARRA PARA DAMA COLOR AZUL MARINO, CONFECCIONADA EN TELA 100% POLIESTER FORRO POLIESTER, CIERRE AL FRENTE,  DOS BOLSAS AL FRENTE A LA ALTURA DEL ABDOMEN, CORET RECTO, DISE?O DE LINEAS PUNTEADAS, TEJIDO EN  PU?O Y PRETINA, CUELLO ALTO. SEG?N MUESTRA CHD01",944.38,944.38,151.10,1095.48,,PC310,37
311,2025,101,42,244,CHD13,"CHAMARRA PARA DAMA COLOR ROJO , CONFECCIONADA EN TELA POLIAMIDA REPELENTE AL AGUA, FORRO POLIAMIDA, RELLENO POLIESTER, CAPITONADO HORIZONTAL, DOS BOLSILLOS CON CIERRE AL FRENTE, CIERRE DE CARRO METALICO AL FRENTE AL FRENTE, CUELLO ALTO, CORTE CON SILUETA, BOLSA OCULTA A LA ALTURA DEL ABDOMEN DE LADO IZQUIERDO, BOLSA PARA FACILITAR SU GUARDADO. SEG?N MUESTRA CHD13",966.89,966.89,154.70,1121.59,,PC311,37
312,2025,101,42,244,CHD12,"CHAMARRA PARA DAMA COLOR AMARILLO , CONFECCIONADA EN TELA POLIAMIDA REPELENTE AL AGUA, FORRO POLIAMIDA, RELLENO POLIESTER, CAPITONADO HORIZONTAL, DOS BOLSILLOS AL FRENTE, CIERRE DE CARRO METALICO AL FRENTE AL FRENTE, CUELLO ALTO, CORTE CON SILUETA, BOLSA OCULTA A LA ALTURA DEL ABDOMEN DE LADO IZQUIERDO, BOLSA PARA FACILITAR SU GUARDADO. SEG?N MUESTRA CHD12",966.89,966.89,154.70,1121.59,,PC312,37
313,2025,102,43,244,CHD16,"CHAMARRA PARA DAMA COLOR AZUL CIELO, CONFECCIONADA EN TELA 100% POLIESTER REPELENTE AL AGUA, FORRO POLIAMIDA,RELLENO POLIESTER, CAPITONADO HORIZONTAL, DOS BOLSILLOS AL FRENTE CON DOS BROCHES DE PRESION  EN CADA BOLSA COLOR CIELO, CIERRE DE CARRO METALICO AL FRENTE, CUELLO ALTO, SEG?N MUESTRA CHD15",918.10,918.10,146.90,1065.00,,PC313,37
314,2025,102,43,244,CHD15,"CHAMARRA PARA DAMA COLOR VERDE FLUORECENTE, CONFECCIONADA EN TELA 100% POLIESTER REPELENTE AL AGUA, FORRO POLIAMIDA,RELLENO POLIESTER, CAPITONADO HORIZONTAL, DOS BOLSILLOS AL FRENTE CON DOS BROCHES DE PRESION  EN CADA BOLSA COLOR VERDE, CIERRE DE CARRO METALICO AL FRENTE, CUELLO ALTO, SEG?N MUESTRA CHD15",918.10,918.10,146.90,1065.00,,PC314,37
315,2025,146,87,244,CP04,"CONJUNTO DE 3 PIEZAS PARA DAMA COLOR UVA: SACO CONFECCIONADO EN TELA  POLIESTER, FORRO POLIESTER, CUELLO CON SOLAPA, DOS BOLSAS SIMULADAS AL FRENTE TIPO FLAP, BOTON DE AJUSTE AL FRENTE, DOS PINZAS AL FRENTE, PU?O FUSIONADO CON CUATRO BOTONES DE AJUSTE. PANTALON: CONFECCIONADO EN TELA 100% P0LIESTER, COLOR UVA, CORTE RECTO,  CIERRE METALICO Y BOTON DE AJUSTE  AL FRENTE, BOLSA SIMULADA TIPO OJAL A LA ALTURA DE LA CADERA, DOS PINZAS EN LA PARTE TRASERA A LA ALTURA DE LA CADERA. BLUSA: CONFECCIONADA EN TELA 100% POLIESTER, COLOR BLANCO CON DETALLES DE LINEAS EN COLOR UVA, CUELLO TIPO MAO, ESCOTE EN V, MANGA LARGA, PU?O FUSIONADO CON BOTON DE AJUSTE Y PLIEGUES, CINCO BOTONES DE AJUSTE AL FRENTE, SEG?N MUESTRA CP04.",2275.47,2275.47,364.08,2639.55,,PC315,33
316,2025,80,21,244,CV01,"CAMISA DE VESTIR MANGA LARGA PARA CABALLERO COLOR BLANCO, DISE?O LISO, COMPOSICI?N 85% POLIESTER 12%  ALGOD?N 3% EXPANDEX, CUELLO FUSIONADO CON DOS BOTONES DE AJUSTE, PU?OS FUSIONADOS CON DOBLE BOT?N DE AJUSTE, SIETE BOTONES DE AJUSTE EN COLOR NEGRO, FALD?N CURVO, DOS BOT?NES DE REPUESTO, BOLSILLO A LA ALTURA DEL PECHO LADO IZQUIERDO, SEG?N MUESTRA CV02.",693.16,693.16,110.91,804.07,,PC316,34
317,2025,81,22,244,CV15,"CAMISA DE VESTIR MANGA LARGA PARA CABALLERO COLOR AZUL CLARO, DISE?O DE ROMBOS BLANCOS Y LINEAS AZUL MARINO, COMPOSICI?N 60% POLIESTER 40%  ALGOD?N, CUELLO FUSIONADO, PU?OS FUSIONADOS CON DOBLE BOT?N DE AJUSTE, SIETE BOTONES DE AJUSTE EN COLOR AZUL CLARO, FALD?N CURVO, DOS BOT?NES DE REPUESTO, BOLSILLO A LA ALTURA DEL PECHO LADO IZQUIERDO, SEG?N MUESTRA CV15.",693.15,693.15,110.90,804.05,,PC317,34
318,2025,82,23,244,CV28,"CAMISA DE VESTIR MANGA LARGA PARA CABALLERO COLOR BLANCO, ESTAMPADO A CUADROS EN COLOR AZULES DEGRADADOS, COMPOSICI?N 60% POLIESTER 40%  ALGOD?N, CUELLO FUSIONADO, PU?OS FUSIONADOS CON DOBLE BOT?N DE AJUSTE, SIETE BOTONES DE AJUSTE EN COLOR AZUL MARINO, FALD?N CURVO, DOS BOT?NES DE REPUESTO, BOLSILLO A LA ALTURA DEL PECHO LADO IZQUIERDO, SEG?N MUESTRA CV28.",693.16,693.16,110.91,804.07,,PC318,34
319,2025,82,23,244,CV30,"CAMISA DE VESTIR MANGA LARGA PARA CABALLERO COLOR AZUL, CON DISE?O DE RAYAS VERTICALES EN COLOR BLANCO, COMPOSICION 60% POLIESTER 40%  ALGODON, CUELLO FUSIONADO, PU?OS FUSIONADOS CON DOBLE BOTON DE AJUSTE, SIETE BOTONES DE AJUSTE EN COLOR AZUL MARINO, FALDON CURVO, DOS BOTONES DE REPUESTO, BOLSILLO A LA ALTURA DEL PECHO LADO IZQUIERDO, SEGUN MUESTRA CV30.",693.16,693.16,110.91,804.07,,PC319,34
320,2025,84,25,244,CV41,"CAMISA DE VESTIR MANGA LARGA PARA CABALLERO COLOR AZUL MARINO, ESTAMPADO DE LINEAS COLOR BLANCO Y ROJO, COMPOSICI?N 60% POLIESTER 40%  ALGOD?N, CUELLO FUSIONADO CON DOS BOTONES DE AJUSTE, PU?OS FUSIONADOS CON DOBLE BOT?N DE AJUSTE, SIETE BOTONES DE AJUSTE EN COLOR BLANCO, FALD?N CURVO, DOS BOT?NES DE REPUESTO, BOLSILLO A LA ALTURA DEL PECHO LADO IZQUIERDO, SEG?N MUESTRA CV41.",693.16,693.16,110.91,804.07,,PC320,34
321,2025,152,93,244,FL04,"FILIPINA PARA CABALLERO MANGA CORTA CON CON LINEAS EN AZUL TURQUEZA, COLOR BLANCO, COMPOSICI?N 65% POLIESTER 35% ACRILICO, CUELLO TIPO MAO, CIERRE DE CARRO METALICO AL FRENTE CON BIES COLOR TURQUEZA, DOS BOLSAS AL FRENTE A LA ALTURA DEL ABDOMEN, UNA BOLSA A LA ALTURA DEL PECHO CON DETALLES COLOR TURQUEZA . SEG?N MUESTRA FL04.",327.07,327.07,52.33,379.40,,PC321,52
322,2025,152,93,244,FL02,"FILIPINA PARA CABALLERO MANGA CORTA COLOR AZUL CLARO JASPEADO, COMPOSICI?N 65% POLIESTER 35% ACRILICO, CUELLO TIPO MAO, CINCO BOTONES AL FRENTE COLOR AZUL, DOS BOLSAS AL FRENTE A LA ALTURA DEL ABDOMEN, UNA BOLSA A LA ALTURA DEL PECHO . SEG?N MUESTRA FL01.",327.07,327.07,52.33,379.40,,PC322,52
323,2025,153,94,244,FL08,"FILIPINA PARA DAMA,  MANGA CORTA COLOR MENTA, COMPOSICI?N 65% POLIESTER 35% ACRILICO, CUELLO TIPO MAO, ESCOTE EN V, CIERRE DE CARRO METALICO AL FRENTE, TRES BOLSAS AL FRENTE, DOS  A LA ALTURA DEL ABDOMEN, Y UNA A LA ALTURA DEL PECHO LADO IZQUIERDO,  CINTA DECORATIVA EN ESPALDA, CORTE CON SILUETA, APERTURA EN LATERALES INFERIORES.  SEG?N MUESTRA FL07.",326.31,326.31,52.21,378.52,,PC323,52
324,2025,153,94,244,FL07,"FILIPINA PARA DAMA,  MANGA 3/4 COLOR BLANCO, COMPOSICI?N 65% POLIESTER 35% ACRILICO, CUELLO TIPO SPORT, ESCOTE EN V, CINCO BOTONES AL COLOR BLANCO,  DOS BOLSAS AL FRENTE A LA ALTURA DEL ABDOMEN,  CINTA DECORATIVA EN ESPALDA, CORTE CON SILUETA, BIES COLOR ROSA EN MANGAS Y BOLSAS.  SEG?N MUESTRA FL07.",326.31,326.31,52.21,378.52,,PC324,52
325,2025,153,94,244,FL06,"FILIPINA PARA DAMA,  MANGA CORTA COLOR MELON, COMPOSICI?N 65% POLIESTER 35% ACRILICO, CUELLO MAO, ESCOTE EN V, CIERRE DE CARRO METALICO AL FRENTE, DOS BOLSAS AL FRENTE A LA A LTURA DEL ABDOMEN  Y UNA A LA ALTURA DEL PECHO, UNA CINTA DECORATIIVA EN ESPALDA, CORTE CON SILUETA. SEG?N  MUESTRA FL06.",326.31,326.31,52.21,378.52,,PC325,52
326,2025,153,94,244,FL05,"FILIPINA  PARA DAMA, MANGA CORTA CON DETALLE EN COLOR AZUL MARINO, COLOR AZUL CIELO, COMPOSICI?N 65% POLIESTER 35% ACRILICO, CUELLO  REDONDO , CINCO BOTONES  DE AJUSTE  CRUZADO AL FRENTE  CON DETALLE DE BIES EN COLOR AZUL MARINO , DOS BOLSAS AL FRENTE A LA ALTURA DEL ABDOMEN CON FILO EN COLOR AZUL MARINO, DOS PINZAS  EN LA PARTE DE ATRAS, CORTE CON SILUETA. SEG?N MUESTRA FL05.",326.31,326.31,52.21,378.52,,PC326,52
327,2025,144,85,244,FV02,"FALDA DE VESTIR PARA DAMA COLOR GRIS OXFORD, COMPOSICI?N 65% POLIESTER 35% ACRILICO, CORTE RECTO,  DOS PINZAS AL FRENTE Y ATRAS, ABERTURA TRASERA, CIERRE  DE CARRO METALICO CON BOTON PASTICO COLOR NEGRO, EN LA PARTE DE ATR?S, BOLSAS EN DIAGONALES LATERALES . SEG?N MUESTRA FV02.",462.42,462.42,73.99,536.41,,PC327,40
328,2025,147,88,244,JPC01,"JUEGO DEPORTIVO PARA CABALLERO COMPOSICI?N EN TELA 100% POLIESTER; COMPUESTO DE CHAMARRA EN COLOR GRIS, CON DOS BOLSAS AL FRENTE A LA ALTURA DEL ABDOMEN TIPO OJAL, CIERRE AL FRENTE,GORRO; PANTS COLOR  GRIS, DOS BOLSAS LATERALES, RESORTE EN LA CINTURA,CORTE RECTO. SEGUN MUESTRA JPC01",1004.99,1004.99,160.80,1165.79,,PC328,37
329,2025,147,88,244,JPC02,"JUEGO DEPORTIVO PARA CABALLERO COMPOSICI?N EN TELA 100% POLIESTER; COMPUESTO DE CHAMARRA EN COLOR AZUL MARINO CON DOS BOLSAS AL FRENTE A LA ALTURA DEL ABDOMEN TIPO CANGURO, CIERRE AL FRENTE, CON GORRO; PANTS COLOR  AZUL MARINO, DOS BOLSAS LATERALES, RESORTE EN LA CINTURA,TEJIDO EN PU?OS Y PRETINA,CORTE RECTO. SEGUN MUESTRA JPC02",1004.99,1004.99,160.80,1165.79,,PC329,37
330,2025,149,90,244,JPD02,"JUEGO DEPORTIVO PARA DAMA EN COLOR AZUL MARINO, CONFECCIONADO EN TELA 100% POLIESTER; CHAMARRA CON DOS BOLSILLOS AL FRENTE TIPO CANGURO, CIERRE AL FRENTE,GORRO,PANTS COLOR AZUL MARINO, AJUSTE ELASTICO EN CINTURA, DOS BOLSAS LATERALES. SEG?N MUESTRA JPD02",1050.37,1050.37,168.06,1218.43,,PC330,37
331,2025,31,110,246,OV01,"OVEROL UNISEX COLOR AZUL REY, CONFECCIONADO EN GABARDINA DE ALGOD?N, CON CINTA REFLEJANTE EN BRAZOS Y PIERNAS, CIERRE REFORZADO AL FRENTE CON DOBLE ACCI?N, DOS BROCHES DE PRESI?N EN LA PARTE SUPERIOR DEL CIERRE, DOS BOLSAS DE PARCHE EN LA PARTE SUPERIOR,  SEGUN MUESTRA OV01",524.68,524.68,83.95,608.63,,PC331,43
332,2025,11,11,244,PGC04,"PANTALON DE GABARDINA PARA CABALLERO COLOR GRIS, CONFECCIONADO EN 98% ALGOD?N 2% ELASTANO, CUATRO BOLSILLOS, DOS AL FRENTE DIAGONALES Y DOS TRASEROS TIPO OJAL, TIRO  MEDIO, CORTE RECTO, PIERNA Y VALENCIANA RELAJADA, CIERRE DE CARRO  METALICO EN BRAGUETA Y BOTON PLASTICO PARA AJUSTE, CINCO PRESILLAS. SEG?N MUESTRA PGC04",560.90,560.90,89.74,650.64,,PC332,33
333,2025,11,11,244,PGC05,"PANTALON DE GABARDINA PARA CABALLERO COLOR NEGRO, CONFECCIONADO EN 98% ALGOD?N 2% ELASTANO,CUATRO BOLSILLOS, DOS AL FRENTE DIAGONALES Y DOS TRASEROS TIPO OJAL, TIRO  MEDIO, CORTE RECTO, PIERNA Y VALENCIANA RELAJADA, CIERRE DE CARRO  METALICO EN BRAGUETA Y BOTON PLASTICO PARA AJUSTE, CINCO PRESILLAS. SEG?N MUESTRA PGC05",560.90,560.90,89.74,650.64,,PC333,33
334,2025,12,12,244,PGC16,"PANTALON DE GABARDINA PARA CABALLERO COLOR AZUL MARINO, COMPOSICI?N 57% ALGOD?N 43% POLIESTER, CINCO BOLSILLOS: TRES AL FRENTE Y DOS ATRAS, CIERRE DE CARRO METALICO, EN BRAGUETA Y BOT?N MET?LICO PARA AJUSTE, REMACHES MET?LICOS EN BOLSILLOS DELANTEROS, CORTE REGULAR, CINTURA ALTA, PIERNA RELAJADA Y VALENCIANA PARA BOTA, CINCO PRESILLAS. SEG?N MUESTRA PGC15",552.47,552.47,88.40,640.87,,PC334,30
335,2025,12,12,244,PGC13,"PANTALON DE GABARDINA PARA CABALLERO COLOR TABACO, COMPOSICI?N 56% ALGOD?N 44% POLIESTER, CINCO BOLSILLOS: TRES AL FRENTE Y DOS ATRAS, CIERRE DE CARRO METALICO, EN BRAGUETA Y BOT?N MET?LICO PARA AJUSTE, REMACHES MET?LICOS EN BOLSILLOS DELANTEROS, CORTE REGULAR, CINTURA ALTA, PIERNA RELAJADA Y VALENCIANA PARA BOTA, CINCO PRESILLAS SEG?N MUESTRA PGC13",552.47,552.47,88.40,640.87,,PC335,30
336,2025,12,12,244,PGC08,"PANTALON DE GABARDINA PARA CABALLERO COLOR GRIS, 98% ALGOD?N 2% ELASTANO,  CINCO BOLSILLOS: TRES AL FRENTE Y DOS ATRAS,  CIERRE DE CARRO METALICO EN BRAGUETA Y BOTON METALICO PARA AJUSTE, CORTE SLIM, TIRO CORTO, VALENCIANA SEMI AJUSTADA, PIERNA AJUSTADA, CINCO PRESILLAS, REMACHES METALICOS EN LOS BOLSILLOS FRONTALES. SEG?N MUESTRA PGC08.",552.47,552.47,88.40,640.87,,PC336,33
337,2025,14,14,244,PGC27,"PANTALON DE GABARDINA PARA CABALLERO COLOR VERDE OLIVO, COMPOSICION 100% ALGOD?N ,CINCO BOLSILLOS: TRES AL FRENTE Y DOS ATRAS, CORTE RECTO, CINTURA ALTA, PIERNA Y VALENCIANA RELAJADA, CIERRE DE CARRO METALICO EN BRAGUETA Y BOT?N METALICO PARA AJUSTE, CINCO PRESILLAS, REMACHES METALICOS EN BOLSILLOS DELANTEROS. SEG?N MUESTRA PGC27.",563.46,563.46,90.15,653.61,,PC337,33
338,2025,14,14,244,PGC29,"PANTALON DE GABARDINA PARA CABALLERO COLOR AZUL MARINO, COMPOSICI?N 98% ALGOD?N 2% ELASTANO,  CUATRO BOLSILLOS:  DOS AL FRENTE DIAGONALES Y DOS ATRAS TIPO OJAL CON BOTON, CIERRE DE CARRO METALICO EN BRAGUETA Y BOT?N PLASTICO PARA AJUSTE, CORTE SLIM, PIERNA Y VALENCIANA SEMI JUSTO, CINCO PRESILLAS. SEG?N MUESTRA PGC29",563.46,563.46,90.15,653.61,,PC338,33
339,2025,14,14,244,PGC28,"PANTALON DE GABARDINA PARA CABALLERO COLOR KHAKI, COMPOSICION 100% ALGOD?N ,CINCO BOLSILLOS: TRES AL FRENTE Y DOS ATRAS, CORTE RECTO, CINTURA ALTA, PIERNA Y VALENCIANA RELAJADA, CIERRE DE CARRO METALICO EN BRAGUETA Y BOT?N METALICO PARA AJUSTE, CINCO PRESILLAS, REMACHES METALICOS EN BOLSILLOS DELANTEROS. SEG?N MUESTRA PGC28.",563.46,563.46,90.15,653.61,,PC339,33
340,2025,17,17,244,PGD02,"PANTALON DE GABARDINA PARA DAMA, COLOR VERDE OLIVO, COMPOSICI?N 97% ALGOD?N 3% ELASTANO,  CINCO BOLSILLOS; TRES AL FRENTE Y DOS ATR?S, CINTURA MEDIA, CORTE RECTO, PIERNA Y VALENCIANA RELAJADA, CIERRE DE CARRO METALICO  EN BRAGUETA, UN BOT?N MET?LICO PARA AJUSTE, REMACHES METALICOS EN BOLSILLOS DELANTEROS, CINCO PRESILLAS. SEG?N MUESTRA PGD02",569.59,569.59,91.13,660.72,,PC340,33
341,2025,19,19,244,PGD13,"PANTALON DE GABARDINA PARA DAMA, COLOR AZUL MARINO, COMPOSICION  98% ALGOD?N 2% ELASTANO, CINTURA ALTA, CORTE RECTO, PIERNA Y VALENCIANA RELAJADA, CIERRE DE CARRO METALICO Y BOTON METALICOS EN BRAGUETA PARA AJUSTE, CINCO BOSILLOS: TRES AL FRENTE Y DOS ATR?S, REMACHES METALICOS EN BOLSILLOS DELANTEROS, CINCO PRESILLAS. SEG?N MUESTRA PGD13",578.44,578.44,92.55,670.99,,PC341,33
342,2025,154,95,244,PLC04,"PLAYERA TIPO POLO PARA CABALLERO COLOR MOSTAZA , COMPOSICI?N EN 50% ALGOD?N 50% POLIESTER, MANGA CORTA, 3 BOTONES AL FRENTE, CUELLO Y PU?OS TEJIDOS CON DETALLES EN COLOR BEIGE Y CAF? OSCURO,  DISE?O BORDADO EN PARTE IFERIOR COLOR CAFE. SEG?N MUESTRA PLC04.",294.45,294.45,47.11,341.56,,PC342,36
343,2025,154,95,244,PLC05,"PLAYERA TIPO POLO PARA CABALLERO COLOR NEGRO , COMPOSICI?N EN 50% ALGOD?N 50% POLIESTER, MANGA CORTA, 3 BOTONES AL FRENTE, CUELLO Y PU?OS TEJIDOS CON DETALLES EN COLOR BLANCO CON CORAL, DISE?O BORDADO EN PARTE IFERIOR COLOR BEIGE. SEG?N MUESTRA PLC05.",294.45,294.45,47.11,341.56,,PC343,36
344,2025,154,95,244,PLC02,"PLAYERA TIPO POLO PARA CABALLERO COLOR VERDE PETROLIO , COMPOSICI?N EN 50% ALGOD?N 50% POLIESTER, MANGA CORTA, 3 BOTONES AL FRENTE, CUELLO Y PU?OS TEJIDOS CON DETALLES EN COLOR GRIS Y MARINO,  DISE?O BORDADO EN PARTE IFERIOR COLOR BLANCO. SEG?N MUESTRA PLC02.",294.45,294.45,47.11,341.56,,PC344,36
345,2025,154,95,244,PLC03,"PLAYERA TIPO POLO PARA CABALLERO COLOR VERDE OLIVO , COMPOSICI?N EN 50% ALGOD?N 50% POLIESTER, MANGA CORTA, 3 BOTONES AL FRENTE, CUELLO Y PU?OS TEJIDOS CON DETALLES EN COLOR GRIS Y MARINO,  DISE?O BORDADO EN PARTE IFERIOR COLOR BEIGE. SEG?N MUESTRA PLC03.",294.45,294.45,47.11,341.56,,PC345,36
346,2025,155,96,244,PLD08,"PLAYERA TIPO POLO PARA DAMA COLOR CORAL, COMPOSICI?N EN 50% ALGOD?N 50% POLIESTER, MANGA CORTA, 3 BOTONES AL FRENTE, TEJIDO EN CUELLOS Y PU?O EN COLOR CORAL, DISE?O BORDADO EN PECHO IZQUIERDO COLOR AZUL MARINO. SEG?N MUESTRA PLD08",281.90,281.90,45.10,327.00,,PC346,36
347,2025,155,96,244,PLD03,"PLAYERA TIPO POLO PARA DAMA COLOR AZUL PETROLEO, COMPOSICI?N EN 50% ALGOD?N 50% POLIESTER, MANGA CORTA, 3 BOTONES AL FRENTE, TEJIDO EN CUELLOS Y PU?O, DISE?O BORDADO EN PECHO IZQUIERDO COLOR BLANCO. SEG?N MUESTRA PLD03",281.90,281.90,45.10,327.00,,PC347,36
348,2025,155,96,244,PLD02,"PLAYERA TIPO POLO PARA DAMA COLOR ROSA, COMPOSICI?N EN 50% ALGOD?N 50% POLIESTER, MANGA CORTA, 3 BOTONES AL FRENTE, TEJIDO EN CUELLOS Y PU?O, DISE?O BORDADO EN PECHO IZQUIERDO COLOR AZUL CIELO. SEG?N MUESTRA PLD02.",281.90,281.90,45.10,327.00,,PC348,36
349,2025,155,96,244,PLD06,"PLAYERA TIPO POLO PARA DAMA COLOR GRIS, COMPOSICI?N EN 50% ALGOD?N 50% POLIESTER, MANGA CORTA, 3 BOTONES AL FRENTE, TEJIDO EN CUELLOS Y PU?O CON DETALLES COLOR AZUL MARINO Y ROSA, DISE?O BORDADO EN PECHO IZQUIERDO COLOR AZUL CIELO. SEG?N MUESTRA PLD06",281.90,281.90,45.10,327.00,,PC349,36
350,2025,155,96,244,PLD05,"PLAYERA TIPO POLO PARA DAMA COLOR AZUL CIELO, COMPOSICI?N EN 50% ALGOD?N 50% POLIESTER, MANGA CORTA, 3 BOTONES AL FRENTE, TEJIDO EN CUELLOS Y PU?O, DISE?O BORDADO EN PECHO IZQUIERDO COLOR AZUL MARINO. SEG?N MUESTRA PLD05",281.90,281.90,45.10,327.00,,PC350,36
351,2025,155,96,244,PLD09,"PLAYERA TIPO POLO PARA DAMA COLOR ROJA, COMPOSICI?N EN 50% ALGOD?N 50% POLIESTER, MANGA CORTA, 3 BOTONES AL FRENTE, TEJIDO EN CUELLOS Y PU?O EN COLOR ROJO, DISE?O BORDADO EN PECHO IZQUIERDO COLOR AZUL MARINO. SEG?N MUESTRA PLD09",281.90,281.90,45.10,327.00,,PC351,36
352,2025,155,96,244,PLD04,"PLAYERA TIPO POLO PARA DAMA COLOR BLANCO, COMPOSICI?N EN 50% ALGOD?N 50% POLIESTER, MANGA CORTA, 3 BOTONES AL FRENTE, TEJIDO EN CUELLOS Y PU?O, DISE?O BORDADO EN PECHO IZQUIERDO COLOR ROJO. SEG?N MUESTRA PLD04",281.90,281.90,45.10,327.00,,PC352,36
353,2025,1,1,244,PMC06,"PANTALON DE MEZCLILLA PARA CABALLERO,COLOR AZUL MARINO, COMPOSICION 64 % ALGODON 36% POLIESTER,CUATRO BOLSILLOS:DOS AL FRENTE  Y DOS ATRAS, CINTURA MEDIA, CORTE RECTO,CIERRE DE CARRO METALICO EN BRAGUETA, UN BOTON METALICO  PARA AJUSTE, REMACHES METALICOS EN BOLSILLOS DELANTEROS, SEIS PRESILLAS. SEGUN MUESTRA PMC06",598.55,598.55,95.77,694.32,,PC353,33
354,2025,1,1,244,PMC03,"PANTALON DE MEZCLILLA PARA CABALLERO COLOR AZUL OBCURO, COMPOSICI?N 100% ALGOD?N CINCO BOLSILLOS:  TRES AL FRENTE Y DOS ATRAS,CON REMACHES METALICOS EN LOS BOLSILLOS DE AL FRENTE, SEIS PRESILLAS,CINTURA MEDIA, CIERRE DE CARRO METALICO EN BRAGUETA Y BOT?N  METALICO PARA AJUSTE, CORTE RECTO. SEG?N MUESTRA PMC03.",598.55,598.55,95.77,694.32,,PC354,33
355,2025,4,4,244,PMC18,"PANTALON DE MEZCLILLA PARA CABALLERO COLOR INDIGO MEDIO, COMPOSICION 98% ALGOD?N 2% ELASTANO, CINCO BOLSILLOS: TRES AL FRENTE Y DOS ATRAS , TIRO ALTO, PIERNA RELAJADA, VALENCIANA RELAJADA, CIERRE DE CARRO METALICO  EN BRAGUETA Y BOTON METALICO PARA AJUSTE,  CON REMACHES METALICOS EN LOS BOLSILLOS, CINCO PRESILLAS.SEGUN MUESTRA PMC18.",598.55,598.55,95.77,694.32,,PC355,33
356,2025,4,4,244,PMC15,"PANTALON DE MEZCLILLA PARA CABALLERO COLOR AZUL CLARO, COMPOSICION 98% ALGOD?N,2% ELASTANO,  CINCO BOLSILLOS: TRES AL FRENTE Y DOS ATRAS, CORTE RECTO, TIRO MEDIO, VALENCIANA RELAJADA, PIERNA RELAJADA, CIERRE DE CARRO METALICO EN BRAGUETA, UN BOTON METALICO PARA AJUSTE, REMACHES METALICOS EN BOLSILLOS DELANTEROS, CINCO PRESILLAS. SEG?N MUESTRA PMC15.",598.55,598.55,95.77,694.32,,PC356,33
357,2025,5,5,244,PMC25,"PANTALON DE MEZCLILLA PARA CABALLERO COLOR INDIGO STONE, COMPOSICION 98% ALGOD?N 2% ELASTANO, CINCO BOLSILLOS: TRES AL FRENTE Y DOS  ATRAS, CORTE SLIM, TIRO BAJO, PIERNA AJUSTADA, VALENCIANA SEMI AJUSTADA CIERRE DE CARRO METALICO EN BRAGUETA Y BOTON METALICO PARA AJUSTE, CORTE SLIM, CON REMACHES METALICOS EN  BOLSILLOS  Y CINCO PRESILLA.SEGUN MUESTRA PMC25.",598.55,598.55,95.77,694.32,,PC357,33
