id,anio,producto_licitado_id,numero_partida,partida_especifica,clave,descripcion,precio_unitario,importe,iva,total,precio_alterno,referencia_codigo,clasificacion_principal_id
1,2025,38,117,246,AC04,"FAJA DE PROTECCI?N LUMBAR, FABRICADA EN FIBRAS SINT?TICAS, TIRANTES AJUSTABLES, VARILLAS EN ESPALDA Y CINTUR?N AJUSTABLE CON CIERRE MEDIANTE VELCRO. SEG?N MUESTRA AC04",291.84,291.84,46.69,338.53,,PC1,56
2,2025,58,137,246,AC102,"JUEGO DE IMPERMEABLE UNISEX TIPO DEPORTIVO, CONFECCIONADO EN TELA 100 % POLIESTER; CHAMARRA COLOR VERDE OLIVO, CON REFLEJANTE  AL FRENTE A LA ALTURA DE LOS HOMBROS, Y EN ESPALDA, CON DOS BOLSAS LATERALES, CIERRE DE CARRO METALICO AL FRENTE PARA AJUSTE, RESORTE EN PU?OS,  CUELLO ALTO CON GORRO; PANTS COLOR NEGRO LISO, AJUSTE ELASTICO EN CINTURA, DOS BOLSAS LATERALES, REFLEJANTE AL FRENTE. SEGUN MUESTRA AC102",671.12,671.12,107.38,778.50,,PC2,37
3,2025,58,137,246,AC103,"JUEGO DE IMPERMEABLE UNISEX TIPO DEPORTIVO, CONFECCIONADO EN TELA 100 % POLIESTER; CHAMARRA COLOR  PLATA, DETALLES EN AZUL REY EN , HOMBROS, GORRO Y LATERALES, FRANJA NARANJA FLORECENTE, CON DOS BOLSAS LATERALES, CIERRE DE CARRO METALICO  Y 5 BROCHES METALICOS AL FRENTE PARA AJUSTE, RESORTE EN PU?OS; PANTS COLOR PLATA LISO, AJUSTE ELASTICO EN CINTURA, DOS BOLSAS LATERALES, REFLEJANTE AL FRENTE. SEGUN MUESTRA AC103",671.12,671.12,107.38,778.50,,PC3,37
4,2025,59,138,246,AC108,"CHAMARRA IMPERMEABLE UNISEX TIPO DEPORTIVO, CONFECCIONADO EN TELA 100 % POLIESTER; CHAMARRA COLOR  PLATA, DETALLES EN AZUL REY EN , HOMBROS, GORRO Y LATERALES, FRANJA NARANJA FLORECENTE, CON DOS BOLSAS LATERALES, CIERRE DE CARRO METALICO  Y 5 BROCHES METALICOS AL FRENTE PARA AJUSTE, RESORTE EN PU?OS",421.43,421.43,67.43,488.86,,PC4,37
5,2025,59,138,246,AC107,"CHAMARRA IMPERMEABLE UNISEX TIPO DEPORTIVO, CONFECCIONADO EN TELA 100 % POLIESTER; CHAMARRA COLOR VERDE OLIVO, CON REFLEJANTE  AL FRENTE A LA ALTURA DE LOS HOMBROS, Y EN ESPALDA, CON DOS BOLSAS LATERALES, CIERRE DE CARRO METALICO AL FRENTE PARA AJUSTE, RESORTE EN PU?OS",421.43,421.43,67.43,488.86,,PC5,37
6,2025,61,140,246,AC26,"GUANTE DE L?TEX 100% NATURAL, COLOR NEGRO DE USO INDUSTRIAL Y LABORATORIOS,  PARA MANEJO DE ?CIDOS Y  PRODUCTOS QU?MICOS, PU?O ENROLLADO, PU?O EXTRA LARGO PARA PROTECCI?N DE ANTEBRAZO. SEG?N MUESTRA AC26.",171.74,171.74,27.48,199.22,,PC6,44
7,2025,62,141,246,AC27,"GUANTE DE L?TEX NATURAL COLOR NARANJA, PU?O  LARGO Y SUPERFICIE DE PALMA ANTIDERRAPANTE, PARA LIMPIEZA DOM?STICA, DETERGENTES, JABONES  Y PRODUCTOS QU?MICOS LIGEROS. SEG?N MUESTRA AC27.",43.19,43.19,6.91,50.10,,PC7,44
8,2025,65,144,246,AC37,"GUANTES DE CARNAZA UNITALLA PARA SOLDADURA Y HERRER?A, PU?O LARGO PARA PROTECCI?N EN ANTEBRAZO, CON FORRO INTERNO TEXTIL, PROTECCION ADICIONAL CONTRA CHISPAS Y SALPICADURAS AL SOLDAR. SEG?N MUESTRA AC37.",218.09,218.09,34.89,252.98,,PC8,44
9,2025,67,146,246,AC39,"GUANTE DE CARNAZA COLOR AMARILLO UNITALLA, PU?OS DE SEGURIDAD, IDEAL PARA MANEJO DE MATERIALES DE CONSTRUCCION. SEG?N MUESTRA AC39.",132.75,132.75,21.24,153.99,,PC9,44
10,2025,74,153,246,AC41,"CUBREBOCA EN BLANCO Y AZUL DE ALGOD?N, CON TRES PLIEGUES AL CENTRO PARA MEJOR AJUSTE, DE TELA NO TEJIDA DESECHABLE SELLADO AL CALOR PARA MAYOR PROTECCI?N, BANDA EL?STICA. SEG?N MUESTRA AC41.",6.32,6.32,1.01,7.33,,PC10,56
11,2025,64,143,246,AC42,"GUANTE DE L?TEX PARA EXPLORACI?N  ESTERIL, DESECHABLE, AMBIDIESTRO, ATOXICO  EN COLOR NATURAL, PU?O ENRROLADO, AJUSTE C?MODO. SEG?N MUESTRA AC42.",7.37,7.37,1.18,8.55,,PC11,44
12,2025,68,147,246,AC49,"GUANTE DIEL?CTRICO COLOR AMARILLO, PIEL VACUNO, CON AJUSTADOR EN MU?ECA, MANEJO DE HERRAMIENTAS EL?CTRICAS. SEG?N MUESTRA AC49.",106.40,106.40,17.02,123.42,,PC12,44
13,2025,71,150,246,AC53,"GUANTE PARA MOTOCICLISTA COLOR NEGRO, CONFECCIONADO EN 60% POLIESTER 20% NYLON 20% POLIVINILO, DISE?O DEPORTIVO, RESISTENTES A LA ABRASI?N, PROTECCI?N EN NUDILLOS, ANTIDERRAPANTE EN PALMA Y AJUSTE EN LA MU?ECA DE VELCRO. SEG?N MUESTRA AC53.",703.79,703.79,112.61,816.40,,PC13,44
14,2025,53,132,246,AC65,"CASCO PARA MOTOCICLISTA EN COLOR NEGRO MATE, RENDIJA DE VENTILACION EN LA PARTE SUPERIOR, ABATIBLE,   MICA DE TRANSPARENTE DE POLICARBONATO,  LENTE OBSCURO INTEGRADO DE POLICARBONATO, ANTIRAYADURAS , INTERIOR ACOJINADO, BROCHE MILIMETRICO PARA AJUSTE,  CUMPLE CONLA CERTIFICACION DOT FMVSS2 No18  SEGUN MUESTRA AC65",2209.33,2209.33,353.49,2562.82,,PC14,56
15,2025,21,100,244,AC68,"MOCHILA ERGONOMICA COLOR GRIS COMPOSICI?N 100% POLIESTER, CUATRO COMPARTIMIENTOS CON CIERRE, CON ESPACIO PARA LAPTOP, ASA SUPERIOR, RESPALDO Y TIRANTES ACOJINADOS, DOS BOLSAS LATERALES CON MALLA. SEG?N MUESTRA AC68.",992.44,992.44,158.79,1151.23,,PC15,55
16,2025,21,100,244,AC67,"MOCHILA ERGONOMICA COLOR NEGRO COMPOSICI?N 100% POLIESTER, CUATRO COMPARTIMIENTOS CON CIERRE, CON ESPACIO PARA LAPTOP, ASA SUPERIOR, RESPALDO Y TIRANTES ACOJINADOS, DOS BOLSAS LATERALES CON MALLA. SEG?N MUESTRA AC67.",992.44,992.44,158.79,1151.23,,PC16,55
17,2025,22,101,244,AC71,"MOCHILA ERGONOMICA COLOR AZUL MARINO COMPOSICI?N 100% POLIESTER, CUATRO COMPARTIMIENTOS CON CIERRE, CON ESPACIO PARA LAPTOP, ASA SUPERIOR, RESPALDO Y TIRANTES ACOJINADOS, DOS BOLSAS LATERALES CON MALLA. SEG?N MUESTRA AC71.",992.44,992.44,158.79,1151.23,,PC17,55
18,2025,63,142,246,AC74,"GUANTE DE L?TEX COLOR NEGRO PARA TRABAJOS DE PINTADO Y ACTIVIDADES DE AGRICULTURA, INTERIOR AFELPADO CON PU?O LARGO. SEG?N MUESTRA AC74.",168.56,168.56,26.97,195.53,,PC18,44
19,2025,79,158,246,AC76,"JUEGO  DE PROTECCI?N UNISEX PARA MOTOCICLISTA 100% POLIESTER, COMPUESTO DE: CHAMARRA Y PANTAL?N.CHAMARRA:  CON VENTILACION  EN HOMBROS Y ESPALDA PARTE ALTA, CIERRE DE CARRO METALLICO AL FRENTE PARA AJUSTE Y VELCRO EN CUELLO PARA AJUSTE, AJUSTE DE PU?OS EN VELCRO Y CIERRE, PROTECCION EN HOMBROS, ANTE BRAZOS Y ESPALDA, DOS BOLSILLOOS AL FRENTE A LA ALTURA DEL ABDOMEN CON CIERRE, DOS BOLSAS INTERNAS, TIPO PARCHE Y CON CIERRE, AJUSTE DE CINTURA CON VELCRO Y CIERRE. PANTALON:  PROTECCIONES EN  MUSLO  Y RODILLAS, DOS BOLSAS AL FRENTE CON CIERRE,AJUSTE DE CIERRE , VELCRO Y BROCHE AL FRENTE,  CINTURA CON RESORTE Y AJUSTE DE VELCRO, AJUSTE DE TOBILLO CON VELCRO, VENTILACION EN AMBAS PIERNAS. SEG?N MUESTRA AC76.",7649.96,7649.96,1223.99,8873.95,,PC19,33
20,2025,157,98,244,AC88,"GORRA TIPO BEISBOLERA EN COLOR AZUL JASPEADO, COMFECCIONADA EN ALGODON, SEIS GAJOS CON OJILLOS BORDADOS, VICERA RIGIDA COLOR CAF? , AJUSTE DE METALICO EN PARTE TRASERA SEG?N MUESTRA AC88",90.74,90.74,14.52,105.26,,PC20,45
21,2025,128,69,244,BC04,"BOTA PARA CABALLERO COLOR CAFE, CORTE VACUNO ACABADO PIEL LISA , FORRO TEXTIL ACOJINADO, SUELA SINTETICA COLOR NEGRO, SIN BULLON ,AJUSTE DE RESORTE EN LATERALES,CINTA PARA FACILITAR CALZADO, PESPUNTES VISIBLES, GRABADO DE LOGO EN LA PARTE EXTERIOR, REFUERZO EN TALON. SEGUN MUESTRA BC04.",1195.18,1195.18,191.23,1386.41,,PC21,30
22,2025,128,69,244,BC03,"BOTA PARA CABALLERO COLOR NEGRO, CORTE VACUNO ACABADO PIEL LISA , FORRO TEXTIL ACOJINADO, SUELA SINTETICA COLOR NEGRO, SIN BULLON ,AJUSTE DE RESORTE EN LATERALES,CINTA PARA FACILITAR CALZADO, PESPUNTES VISIBLES, GRABADO DE LOGO EN LA PARTE EXTERIOR, REFUERZO EN TALON. SEGUN MUESTRA BC03.",1195.18,1195.18,191.23,1386.41,,PC22,30
23,2025,130,71,244,BC13,"BOTA PARA CABALLERO COLOR CAFE, CORTE VACUNO, ACABADO PIEL TEXTURIZADA, FORRO TEXTIL ACOJINADO, SUELA SINTETICA COLOR NEGRO, CON BULLON TEXTIL COLOR  CAFE, 12 OJILLOS METALICOS COLOR NATURAL, AJUSTE DE AGUJETA COLOR CAFE, PESPUNTES VISIBLES, GRABADO DE LOGO EN LA PARTE EXTERIOR, RESPIRADORES EN LATERALES. SEGUN MUESTRA BC13.",1100.68,1100.68,176.11,1276.79,,PC23,30
24,2025,131,72,244,BC16,"BOTA PARA CABALLERO COLOR CAFE OBSCURO, CORTE VACUNO, ACABADO PIEL LISO, FORRO TEXTIL ACOJINADO, SUELA SINTETICA COLOR CAF? Y NEGRO,OCHO HERRAJES, DOS GANCHOS METALICOS, AJUSTE DE AGUJETAS COLOR CAF? Y BEIGE,  BULLON SUPERIOR SINTETICO, ACABADO LISO CON CINTA PARA FACILITAR CALZADO, PESPUNTES VISIBLES, GRABADO DE LOGO EN LA PARTE EXTERIOR. SEG?N MUESTRA BC16.",1214.49,1214.49,194.32,1408.81,,PC24,30
25,2025,133,74,244,BC30,"BOTA PARA CABALLERO COLOR NEGRO, ACABADO PIEL TEXTURIZADA, CORTE VACUNO, FORRO TEXTIL, SUELA SINTETICA COLOR NEGRO, SIN BULL?N, CINTA PARA FACILITAR EL CALZADO, FORRRO INTERIOR ACOJINADO, AJUSTE DE CIERRE EN LATERAL INTERNO, DOS CINTAS DECORATIVAS CON HEBILLA A LA ALTURA DEL EMPEINE, DESPUNTES VISIBLES. SEGUN MUESTRA BC30.",1214.49,1214.49,194.32,1408.81,,PC25,30
26,2025,134,75,244,BC37,"BOTA DE CABALLERO COLOR CAFE, CORTE VACUNO ACABADO PIEL LISA, FORRO TEXTIL ACOJINADO, SUELA SINTETICA COLOR NEGRO,AJUSTE DE RESORTE EN LATERALES,CON CINTA PARA FACILITAR CALZADO GRABADO DE LOGO EN PARTE EXTERIOR.SEG?N MUESTRA BC37",1214.49,1214.49,194.32,1408.81,,PC26,30
27,2025,134,75,244,BC35,"BOTA PARA CABALLERO COLOR VERDE OLIVO, CORTE VACUNO ACABADO NOBUCK, FORRO TEXTIL ACOJINADO, SUELA SINTETICA COLOR ARENA, SEIS HERRAJES , DOS GANCHOS METALICOS Y DOS CINTAS TEXTILES PARA AJUSTE, AJUSTE DE AGUJETAS COLOR ARENA, BULLON SUPERIOR SINTETICO ACABADO TEXTURIZADO CON CINTA PARA FACILITAR CALZADO, PESPUNTES VISIBLES, GRABADO DE LOGO EN LA PARTE EXTERIOR. SEG?N MUESTRA BC35.",1214.49,1214.49,194.32,1408.81,,PC27,30
28,2025,137,78,244,BD05,"BOTA PARA DAMA COLOR NEGRO, CORTE VACUNO ACABADO PIEL NOBUCK, FORRO TEXTIL ACOJINADO, SUELA SINTETICA COLOR NEGRO, BULLON TEXTIL , DIEZ OJILLOS METALICOS PERFORADOS, AGUJETA COLOR NEGRO, PESPUNTES VISIBLES, CINTA PARA FRACILITAR EL CALZADOGRABADO DE LOGO EN LA PARTE EXTERIOR. SEG?N MUESTRA BD05",1063.88,1063.88,170.22,1234.10,,PC28,30
29,2025,138,79,244,BD08,"BOTA PARA DAMA COLOR BRONCE, CORTE SINTETICO ACABADO  NOBUCK, FORRO TEXTIL ACOJINADO, SUELA SINTETICA COLOR  GRIS, BULLON TEXTIL, DIEZ OJILLOS METALICOS, CUATRO GANCHOS METALICOS, AGUJETA COLOR NEGRA, GRABADO DE LOGO EN LA PARTE EXTERIOR. SEG?N MUESTRA BD08",865.98,865.98,138.56,1004.54,,PC29,30
30,2025,140,81,244,BD18,"BOTA PARA DAMA COLOR ROBLE CORTE VACUNO ,ACABADO PIEL LISA,SIN FORRO,SIN BULLON SUELA SINTETICA  CON TACON, COLOR BEIGEAJUSTE DE RESORTE EN LATERALES,PESPUNTES VISIBLES,CINTA PARA FACILITAR CALZADO, GRABADO DE LOGO EN LA PARTE EXTERIOR.  SEG?N MUESTRA BD18",1019.69,1019.69,163.15,1182.84,,PC30,30
31,2025,143,84,244,BD41,"BOTA PARA DAMA COLOR CAFE,  CORTE VACUNO, ACABADO PIEL LISA, FORRO TEXTIL ACOJINADO, SUELA SINTETICA CHOCOLATE, PLANTILLA DE CERDO, AJUSTE DE AGUJETA COLOR CAFE , CUATRO OJILLOS PERFORADOS Y SEIS SUJETADORES DE PLASTICO, BULLON ACABADO NOBUK, PESPUNTES VISIBLES, GRABADO DE LOGO EN LA PARTE EXTERIOR. SEGUN MUESTRA BD40",1011.08,1011.08,161.77,1172.85,,PC31,30
32,2025,143,84,244,BD40,"BOTA PARA DAMA COLOR NEGRO,  CORTE VACUNO, ACABADO PIEL TEXTURIZADA, FORRO TEXTIL ACOJINADO, SUELA SINTETICA COLOR NEGRA, PLANTILLA DE CERDO, AJUSTE DE CIERRES EN LATERALES, BULLON ACABADO NOBUK, CON CINTA PARA FACILITAR EL CALZADO, PESPUNTES VISIBLES, SEGUN MUESTRA BD40",1011.08,1011.08,161.77,1172.85,,PC32,30
33,2025,29,108,246,BI01,"BATA UNISEX TIPO INDUSTRIAL MANGA LARGA EN COLOR AZUL MARINO, CONFECCIONADO EN GABARDINA ALGOD?N, CUELLO CON SOLAPA, ALETILLA Y BOTONES PARA CERRAR LA PRENDA, TRES BOLSILLO AL FRENTE, ABERTURAS LATERALES, CINTA TRASERA CON BOTONES. SEG?N MUESTRA BI01.",329.81,329.81,52.77,382.58,,PC33,56
34,2025,30,109,246,BI02,"BATA UNISEX TIPO INDUSTRIAL MANGA LARGA EN COLOR GRIS OXFORD, CONFECCIONADO EN GABARDINA ALGOD?N, CUELLO CON SOLAPA, ALETILLA Y BOTONES PARA CERRAR LA PRENDA, TRES BOLSILLO AL FRENTE, ABERTURAS LATERALES, CINTA TRASERA CON BOTONES. SEG?N MUESTRA BI02.",329.81,329.81,52.77,382.58,,PC34,56
35,2025,111,52,244,BL01,"BLAZER PARA DAMA COLOR AZUL MARINO, CONFECCIONADO EN TELA  POLIESTER, FORRO POLIESTER, DOS BOLSAS SIMULADAS AL FRENTE TIPO OJAL, UN BOTON DE AJUSTE, PINZAS AL FRENTE Y ESPALDA, TRES BOTONES DE ADORNO EN CADA PU?O. SEG?N MUESTRA BL01.",812.87,812.87,130.06,942.93,,PC35,56
36,2025,88,29,244,BV08,"BLUSA DE VESTIR PARA DAMA SIN MANGA ,COLOR  HUESO, DISE?O LISO CONFECCIONADA EN TELA 100% LINO, CUELLO REDONDO, BOTON DE AJUSTE  AL FRENTE A LA ALTURA DEL CUELLO, ABERTURA A LOS COSTADOS, DOS PINZAS A LA ALTURA DEL PECHO, MANGAS CON DETALLE ONDULADO. SEG?N MUESTRA BV07.",676.75,676.75,108.28,785.03,,PC36,35
37,2025,89,30,244,BV31,"BLUSA DE VESTIR PARA DAMA MANGA CORTA, COLOR BLANCO,ESTAMPADO DE LETRAS Y FRANJA METALICA, CONFECCIONADA EN TELA 100% POLIESTER, CUELLO REDONDO, SEGUN MUESTRA BV31.",697.99,697.99,111.68,809.67,,PC37,35
38,2025,90,31,244,BV42,"BLUSA DE VESTIR PARA DAMA MANGA CORTA,COLOR BLANCO,LINEAS EN COLOR ROJO Y GLITER,CONFECCIONADA EN TELA 50% ALGOD?N 50% POLIESTER CUELLO TIPO ""V"" DOS PINZAS A LA ALTURA DEL PECHO,DOS PINZAS EN LA PARTE TRASERA SEG?N MUESTRA BV42.",696.06,696.06,111.37,807.43,,PC38,35
39,2025,90,31,244,BV43,"BLUSA DE VESTIR PARA DAMA MANGA CORTA,COLOR BLANCO,LINEAS EN COLOR VINO, AZUL  Y GLITER,CONFECCIONADA EN TELA 50% ALGODON 50% POLIESTER CUELLO TIPO ""V"" DOS PINZAS A LA ALTURA DEL PECHO,DOS PINZAS EN LA PARTE TRASERA SEGUN MUESTRA BV42.",696.06,696.06,111.37,807.43,,PC39,35
40,2025,90,31,244,BV34,"BLUSA DE VESTIR PARA DAMA MANGA 3/4 ESTAMPADO COLOR REY/HUESO, CONFECCIONADA EN TELA 100% POLIESTER,CUELLO REDONDO,TRES BOTONES DECORATIVOS A LA ALTURA DEL HOMBRO LADO IZQUIERDO, BOTON EN LA PARTE DE ATRAS A LA ALTURA DEL CUELLO COLOR REY, DOS PINZAS A LA ALTURA DEL PECHO, ABERTURA EN COSTADOS PARTE INFERIOR.  SEGUN MUESTRA BV32",696.06,696.06,111.37,807.43,,PC40,35
41,2025,91,32,244,BV57,"BLUSA DE VESTIR PARA DAMA,  COLOR VERDE, COMPOSICION 80% RAYON 20% NYLON,  MANGA CORTA CON OLANES, ESCOTE EN V CON CINTA DE AJUSTE, PLIGUES AL FRENTE A  LA ALTURA DEL PECHO, BOTONES DECORATIVOS  EN ESCOTE.SEGUN MUESTRA BV57.",694.06,694.06,111.05,805.11,,PC41,35
42,2025,92,33,244,BV67,"BLUSA DE VESTIR PARA DAMA,  COLOR MELON, LISA, COMPOSICION, 97% POLIESTER 3% SPANDEX,  MANGA 3/4,CUELLO REDONDO CON DOS BOTONES DE AJUSTE,  ESCOTE EN V, DOS PLIEGUES AL FRENTE, DOS PINZAS AL FRENTE A LA ALTURA DEL PECHO Y DOS EN LA APRTE DE ATRAS, ABERTURAS LATERALES .SEGUN MUESTRA BV67",706.05,706.05,112.97,819.02,,PC42,35
43,2025,92,33,244,BV64,"BLUSA DE VESTIR PARA DAMA,  COLOR BLANCA, CON  LINEAS VERTICALES COLOR AZUL FRANCIA, COMPOSICION, 58% ALGODON, 42% POLIESTER,  MANGA LARGA, CUELLO FUSIONADO, PU?O FUSIONADO CON BOTON DE AJUSTE, CUELLO TIPO SOLAPA, SIETE BOTONES AL FRENTE PARA AJUSTE COLOR MARINO, BOTON DE REPUESTO, CUATRO PINZAS AL FRENTE Y DOS EN ESPALDA .SEGUN MUESTRA BV64",706.05,706.05,112.97,819.02,,PC43,35
44,2025,108,49,244,CHALD19,"CHALECO PARA DAMA COLOR AZUL MARINO, CONFECCIONADO EN TELA 100% POLIESTER, FORRO POLIESTER, CAPITONADO EN ROMBOS, DOS BOLSILLOS AL FRENTE CON CIERRE Y BIES PLASTICO A LA ALTURA DEL ABDOMEN, CIERRE DE ACRRO METALICO CON BIES PLASTICO EN COLOR NEGRO AL FRENTE, AJUSTE ELASTICO EN CINTURACON TOPE METALICO, CUELLO TIPO SPORT. SEG?N MUESTRA CHALD19",799.83,799.83,127.97,927.80,,PC44,38
45,2025,95,36,244,CHC03,"CHAMARRA DE CABALLERO COLOR AZUL MARINO, CONFECCIONADO EN TELA 100% POLIESTER, FORRO POLIESTER, DOS BOLSILLOS DELANTEROS A LA ALTURA DEL ABDOMEN, CIERRE DE CARRO METALICO  AL FRENTE, CUELLO TIPO SPORT FUSIONADO CON BOTON DE AJUSTE, PU?OS  FUSIONADOS CON BOTON DE AJUSTE, PRETINA CON RESORTE, BOLSILLO INTERNO OCULTO A LA ALTURA DEL PECHO. SEGUN MUESTRA CHC03.",919.07,919.07,147.05,1066.12,,PC45,37
46,2025,95,36,244,CHC01,"CHAMARRA DE CABALLERO COLOR AZUL ACERO, CONFECCIONADA EN TELA 100% POLIESTER, REPELENTE AL AGUA, FORRO POLIESTER, CAPITONADO EN HORIZONTAL, DOS BOLSILLOS DELANTEROS CON DOS BROCHES METALICOS  EN CADA BOLSA, CIERRE DE CARRO METALICO AL FRENTE, AJUSTE ELASTICO CON TOPE  PLASTICO EN GORRO, CIERRES Y BROCE METALICO PARA DESMONTAR. SEGUN MUESTRA CHC01.",919.07,919.07,147.05,1066.12,,PC46,37
47,2025,96,37,244,CHC07,"CHAMARRA PARA CABALLERO COLOR  NEGRO/CAFE, CONFECCIONADA EN TELA 100% POLIESTER, FORRO POLIESTER, CUELLO ALTO,  DOS BOLSAS A LA ALTURA DEL ABDOMEN, DOBLE VISTA, TEJIDO EN CUELLO,  PU?O Y PRETINA,  REPELENTE AL AGUA. SEG?N MUESTRA CHC07",958.65,958.65,153.38,1112.03,,PC47,37
48,2025,96,37,244,CHC09,"CHAMARRA DE CABALLERO COLOR AZUL MARINO,CONFECCIONADO EN TELA  100%POLIESTER, FORRO POLIESTER, DOS BOLSILLOS DELANTEROS A LA ATURA DEL ABDOMEN, CIERRE DE CARRO METALICO AL FRENTE, REPELENTE AL AGUA, GORRO DESMONTABLE CON CIERRE DE CARRO METALICO, BOLSAS INTERIORES OCULTAS A LA ALTURA DEL ABDOMEN, AJUSTE DE RESORTE CON TOPE DE PLASTICO EN GORRO, RESORTE EN PU?OS Y CINTURA, CUELLO ALTO. SEG?N MUESTRA CHC09.",958.65,958.65,153.38,1112.03,,PC48,37
49,2025,97,38,244,CHC16,"CHAMARRA DE CABALLERO COLOR AZUL MARINO CON DETALLE EN LINEAS PUNTEADAS ,CONFECCIONADA EN TELA 100% POLIESTER, REPELENTE AL AGUA, FORRO POLIESTER, DOS BOLSILLOS DELANTEROS A LA ALTURA DEL ABDOMEN, CIERRE DE CARRO METALICO AL FRENTE, TEJIDO EN PU?OS Y PRETINA COLOR  AZULMARINO, BOLSA OCULTA A LA ALTURA DEL ABDOMEN, CUELLO ALTO. SEG?N MUESTRA CHC16",959.83,959.83,153.57,1113.40,,PC49,37
50,2025,97,38,244,CHC19,"CHAMARRA PARA CABALLERO COLOR NEGRO, CONFECCIONADA EN TELA 100% POLIESTER, CIERRE DE CARRO METALICO  AL FRENTE, DOS BOLSAS AL FRENTE A LA ALTURA DEL ABDOMEN, DETALLE AMARILLO EN PECHO, AJUSTE DE RESORTE EN PU?OS,  GORRO CON AJUSTE DE RESORTE Y TOPE PLASTICO. SEG?N MUESTRA CH19",959.83,959.83,153.57,1113.40,,PC50,37
51,2025,98,39,244,CHC21,"CHAMARRA DE CABALLERO COLOR AZUL ACERO, CONFECCIONADO EN TELA 100% POLIESTER, REPELENTE AL AGUA, FORRO POLIESTER, DOS BOLSILLOS DELANTEROS A LA ALTURA DEL ABDOMEN, CIERRE DE CARRO METALICO AL FRENTE, TEJIDO EN CUELLO PU?OS Y PRETINA, BOLSA OCULTA A LA ALTURA DEL PECHO. SEGUN MUESTRA CHC21.",915.31,915.31,146.45,1061.76,,PC51,37
52,2025,98,39,244,CHC23,"CHAMARRA DE CABALLERO COLOR OLIVO, CONFECCIONADO EN TELA 100 % POLIESTER, REPELENTE AL AGUA, FORRO POLIESTER, DOS BOLSILLOS DELANTEROS CON CIERRE A LA ALTURA DEL ABDOMEN, CIERRE  DE CARRO METALICO AL FRENTE, CUELLO TIPO SPORT, TEJIDO EN CUELLO, PU?OS Y PRETINA, BOLSA OCULTA A LA ALTURA DEL PECHO DE LADO IZQUIERDO . SEG?N MUESTRA CHC23.",915.31,915.31,146.45,1061.76,,PC52,37
53,2025,99,40,244,CHD04,"CHAMARRA PARA DAMA COLOR OLIVO, CONFECCIONADA EN TELA  100% POLIESTER REPELENTE AL AGUA, FORRO POLIESTER, DOS BOLSILLOS AL FRENTE  TIPO FLAP CON DOS BROCHES MET?LICOS CADA UNO, CIERRE  DE CARRO METALICO AL FRENTE, CUELLO ALTO, AJUSTE ELASTICO CON TOPE PLASTICO EN CUELLO.. SEG?N MUESTRA CHD04",944.38,944.38,151.10,1095.48,,PC53,37
54,2025,99,40,244,CHD02,"CHAMARRA PARA DAMA COLOR AZUL MARINO, CONFECCIONADA EN TELA 100%POLIESTER REPELENTE AL AGUA, FORRO POLIESTER, CAPITONADO HORIZONTAL, DOS BOLSILLOS AL FRENTE A LA ALTURADEL ABDOMEN, CIERRE AL FRENTE, TEJIDO EN CUELLO,  PU?OS  Y PRETINA COLOR AZUL MARINO CON LINEA ROSA EN BORDES. SEG?N MUESTRA CHD02.",944.38,944.38,151.10,1095.48,,PC54,37
55,2025,100,41,244,CHD05,"CHAMARRA PARA DAMA COLOR AZUL MARINO CONFECCIONADA EN TELA 100% POLIESTER REPELENTE AL AGUA, FORRO POLIESTER, DOS BOLSILLOS AL FRENTE  , CIERRE  DE CARRO METALICO AL FRENTE, CUELLO ALTO, AJUSTE ELASTICO CON TOPE PLASTICO EN CINTURA. AJUSTE ELASTICO EN CUELLO, RESORTE EN PU?OS. SEG?N MUESTRA CHD04",944.38,944.38,151.10,1095.48,,PC55,37
56,2025,100,41,244,CHD06,"CHAMARRA DE DAMA COLOR AZUL ACERO, CONFECCIONADA EN TELA 100% POLIESTER REPELENTE AL AGUA, FORRO POLIESTER, CAPITONADO EN HORIZONTAL, DOS BOLSILLOS DELANTEROS CON DOS BROCHES MET?LICOS CADA BOLSA, CIERRE DE CARRO METALICO AL FRENTE, AJUSTE ELASTICO CON TOPE EN GORRO, CIERRES Y BROCE METALICO PARA DESMONTAR. SEG?N MUESTRA CHD06.",944.38,944.38,151.10,1095.48,,PC56,37
57,2025,101,42,244,CHD11,"CHAMARRA PARA DAMA COLOR BEIGE , CONFECCIONADA EN TELA POLIAMIDA REPELENTE AL AGUA, FORRO POLIAMIDA, RELLENO POLIESTER, CAPITONADO HORIZONTAL, DOS BOLSILLOS AL FRENTE, CIERRE DE CARRO METALICO AL FRENTE AL FRENTE, CUELLO ALTO, CORTE CON SILUETA, BOLSA OCULTA A LA ALTURA DEL ABDOMEN DE LADO IZQUIERDO, BOLSA PARA FACILITAR SU GUARDADO. SEG?N MUESTRA CHD11",966.89,966.89,154.70,1121.59,,PC57,37
58,2025,102,43,244,CHD17,"CHAMARRA PARA DAMA COLOR NEGRO, CONFECCIONADA EN TELA POLIAMIDA, REPELENTE AL AGUA, FORRO POLIAMIDA,RELLENO POLIESTER, CAPITONADO HORIZONTAL, DOS BOLSILLOS AL FRENTE CON CIERRE, CIERRE NEGRO CON DETALLES GRISES AL FRENTE, CUELLO ALTO,  BOLSA PAQRA FACILITYAR TU GUSRDADO. SEG?N MUESTRA CHD17",918.10,918.10,146.90,1065.00,,PC58,37
59,2025,146,87,244,CP03,"CONJUNTO DE 3 PIEZAS PARA DAMA: SACO CONFECCIONADO EN TELA  POLIESTER, FORRO POLIESTER, CUELLO TIPO MAO CON BIES AZUL MARINO, COLOR BLANCO CON DETALLES MULTICOLOR, DOS BOLSAS SIMULADAS AL FRENTE A LA ATURA DEL ABDOMEN, PINZAS AL FRENTE A LA ALTURA DEL PECHO, TRES COSTURAS EN LA PARTE DE ATRAS. PANTALON: CONFECCIONADO EN TELA 93% P0LIESTER 7% ELASTANO, COLOR AZUL REY, CORTE RECTO, DOS PINZAS EN LA PARTE DE ATRAS A LA ALTURA DE LA CADERA. BLUSA: CONFECCIONADA EN TELA 100% POLIESTER, COLOR BLANCO, CUELLO REDONDO, MANGA CORTA, ENCAJE DECORATIVO AL FRENTE, CINTAS DE AJUSTE EN CINTURA. SEG?N MUESTRA CP03.",2275.47,2275.47,364.08,2639.55,,PC59,33
60,2025,80,21,244,CV03,"CAMISA DE VESTIR MANGA LARGA PARA CABALLERO, DISE?O CUADRICULADO DE LINEAS EN TONOS DE AZUL, COMPOSICI?N 60% POLIESTER 40%  ALGOD?N, CUELLO FUSIONADO, PU?OS FUSIONADOS CON DOBLE BOT?N DE AJUSTE, SIETE BOTONES DE AJUSTE EN COLOR BLANCO, FALD?N CURVO, DOS BOT?NES DE REPUESTO, BOLSILLO A LA ALTURA DEL PECHO LADO IZQUIERDO, SEG?N MUESTRA CV03.",693.16,693.16,110.91,804.07,,PC60,34
61,2025,81,22,244,CV20,"CAMISA DE VESTIR MANGA LARGA PARA CABALLERO COLOR AZUL FRANCIA, DISE?O TIPO JASPEADO, COMPOSICION 100%  ALGODON, CUELLO FUSIONADO, PU?OS FUSIONADOS CON DOBLE BOTON DE AJUSTE, SIETE BOTONES DE AJUSTE EN COLOR CELESTE, FALDON CURVO, UN BOTON DE REPUESTO, BOLSILLO A LA ALTURA DEL PECHO LADO IZQUIERDO, SEGUN MUESTRA CV20.",693.15,693.15,110.90,804.05,,PC61,34
62,2025,81,22,244,CV13,"CAMISA DE VESTIR MANGA LARGA PARA CABALLERO COLOR ARENA, DISE?O TIPO JASPEADO, COMPOSICI?N 60% POLIESTER 40%  ALGOD?N, CUELLO FUSIONADO, PU?OS FUSIONADOS CON DOBLE BOT?N DE AJUSTE, SIETE BOTONES DE AJUSTE EN COLOR BLANCO CON CAF?, FALD?N CURVO,UN BOT?N DE REPUESTO, BOLSILLO A LA ALTURA DEL PECHO LADO IZQUIERDO, SEG?N MUESTRA CV13.",693.15,693.15,110.90,804.05,,PC62,34
63,2025,81,22,244,CV18,"CAMISA DE VESTIR MANGA LARGA PARA CABALLERO COLOR AZUL CLARO, DISE?O TIPO JASPEADO, COMPOSICION 60% POLIESTER 40%  ALGODON, CUELLO FUSIONADO CON DOBLE BOTON DE AJUSTE, PU?OS FUSIONADOS CON DOBLE BOTON DE AJUSTE, SIETE BOTONES DE AJUSTE EN COLOR NEGRO, FALDON CURVO, UN BOTON DE REPUESTO, BOLSILLO A LA ALTURA DEL PECHO LADO IZQUIERDO, SEGUN MUESTRA CV18.",693.15,693.15,110.90,804.05,,PC63,34
64,2025,81,22,244,CV11,"CAMISA DE VESTIR MANGA LARGA PARA CABALLERO COLOR AZUL GRISASEO, DISE?O JASPEADO, COMPOSICI?N 60% POLIESTER 40%  ALGOD?N, CUELLO FUSIONADO CON DOS BOTONES DE AJUSTE, PU?OS FUSIONADOS CON DOBLE BOT?N DE AJUSTE, SIETE BOTONES DE AJUSTE EN COLOR BLANCO, FALD?N CURVO,DOS BOT?NES DE REPUESTO, BOLSILLO A LA ALTURA DEL PECHO LADO IZQUIERDO, SEG?N MUESTRA CV11.",693.15,693.15,110.90,804.05,,PC64,34
65,2025,81,22,244,CV16,"CAMISA DE VESTIR MANGA LARGA PARA CABALLERO COLOR MENTA, DISE?O TIPO JASPEADO, COMPOSICION 60% POLIESTER 40%  ALGODON, CUELLO TIPO MAO, PU?OS FUSIONADOS CON DOBLE BOTON DE AJUSTE, SIETE BOTONES DE AJUSTE EN COLOR BLANCO, FALDON CURVO, UN BOTON DE REPUESTO, BOLSILLO A LA ALTURA DEL PECHO LADO IZQUIERDO, SEGUN MUESTRA CV16.",693.15,693.15,110.90,804.05,,PC65,34
66,2025,81,22,244,CV14,"CAMISA DE VESTIR MANGA LARGA PARA CABALLERO COLOR BLANCA, DISE?O A CUADROS EN COLOR LILA, COMPOSICION 60% POLIESTER 40%  ALGODON, CUELLO FUSIONADO, PU?OS FUSIONADOS CON DOBLE BOTON DE AJUSTE, SIETE BOTONES DE AJUSTE EN COLOR UVA, FALDON CURVO, DOS BOTONES DE REPUESTO, BOLSILLO A LA ALTURA DEL PECHO LADO IZQUIERDO, SEGUN MUESTRA CV14.",693.15,693.15,110.90,804.05,,PC66,34
67,2025,82,23,244,CV23,"CAMISA DE VESTIR MANGA LARGA PARA CABALLERO COLOR NEGRO, DISE?O LISO, COMPOSICI?N 60% POLIESTER 40%  ALGOD?N, CUELLO FUSIONADO CON DOS BOTONES DE AJUSTE, PU?OS FUSIONADOS CON DOBLE BOT?N DE AJUSTE, SIETE BOTONES DE AJUSTE EN COLOR NEGRO, FALD?N CURVO, DOS BOT?NES DE REPUESTO, BOLSILLO A LA ALTURA DEL PECHO LADO IZQUIERDO, SEG?N MUESTRA CV23.",693.16,693.16,110.91,804.07,,PC67,34
68,2025,82,23,244,CV25,"CAMISA DE VESTIR MANGA LARGA PARA CABALLERO COLOR BLANCO, DISE?O DE CUADROS EN COLOR AZUL MARINO, COMPOSICI?N 60% POLIESTER 40%  ALGOD?N, CUELLO FUSIONADO CON DOS BOTONES DE AJUSTE, PU?OS FUSIONADOS CON DOBLE BOT?N DE AJUSTE, SIETE BOTONES DE AJUSTE EN COLOR BLANCO, FALD?N CURVO, DOS BOT?NES DE REPUESTO, BOLSILLO A LA ALTURA DEL PECHO LADO IZQUIERDO, SEG?N MUESTRA CV25.",693.16,693.16,110.91,804.07,,PC68,34
69,2025,82,23,244,CV24,"CAMISA DE VESTIR MANGA LARGA PARA CABALLERO COLOR AZUL MARINO, DISE?O LISO, COMPOSICION 60% POLIESTER 40%  ALGODON, CUELLO FUSIONADO CON DOS BOTONES DE AJUSTE, PU?OS FUSIONADOS CON DOBLE BOTON DE AJUSTE, SIETE BOTONES DE AJUSTE EN COLOR AZUL MARINO, FALDON CURVO, DOS BOTONES DE REPUESTO, BOLSILLO A LA ALTURA DEL PECHO LADO IZQUIERDO, SEGUN MUESTRA CV24.",693.16,693.16,110.91,804.07,,PC69,34
70,2025,82,23,244,CV26,"CAMISA DE VESTIR MANGA LARGA PARA CABALLERO COLOR AZUL CIELO, ESTAMPADO A CUADROS EN COLOR CORAL AZUL MARINO, BLANCO Y SALMON, COMPOSICION 60% POLIESTER 40%  ALGODON, CUELLO FUSIONADO CON DOS BOTONES DE AJUSTE, PU?OS FUSIONADOS CON DOBLE BOTON DE AJUSTE, SIETE BOTONES DE AJUSTE EN COLOR BLANCO, FALDON CURVO, DOS BOTONES DE REPUESTO, BOLSILLO A LA ALTURA DEL PECHO LADO IZQUIERDO, SEGUN MUESTRA CV26.",693.16,693.16,110.91,804.07,,PC70,34
71,2025,83,24,244,CV36,"CAMISA DE VESTIR MANGA LARGA PARA CABALLERO COLOR BLANCO, ESTAMPADO DE LINEAS EN COLOR AZUL FRANCIA, AZUL REY  Y AZUL MARINO, COMPOSICI?N 60% POLIESTER 40%  ALGOD?N, CUELLO FUSIONADO, PU?OS FUSIONADOS CON DOBLE BOT?N DE AJUSTE, SIETE BOTONES DE AJUSTE EN COLOR AZUL FRANCIA, FALD?N CURVO, DOS BOT?NES DE REPUESTO, BOLSILLO A LA ALTURA DEL PECHO LADO IZQUIERDO, SEG?N MUESTRA CV36.",693.16,693.16,110.91,804.07,,PC71,34
