id,anio,producto_licitado_id,numero_partida,partida_especifica,clave,descripcion,precio_unitario,importe,iva,total,precio_alterno,referencia_codigo,clasificacion_principal_id
499,2025,146,87,244,CP05,"CONJUNTO DE 3 PIEZAS PARA DAMA: SACO CONFECCIONADO EN TELA  POLIESTER, FORRO POLIESTER, CUELLO TIPO MAO, COLOR GRIS OXFORD A CUADROS CONTRASTANTES, BOTON DE AJUSTE, DOS BOLSAS  AL FRENTE A LA ATURA DEL ABDOMEN, PINZAS AL FRENTE A LA ALTURA DEL PECHO,CORTE CON SILUETA. PANTALON: CONFECCIONADO EN TELA 100% P0LIESTER , COLOR GRIS OXFORD A CUADROS CONTRASTANTES, CORTE RECTO, DOS PINZAS EN LA PARTE DE ATRAS A LA ALTURA DE LA CADERA, CIERRE METALICO Y BOTON DE AUJSTE AL FRENTE. BLUSA: CONFECCIONADA EN TELA 100% POLIESTER, COLOR AZUL MARINO, CUELLO TIPO MAO CON CADENA DE AJUSTE, ESCOTE EN V, MANGA 3/4, CUATRO PINZAS AL FRENTE A LA ALTURA DE LOS HOMBROS, PLIEGUE EN LA ESPALDA. SEG?N MUESTRA CP05.",2275.47,2275.47,364.08,2639.55,,PC499,33
500,2025,84,25,244,CV45,"CAMISA DE VESTIR MANGA LARGA PARA CABALLERO COLOR BLANCO, ESTAMPADO DE LINEAS EN VERTICAL AZUL ACERO  HORIZONTAL AZUL CLARO, COMPOSICI?N 60% POLIESTER 40%  ALGOD?N, CUELLO FUSIONADO, PU?OS FUSIONADOS CON DOBLE BOT?N DE AJUSTE, SIETE BOTONES DE AJUSTE EN COLOR BLANCO, FALDON CURVO, DOS BOT?NES DE REPUESTO, BOLSILLO A LA ALTURA DEL PECHO LADO IZQUIERDO, SEG?N MUESTRA CV45.",693.16,693.16,110.91,804.07,,PC500,34
501,2025,84,25,244,CV46,"CAMISA DE VESTIR MANGA LARGA PARA CABALLERO COLOR HUESO, DISE?O LISO, COMPOSICI?N 20% POLIESTER 80%  ALGOD?N, CUELLO FUSIONADO , PU?OS FUSIONADOS CON DOBLE BOT?N DE AJUSTE, SIETE BOTONES DE AJUSTE EN COLOR BLANCO, FALDON CURVO, UN BOT?N DE REPUESTO, BOLSILLO A LA ALTURA DEL PECHO LADO IZQUIERDO, SEG?N MUESTRA CV46",693.16,693.16,110.91,804.07,,PC501,34
502,2025,84,25,244,CV49,"CAMISA DE VESTIR MANGA LARGA PARA CABALLERO COLOR VINO, DISE?O LISO, COMPOSICI?N 20% POLIESTER 80%  ALGOD?N, CUELLO FUSIONADO , PU?OS FUSIONADOS CON DOBLE BOT?N DE AJUSTE, SIETE BOTONES DE AJUSTE EN COLOR VINO, FALDON CURVO, UN BOT?N DE REPUESTO, BOLSILLO A LA ALTURA DEL PECHO LADO IZQUIERDO, SEG?N MUESTRA CV49",693.16,693.16,110.91,804.07,,PC502,34
503,2025,144,85,244,FV04,"FALDA DE VESTIR PARA DAMA COLOR AZUL MARINO, COMPOSICI?N 65% POLIESTER 35% ACRILICO, CORTE RECTO,  DOS PINZAS AL FRENTE Y ATRAS, ABERTURA TRASERA, CIERRE  DE CARRO METALICO CON BOTON PASTICO COLOR NEGRO, EN LA PARTE DE ATR?S, BOLSAS EN DIAGONALES LATERALES . SEG?N MUESTRA FV04.",462.42,462.42,73.99,536.41,,PC503,40
504,2025,148,89,244,JPC06,"JUEGO DEPORTIVO PARA CABALLERO COMPOSICI?N EN TELA 100% POLIESTER; COMPUESTO DE CHAMARRA EN COLOR AZUL MARINO CON DOS BOLSAS AL FRENTE A LA ALTURA DEL ABDOMEN TIPO CANGURO, CIERRE AL FRENTE, CON GORRO; PANTS COLOR  AZUL MARINO, DOS BOLSAS LATERALES, RESORTE EN LA CINTURA,TEJIDO EN PU?OS Y PRETINA,CORTE RECTO. SEGUN MUESTRA JPC06",1004.99,1004.99,160.80,1165.79,,PC504,37
505,2025,11,11,244,PGC01,"PANTALON DE GABARDINA PARA CABALLERO COLOR CAMEL, CONFECCIONADO EN 98% ALGOD?N 2% ELASTANO, CUATRO BOLSILLOS, DOS AL FRENTE DIAGONALES Y DOS TRASEROS TIPO OJAL, TIRO  MEDIO, CORTE RECTO, PIERNA Y VALENCIANA RELAJADA, CIERRE DE CARRO  METALICO EN BRAGUETA Y BOTON PLASTICO PARA AJUSTE, CINCO PRESILLAS. SEG?N MUESTRA PGC01",560.90,560.90,89.74,650.64,,PC505,33
506,2025,13,13,244,PGC20,"PANTALON DE GABARDINA PARA CABALLERO COLOR KHAKI, COMPOSICI?N 98% ALGOD?N 2% ELASTANO, CUATRO BOLSILLOS:  DOS AL FRENTE DIAGONALES Y DOS ATRAS TIPO OJAL CON BOTON, CIERRE DE CARRO METALICO EN BRAGUETA Y BOT?N PLASTICO PARA AJUSTE, CORTE SLIM, PIERNA Y VALENCIANA SEMI JUSTO, CINCO PRESILLAS. SEG?N MUESTRA PGC20",582.15,582.15,93.14,675.29,,PC506,33
507,2025,13,13,244,PGC21,"PANTALON DE GABARDINA PARA CABALLERO COLOR NEGRO, COMPOSICI?N 98% ALGOD?N 2% ELASTANO, CUATRO BOLSILLOS:  DOS AL FRENTE DIAGONALES Y DOS ATRAS TIPO OJAL CON BOTON, CIERRE DE CARRO METALICO EN BRAGUETA Y BOT?N PLASTICO PARA AJUSTE, CORTE SLIM, PIERNA Y VALENCIANA SEMI JUSTO, CINCO PRESILLAS. SEG?N MUESTRA PGC21",582.15,582.15,93.14,675.29,,PC507,33
508,2025,154,95,244,PLC09,"PLAYERA TIPO POLO PARA CABALLERO COLOR MARINO, COMPOSICI?N EN 50% ALGOD?N 50% POLIESTER, MANGA CORTA, 3 BOTONES AL FRENTE, CUELLO Y PU?OS TEJIDOS CON DETALLES EN COLOR MARINO, DISE?O BORDADO EN EL PECHO IZQUIERDO COLOR BLANCO. SEG?N MUESTRA PLC09.",294.45,294.45,47.11,341.56,,PC508,36
509,2025,154,95,244,PLC07,"PLAYERA TIPO POLO PARA CABALLERO COLOR BLANCA, COMPOSICI?N EN 50% ALGOD?N 50% POLIESTER, MANGA CORTA, 3 BOTONES AL FRENTE, CUELLO Y PU?OS TEJIDOS CON DETALLES EN COLOR BLANCO. SEG?N MUESTRA PLC07.",294.45,294.45,47.11,341.56,,PC509,36
510,2025,1,1,244,PMC01,"PANTALON DE MEZCLILLA PARA CABALLERO COLOR AZUL CLARO JASPEADO, COMPOSICION 100% ALGODON ,CUATRO BOLSILLOS:  TRES AL FRENTE Y DOS ATRAS, CINTURA MEDIA, CIERRE DE CARRO METALICO EN BRAGUETA Y BOTON METALICO PARA AJUSTE, CORTE RECTO, SEIS PRESILLAS. SEGUN MUESTRA PMC01.",598.55,598.55,95.77,694.32,,PC510,33
511,2025,10,10,244,PMD30,"PANTALON DE MEZCLILLA PARA DAMA INDIGO OBSCURO, CONFECCIONADO EN 62% ALGOD?N, 32% POLIESTER, 4% RAYON, 2% ELASTANO, CINCO BOLSILLOS: TRES AL FRENTE Y DOS ATRAS, TIRO ALTO, CIERRE DE CARRO METALICO EN BRAGUETA Y BOT?N METALICO PARA AJUSTE, CORTE SKINNY, PUSH UP, PIERNA Y VALENCIANA JUSTA, CON REMACHES METALICOS EN LOS BOLSILLOS DELANTEROS, CINCO PRESILLAS, SEG?N MUESTRA PMD30.",563.18,563.18,90.11,653.29,,PC511,33
512,2025,10,10,244,PMD33,"PANTALON DE MEZCLILLA PARA DAMA COLOR STONE, CONFECCIONADO EN 74% ALGOD?N, 23% POLIESTER, 3% ELASTANO, CINCO BOLSILLOS: TRES AL FRENTE Y DOS ATRAS, TIRO MEDIO, CIERRE DE CARRO METALICO EN BRAGUETA Y BOT?N METALICO PARA AJUSTE, CORTE SKINNY, PUSH UP, PIERNA Y VALENCIANA JUSTA, CON REMACHES METALICOS EN LOS BOLSILLOS DELANTEROS, CINCO PRESILLAS, SEG?N MUESTRA PMD33.",563.18,563.18,90.11,653.29,,PC512,33
513,2025,10,10,244,PMD32,"PANTALON DE MEZCLILLA PARA DAMA COLOR INDIGO, CONFECCIONADO EN 74% ALGOD?N, 23% POLIESTER, 3% ELASTANO, CINCO BOLSILLOS: TRES AL FRENTE Y DOS ATRAS, TIRO MEDIO, CIERRE DE CARRO METALICO EN BRAGUETA Y BOT?N METALICO PARA AJUSTE, CORTE SKINNY, PUSH UP, PIERNA Y VALENCIANA JUSTA, CON REMACHES METALICOS EN LOS BOLSILLOS DELANTEROS, CINCO PRESILLAS, SEG?N MUESTRA PMD32.",563.18,563.18,90.11,653.29,,PC513,33
514,2025,113,54,244,ZC13,"ZAPATO DE VESTIR PARA CABALLERO COLOR NEGRO,CORTE VACUNO ACABADO PIEL LISA,FORRO TEXTIL,SUELA SINTETICA COLOR NEGRO,OCHO OJILLOS PERFORADOS,AJUSTE DE AGUJETA COLOR NEGRO ,DETALLE DE PERFORACIONES EN LATERALES Y EMPEINE,PESPUNTES VISIBLES,PUNTA REDONDA,SEG?N MUESTRA ZC13.",951.26,951.26,152.20,1103.46,,PC514,31
515,2025,113,54,244,ZC10,"ZAPATO DE VESTIR PARA CABALLERO COLOR NOGAL, CORTE VACUNO ACABADO PIEL LISO, FORRO TEXTIL, SUELA SINTETICA COLOR NEGRO PLANTILLA DE RES, OCHO OJILLOS PERFORADOS, AJUSTE DE AGUJETAS COLOR CAFE OSCURO,DETALLES DE ORIFICIOS EN LATERALES Y PUNTA, PESPUNTES VISIBLES,PUNTA OVALADA CON DETALLES, SEG?N MUESTRA ZC10.",951.26,951.26,152.20,1103.46,,PC515,31
516,2025,119,60,244,ZD04,"ZAPATO DE VESTIR PARA DAMA TIPO MOCASIN COLOR NEGRO, CORTE BOVINO ACABADO PIEL LISA, FORRO TEXTIL ACOJINADO, SUELA SINTETICA  COLOR NEGRO,HEBILLA METALICA EN EMPEINE, PESPUNTES VISIBLES,PUNTERA REDONDA.SEG?N MUESTRA ZD04.",825.98,825.98,132.16,958.14,,PC516,31
517,2025,41,120,246,AC07,"RESPIRADOR MEDIA CARA DE UN FILTRO, PARA PROTECCI?N MULTIGAS/VAPORES ORG?NICOS, BANDA EL?STICA AJUSTABLE, NO INCLUYE CARTUCHO. DEBE CUMPLIR CON LA NORMA NOM-116-STPS. SEG?N MUESTRA AC07",176.99,176.99,28.32,205.31,,PC517,50
518,2025,69,148,246,AC17,"GUANTES UNITALLA EN COLOR BLANCO, FABRICADOS EN ALGOD?N CON APLICACIONES DE PUNTOS NEGROS DE PVC, TEJIDO EL?STICO EN MU?ECA. SEG?N  MUESTRA AC17.",54.78,54.78,8.76,63.54,,PC518,44
519,2025,139,80,244,BD10,"BOTA PARA DAMA COLOR NEGRO, CORTE VACUNO ACABADO PIEL CRAZY, FORRO TEXTIL ACOJINADO, SUELA SINTETICA COLOR CAF?, BULLON GAMUZA, DIEZ OJILLOS METALICOS,AGUJETA COLOR NEGRO CON GRIS, GRABADO DE LOGO EN PARTE EXTERIOR. SEG?N MUESTRA BD010",945.14,945.14,151.22,1096.36,,PC519,30
520,2025,141,82,244,BD22,"BOTA PARA DAMA COLOR NEGRO, CORTE VACUNO ACABADO PIEL LISA, FORRO TEXTIL ACOJINADO, SUELA SINTETICA COLOR NEGRO,DIEZ OJILLOS PERFORADOS,CUATRO GANCHOS METALICOS, AJUSTE DE AGUJETA COLOR NEGRO,BULLON ALCOLCHADO CON CINTA PARA FACILITAR EL CALZADO,CON UN CIERRE EN LATERAL INTERNO, PESPUNTES VISIBLES, GRABADO DE LOGO EN PARTE EXTERIOR. SEG?N MUESTRA BD22",918.48,918.48,146.96,1065.44,,PC520,30
521,2025,87,28,244,BV01,"BLUSA DE VESTIR PARA DAMA, SIN MANGA, COLOR LIMON, CONFECCIONADA EN TELA 100% POLIESTER , CUELLO REDONDO, DOS BOTONES DE AJUSTE EN  LA ESPALDA A LA ALTURA DEL CUELLO EN COLOR PLATA, CINTA Y RESORTE EN LA PARTE INFERIOR PARA JUSTE. SEG?N MUESTRA BV01.",715.37,715.37,114.46,829.83,,PC521,35
522,2025,87,28,244,BV03,"BLUSA DE VESTIR PARA DAMA, SIN MANGAS, COLOR HUESO ESTAMPADO FLORAL,  CUELLO REDONDO, CON AVERTURA EN ESPALDA, DOS BOTONES DE AJUSTE COLOR HUESO, FALDON CURVO, OLIEGUES EN CUELLO, SEG?N MUESTRA BV03.",715.37,715.37,114.46,829.83,,PC522,35
523,2025,89,30,244,BV28,"BLUSA DE VESTIR PARA DAMA MANGA LARGA, COLOR NEGRO Y BLANCO, CONFECCIONADA EN TELA 100%  POLIESTER, CUELLO TIPO SPORT, ESCOTE EN V, CINCO BOTONES DE AJUSTE AL FRENTE  COLOR PLATA, PU?OS FUSIONADOS CON UN BOTON DE AJUSTE, FALDON CURVO.SEG?N MUESTRA BV28.",697.99,697.99,111.68,809.67,,PC523,35
524,2025,93,34,244,BV75,"BLUSA DE VESTIR PARA DAMA, MANGA 3/4 COLOR MIL RAYAS VERDE MENTA, CON DETALLES DE LINEAS  BLANCO EN CUELLO Y PU?OS, CONFECCIONADA EN TELA 75% POLIESTER, 25% ALGOD?N, CUELLO FUSIONADO, ECOTE EN V, SIETE BOTONES DE AJUSTE AL FRENTE COLOR AZUL,  Y BOTON DE REPUESTO,  DOS PINZAS AL FRENTE Y DOS EN ESPALDA,, CORTE CON SILUETA, FALDON CURVO,  ABERTURA EN LATERALES. SEG?N MUESTRA, BV75",697.99,697.99,111.68,809.67,,PC524,35
525,2025,103,44,244,CHALC03,"CHALECO PARA CABALLERO DOBLE VISTA COLOR AZUL MARINO Y CAFE OBSCURO, CONFECCIONADO EN TELA  100% POLIESTER, FORRO P?LIESTER, CAPITONADO DE CUADROS , CUELLO ALTO, DOS BOLSILLOS AL FRENTE CON CIERRE A LA ALTURA DEL ABDOMEN, CIERRE DE CARRO METALICO AL FRENTE.DOS BOLSILLOS INTERNOS A LA ALTURA DEL ABDO3.",795.50,795.50,127.28,922.78,,PC525,38
526,2025,152,93,244,FL01,"FILIPINA PARA CABALLERO MANGA CORTA COLOR ARENA, COMPOSICI?N 65% POLIESTER 35% ACRILICO, CUELLO TIPO SPORT, CIERRE DE CARRO METALICO AL FRENTE, DOS BOLSAS AL FRENTE A LA ALTURA DEL ABDOMEN, DOS PINZAS EN LA PARTE DE ATR?S, DOS ABERTURAS EN LATERALES. SEG?N MUESTRA FL01.",327.07,327.07,52.33,379.40,,PC526,52
527,2025,14,14,244,PGC25,"PANTALON DE GABARDINA PARA CABALLERO COLOR AZUL MARINO, COMPOSICION 100% ALGOD?N , CINCO BOLSILLOS: TRES AL FRENTE Y DOS ATRAS, CORTE RECTO, CINTURA ALTA, PIERNA Y VALENCIANA RELAJADA, CIERRE DE CARRO METALICO EN BRAGUETA Y BOT?N METALICO PARA AJUSTE, CINCO PRESILLAS, REMACHES METALICOS EN BOLSILLOS DELANTEROS. SEG?N MUESTRA PGC25",563.46,563.46,90.15,653.61,,PC527,33
528,2025,9,9,244,PMD14,"PANTALON DE MEZCLILLA PARA DAMA COLOR INDIGO CLARO, COMPOSICION 65.5% ALGODON 28.1% POLIESTER 3.1% VISCOSA 3.3% ELASTANO, CINCO BOLSILLOS: TRES AL FRENTE Y ATRAS, CINTURA ALTA, CIERRE DE CARRO METALICO EN BRAGUETA Y TRES BOTONES METALICOS PARA AJUSTE, CORTE SUPER SKINNY, CON REMACHES METALICOS EN LOS BOLSILLOS DELANTEROS, PRETINA ANCHA, PIERNA AJUSTADA, SEIS PRESILLAS, CON SISTEMA PUSH UP. SEGUN MUESTRA PMD14.",559.94,559.94,89.59,649.53,,PC528,33
529,2025,9,9,244,PMD18,"PANTALON DE MEZCLILLA PARA DAMA COLOR INDIGO, COMPOSICION 65.4% ALGODON 28% POLIESTER 3.4% VISCOSA 3.2% ELASTANO, CINCO BOLSAS: TRES AL AFRENTE Y DOS ATRAS, CIERRE DE CARRO METALICO EN BRAGUETA Y BOTONMETALICO PARA AJUSTE, CORTE SKINNY, TIRO MEDIO, PIERNA Y VALENCIANA SEMI AJUSTADA, CON REMACHES EN BOLSILLOS DELANTEROS, CINCO PRESILLAS, SEGUN MUESTRA PMD18.",559.94,559.94,89.59,649.53,,PC529,33
530,2025,10,10,244,PMD28,"PANTALON DE MEZCLILLA PARA DAMA AZUL CLARO, CONFECCIONADO EN 70% ALGOD?N, 28% POLIESTER, 2% ELASTANO, CINCO BOLSILLOS: TRES AL FRENTE Y DOS ATRAS, TIRO ALTO, CIERRE DE CARRO METALICO EN BRAGUETA Y BOT?N METALICO PARA AJUSTE, CORTE SKINNY, PUSH UP, PIERNA Y VALENCIANA JUSTA, CON REMACHES METALICOS EN  LOS BOLSILLOS DELANTEROS, CINCO PRESILLAS, SEG?N MUESTRA PMD28.",563.18,563.18,90.11,653.29,,PC530,33
531,2025,112,53,244,ZC02,"ZAPATO DE VESTIR PARA CABALLERO COLOR CAFE, CORTE VACUNO ACABADO PIEL TEXTURIZADA, FORRO TEXTIL, SUELA SINTETICA COLOR CAFE OSCURO,  PLANTILLA DE CERDO,  OCHO OJILLOS METALICOS COLOR BRONCE, AJUSTE DE AGUJETAS COLOR CAFE OSCURO, PESPUNTES VISIBLES,PUNTA LIGERAMNET CUADRADA, SEG?N MUESTRA ZC02",946.76,946.76,151.48,1098.24,,PC531,31
532,2025,131,72,244,BC15,"BOTA PARA CABALLERO COLOR CAFE, CORTE VACUNO, ACABADO PIEL LISA CON DETALLES TEXTILES EN EMPEINE Y LATERALES, FORRO TEXTIL, SUELA SINTETICA COLOR CAFE,SEIS CINTAS TEXTILES PARA AJUSTE,  CUATRO HERRAJES METALICOS, BULLON SUPERIOR SINTETICO ACABADO TEXTURIZADO, CON CINTA PARA FACILITAR CALZADO, AJUSTE DE AGUJETA COLOR NEGROY GRIS, PESPUNTES VISIBLES, GRABADO DE LOGO EN LA PARTE EXTERIOR,SEGUN MUESTRA BC15.",1214.49,1214.49,194.32,1408.81,,PC532,30
533,2025,142,83,244,BD36,"BOTA PARA DAMA COLOR NEGRO, CORTE VACUNO ACABADO PIEL TEXTURIZADA, FORRO TEXTIL ACOJINADO, SUELA SINTETICA COLOR NEGRO, AJUSTE DE CIERRE EN LATERAL INTERIOR,RESORTE DE AJUSTE EN TOBILLO, ADORNO DE CINTA CON BROCHE METALICO COLOR NEGROL, PESPUNTES VISIBLES, GRABADO DE LOGO EN LA PARTE EXTERIOR, SEGUN MUESTRA BD36",902.50,902.50,144.40,1046.90,,PC533,30
534,2025,142,83,244,BD34,"BOTA PARA DAMA COLOR CAFE VIEJO, CORTE VACUNO, ACABADO PIEL LISA,  FORRO TEXTIL ACOJINADO, SUELA SINTETICA COLOR BEIGE, OCHO OJILLOS METALICOS  Y DOS HERRAJES METALICOS , CIERRE EN LATERAL INTERNO, AHUJETA COLOR CAF?, BULLON ACABADO NOBUCK, ETIQUETA DE LOGO EN LA PARTE EXTERIOR, PESPUNTES VISIBLES. SEG?N MUESTRA BD34",902.50,902.50,144.40,1046.90,,PC534,30
535,2025,105,46,244,CHALC13,"CHALECO PARA CABALLERO COLOR AZUL ACERO, FORRO POLIESTER AFELPADO, CONFECCIONADO EN TELA 100% POLIESTER, BOLSAS AL FRENTE A LA ALTURA DEL ABDOMEN, CUELLO ALTO, CIERRE DE CARRO METALICO ALFRENTE, REPELENTE AL AGUA. SEG?N MUESTRA CHALC13",836.05,836.05,133.77,969.82,,PC535,38
536,2025,9,9,244,PMD13,"PANTALON DE MEZCLILLA PARA DAMA COLOR AZUL STONE, COMPOSICION 65.5% ALGODON 28.1% POLIESTER 3.1% VISCOSA 3.3% ELASTANO, CINCO BOLSILLOS: TRES AL FRENTE Y ATRAS, CINTURA ALTA, CIERRE DE CARRO METALICO EN BRAGUETA Y TRES BOTONES METALICOS PARA AJUSTE, CORTE SUPER SKINNY, CON REMACHES METALICOS EN LOS BOLSILLOS DELANTEROS, PRETINA ANCHA, PIERNA AJUSTADA, SEIS PRESILLAS, CON SISTEMA PUSH UP. SEGUN MUESTRA PMD13",559.94,559.94,89.59,649.53,,PC536,33
537,2025,107,48,244,CHALD15,"CHALECO PARA DAMA COLOR MARINO, CONFECCIONADO EN TELA 100% POLIESTER, FORRO POLIESTER, CAPITONADO EN PETALOS, CUELLO ALTO, CIERRE DE CARRO METALICO AL FRENTE , DOS BOLSILLOS AL FRENTE CON CIERRE A LA ALTURA DEL ABDOMEN, BOLSA INTERNA OCULTA EN AMBOS LADOS. SEG?N MUESTRA CHALD15",821.01,821.01,131.36,952.37,,PC537,38
538,2025,6,6,244,PMC29,"PANTALON DE MEZCLILLA PARA CABALLERO COLOR INDIGO, CONFECCIONADO EN TELA 100% ALGOD?N, CINCO BOLSILLOS: TRES AL FRENTE Y DOS ATR?S, CIERRE DE CARRO METALICO EN BRAGUETA Y BOTON METALICO PARA AJUSTE, CORTE RECTO, CINTURA ALTA, PIERNA RELAJADA, VALENCIANA PARA BOTA  YCINCO PRESILLAS. SEG?N MUESTRA PMC29.",566.70,566.70,90.67,657.37,,PC538,30
539,2025,117,58,244,ZC42,"ZAPATO DE VESTIR PARA CABALLERO COLOR NEGRO CORTE SINTETICO ACABADO TEXTURIZADO, FORRO TEXTIL, SUELA SINTETICA COLOR BLANCO,SEIS OJILLOS PERFORADOS Y DOS OJILLOS METALICOS COLOR NEGRO, AJUSTE DE AGUJETAS COLOR NEGRO, PESPUNTES VISIBLES,DETALLE TEXTURIZADO AL FRENTE,PUNTERA REDONDA, SEG?N MUESTRA ZC42",928.72,928.72,148.60,1077.32,,PC539,31
540,2025,57,136,246,AC132,"CONJUNTO IMPERMEABLE DE DOS PIEZAS COLOR NARANJA, IMPERMEABLE DE DOS PIEZAS: CHAMARRA QUE INCLUYE AJUSTE CON CORD?N, CIERRE TIPO ZIPPER REFORZADO DE PL?STICO, SOLAPA CON CUATRO BROCHES DE AJUSTE A PRESI?N, CAPUCHA, PANTAL?N CON AJUSTE EL?STICO EN LA CINTURA,  AJUSTE DE BROCHES EN MU?ECAS Y PIERNAS, REFLEJANTES DE 2""/5 CM PLASTIFICADOS EN BRAZOS Y PIERNAS.. SEG?N MUESTRA AC132.",213.43,213.43,34.15,247.58,,PC540,37
541,2025,34,113,246,AC24,"GOGGLES DE SEGURIDAD DE VISI?N PANOR?MICA O PERIF?RICA, MICA TRASPARENTE DE POLICARBONATO CON PROTECCI?N UV Y ANTIRAYADURA, AJUSTADOR EL?STICO, ARMAZ?N SUAVE Y FLEXIBLE, DEBE CUMPLIR CON LA NORMA ANSI Z87.1. SEG?N MUESTRA AC24.",273.93,273.93,43.83,317.76,,PC541,56
542,2025,132,73,244,BC29,"BOTA PARA CABALLERO COLOR NEGRO, ACABADO LISO, CORTE SINTETICO, FORRO SINTETICO, SUELA SINTETICA COLOR NEGRO, SIN BULL?N,CINTA PARA FACILITAR EL CALZADO, DOCE OJILLOS PERFORADOS, AJUSTE DE AGUJETA EN COLOR NEGRO, PESPUNTES VISIBLES,  ETIQUETA CON LOGO EN LATERAL EXTERIOR. SEGUN MUESTRA BC29.",1106.71,1106.71,177.07,1283.78,,PC542,30
543,2025,133,74,244,BC31,"BOTA PARA CABALLERO COLOR NEGRO, ACABADO TEXTURIZADO,CORTE VACUNO, FORRO TEXTIL ACOJINADO, SUELA SINTETICA, SIN BULL?N,  CINTA PARA FACILITAR EL CALZADO, LATERALES INTERIORES CON ELASTICOS PARA AJUSTE EN COLOR NEGRO, LATERALES EXTERIORES CON DOS CIERRES COLOR NEGRO Y GRABADO TIPO NUCA DE COCODRILO, PESPUNTES VISIBLES. SEGUN MUESTRA BC31",1214.49,1214.49,194.32,1408.81,,PC543,30
544,2025,136,77,244,BC45,"BOTA PARA CABALLERO COLOR NEGRO, ACABADO PIEL LISA, CORTE VACUNO, FORRO TEXTIL, SUELA SINTETICA COLOR NEGRO, CON BULL?N ACOJINADO, OCHO OJILLOS PERFORADOS, CUATRO GANCHOS PLASTICOS, AJUSTE DE AGUJETA COLOR NEGRO CON AMARILLO, FORRO INTERIOR ACOJINADO, PESPUNTES VISIBLES, GRABADO DE LOGO EN PARTE EXTERIOR, CASQUILLO POLIMERO, DIELECTRICAS, LIJERAS RECISTENTE A IMPACTOS NOM 113-STPS- II . SEGUN MUESTRA BC45.",1214.49,1214.49,194.32,1408.81,,PC544,30
545,2025,137,78,244,BD04,"BOTA PARA DAMA COLOR ARENA, CORTE SINTETICO, ACABADO SINTETICO, SUELA SINTETICA COLOR HUESO, BULLON SINTENTICO , ACABADO PIEL TEXTURIZADA, CON CINTA PARA FRACILIATAR EL CALZADO, DIEZ HERRAJES METALICOS, CUATRO GANCHOS METALICOS, AJUSTE DE AGUJETA COLOR  BLANCO, PESPUNTES VISIBLES, GRABADO DE LOGO EN LA PARTE EXTERIOR. SEG?N MUESTRA BD04",1063.88,1063.88,170.22,1234.10,,PC545,30
546,2025,138,79,244,BD06,"BOTA PARA DAMA COLOR NEGRO, CORTE SINTETICO ACABADO LISO, FORRO TEXTIL, SUELA SINTETICA COLOR GRIS Y NEGRO, BULLON TEXTIL , DIEZ OJILLOS METALICOS COLOR NATURAL  Y CUATRO GANCHOS METALICOS,  AGUJETA COLOR NEGRO, PESPUNTES VISIBLES,GRABADO DE LOGO EN LA PARTE EXTERIOR. SEG?N MUESTRA BD06",865.98,865.98,138.56,1004.54,,PC546,30
547,2025,139,80,244,BD11,"BOTA PARA DAMA COLOR MIEL, CORTE  VACUNO PIEL LISA, FORRO TEXTIL ACOJINADO, SUELA SINTETICA COLOR BEIGE, BULL?N PIEL ACABADO  LISO COLOR CAFE, DOCE OJILLOS COLOR BRONCE, AGUJETA COLOR CAF? OSCURO, PESPUNTES VISIBLES, GRABADO DE LOGO EN PARTE EXTERIOR. SEG?N MUESTRA BD11",945.14,945.14,151.22,1096.36,,PC547,30
548,2025,140,81,244,BD14,"BOTA PARA DAMA COLOR BRONCE, CORTE VACUNO ACABADO PIEL NOBUCK, FORRO TEXTIL ACOJINADO, SUELA SINTETICA COLOR CHOCOLATE, OCHO OJILLOOS METALICOS, DOS HERRAJES METALICOS,BULLON PIEL LISA,  CON CINTA PARA FACILITAR EL CALZADO, PESPUNTES VISIBLES, GRABADO DE LOGO EN PARTE EXTERIOR. SEG?N MUESTRA BD14",1019.69,1019.69,163.15,1182.84,,PC548,30
549,2025,89,30,244,BV26,"BLUSA DE VESTIR PARA DAMA, MANGA LARGA, COLOR BLANCO LISA, CONFECCIONADA EN TELA 100% POLIESTER, TERMINADA CON BIES RAYAS EN COLOR GRIS AL FRENTE , CUELLO TIPO SPORT, CINCO BOTONES  DE AUSTE  AL FRENTE, PU?OS FUSIONADOS CON UN BOTON DE AJUSTE,  FALDON CURVO. SEGUN MUESTRA BV26.",697.99,697.99,111.68,809.67,,PC549,35
550,2025,90,31,244,BV48,"BLUSA DE VESTIR PARA DAMA MANGA LARGA,EN COLOR BLANCO, CON CUADROS EN COLOR UVA, COMPOSICI?N 57%POLIESTER,43%ALGODON, CUELLO TIPO SPORT  FUSIONADO, SIETE BOTONES DE AJUSTE EN COLOR UVA/BLANCO, PU?OS FUSIONADOS CON DOBLE BOT?N DE AJUSTE,DOS PINZAS A LA ALTURA DEL PECHO,DOS PINZAS EN LA PARTE DELANTERA Y TRASERA PARTE BAJA, PINZAS EN MANGAS. SEGUN MUESTRA BV48.",696.06,696.06,111.37,807.43,,PC550,35
551,2025,107,48,244,CHALD10,"CHALECO PARA DAMA COLOR MARINO, CONFECCIONADO EN TELA 100%  POLIESTER, FORRO POLIESTER AFELPADO, CAPITONADO HORIZONTAL, BOLSAS AL FRENTE A LA ALTURA DEL ABDOMEN, CIERRE DE CARRO METALICO ALFRENTE, CUELLO ALTO,SEGUN MUESTRA CHALD10",821.01,821.01,131.36,952.37,,PC551,38
552,2025,80,21,244,CV07,"CAMISA DE VESTIR MANGA LARGA PARA CABALLERO COLOR BLANCA, DISE?O LINEAS EN ZIG ZAG COLOR AZUL MARINO, COMPOSICI?N 60% POLIESTER 40%  ALGOD?N , CUELLO FUSIONADO , PU?OS FUSIONADOS CON DOBLE BOT?N DE AJUSTE, SIETE BOTONES DE AJUSTE EN COLOR BLANCO, FALD?N CURVO,DOS BOT?NES DE REPUESTO, BOLSILLO A LA ALTURA DEL PECHO LADO IZQUIERDO, SEG?N MUESTRA CV07.",693.16,693.16,110.91,804.07,,PC552,34
553,2025,80,21,244,CV09,"CAMISA DE VESTIR MANGA LARGA PARA CABALLERO COLOR SALMON, DISE?O JASPEADO, COMPOSICI?N 60% POLIESTER 40%  ALGOD?N, CUELLO FUSIONADO CON DOS BOTONES DE AJUSTE, PU?OS FUSIONADOS CON DOBLE BOT?N DE AJUSTE, SIETE BOTONES DE AJUSTE EN COLOR BLANCO, FALD?N CURVO,DOS BOT?NES DE REPUESTO, BOLSILLO A LA ALTURA DEL PECHO LADO IZQUIERDO, SEG?N MUESTRA CV09.",693.16,693.16,110.91,804.07,,PC553,34
554,2025,81,22,244,CV17,"CAMISA DE VESTIR MANGA LARGA PARA CABALLERO COLOR GRIS, DISE?O TIPO JASPEADO, COMPOSICION 60% POLIESTER 40%  ALGODON, CUELLO FUSIONADO CON DOBLE BOTON DE AJUSTE, PU?OS FUSIONADOS CON DOBLE BOTON DE AJUSTE, SIETE BOTONES DE AJUSTE EN COLOR BLANCO, FALDON CURVO, DOS BOTONES DE REPUESTO, BOLSILLO A LA ALTURA DEL PECHO LADO IZQUIERDO, SEGUN MUESTRA CV17.",693.15,693.15,110.90,804.05,,PC554,34
555,2025,83,24,244,CV40,"CAMISA DE VESTIR MANGA LARGA PARA CABALLERO COLOR MARRON, ESTAMPADO DE EXAGONOS, DIAMANTES  Y PUNTOS EN COLOR BLANCO, COMPOSICI?N 60% POLIESTER 40%  ALGOD?N, CUELLO FUSIONADO CON DOS BOTONES DE AJUSTE, PU?OS FUSIONADOS CON DOBLE BOT?N DE AJUSTE, SIETE BOTONES DE AJUSTE EN COLOR VINO, FALD?N CURVO, DOS BOT?NES DE REPUESTO, BOLSILLO A LA ALTURA DEL PECHO LADO IZQUIERDO, SEG?N MUESTRA CV40.",693.16,693.16,110.91,804.07,,PC555,34
556,2025,149,90,244,JPD01,"JUEGO DEPORTIVO PARA DAMA EN COLOR AZUL REY OSCURO,, CONFECCIONADO EN TELA 100% POLIESTER; CHAMARRA CON DOS BOLSILLOS AL FRENTE TIPO CANGURO, CIERRE AL FRENTE,GORRO,PANTS COLOR AZUL REY OSCURO, AJUSTE ELASTICO EN CINTURA, DOS BOLSAS LATERALES. SEG?N MUESTRA JPD01",1050.37,1050.37,168.06,1218.43,,PC556,37
557,2025,4,4,244,PMC16,"PANTALON DE MEZCLILLA PARA CABALLERO COLOR STONE, COMPOSICION 99% ALGODON,1% ELASTANO, CINCO BOLSILLOS: TRES AL FRENTE Y DOS ATRAS, CORTE RECTO, TIRO MEDIO, VALENCIANA RELAJADA, PIERNA RELAJADA, CIERRE DE CARRO METALICO EN BRAGUETA, UN BOTON METALICO PARA AJUSTE, REMACHES METALICOS EN BOLSILLOS DELANTEROS, CINCO PRESILLAS. SEGUN MUESTRA PMC16.",598.55,598.55,95.77,694.32,,PC557,33
558,2025,10,10,244,PMD25,"PANTALON DE MEZCLILLA PARA DAMA COLOR AZUL CLARO, CONFECCIONADO EN 62% ALGOD?N, 32% POLIESTER, 4% RAYON, 2% ELASTANO, CINCO BOLSILLOS TRES AL FRENTE Y DOS ATRAS, CINTURA MEDIA, CIERRE DE CARRO METALICO EN BRAGUETA Y BOT?N METALICO PARA AJUSTE, CORTE RECTO, PUSH UP, PIERNA Y VALENCIANA RECTO, CON REMACHES METALICOS EN  LOS BOLSILLOS DELANTEROS, CINCO PRESILLAS, SEG?N MUESTRA PMD25.",563.18,563.18,90.11,653.29,,PC558,33
559,2025,125,66,244,TC10,"TENIS PARA CABALLERO COLOR BLANCO, CORTE SINTETICO, FORRO TEXTIL, SUELA SINTETICA COLOR BLANCO, DOCE OJILLOS METALICOS BLANCOS, AJUSTE DE AGUJETA COLOR BLANCO, INTERIOR ACOJINADO, PESPUNTES VISIBLES, GRABADO DE LOGO EN LA PARTE EXTERIOR. SEG?N MUESTRA TC10.",894.47,894.47,143.12,1037.59,,PC559,56
560,2025,133,74,244,BC33,"BOTA PARA CABALLERO COLOR NEGRO, CORTE VACUNO,ACABADO  PIEL TEXTURIZADA, FORRO TEXTIL ACOJINADO, SUELA SINTETICA COLOR NEGRO,  BULLON ACABADO TEXTURIZADO, CINTA PARA FACILITAR EL CALZADO,CATORCE OJILLOS METALICOS, AJUSTE  DE AGUJETA EN COLOR NEGRO, GRABADO DE LOGO EN LA PARTE EXTERIOR, PESPUNTES VISIBLES. SEGUN MUESTRA BC33.",1214.49,1214.49,194.32,1408.81,,PC560,30
561,2025,141,82,244,BD23,"BOTA PARA DAMA COLOR CAFE, CORTE VACUNO ACABADO PIEL LISA, FORRO TEXTIL, SUELA SINTETICA CAF? OBSCURO,DIEZ OJILLOS PERFORADOS,CUATRO GANCHOS METALICOS, AJUSTE DE AGUJETA COLOR CAFE,BULLON ACOLCHADO CON CINTA PARA FACILITAR EL CALZADO,CON UN CIERRE EN LATERAL INTERNO, PESPUNTES VISIBLES, GRABADO DE LOGO EN PARTE EXTERIOR. SEG?N MUESTRA BD23",918.48,918.48,146.96,1065.44,,PC561,30
562,2025,141,82,244,BD24,"BOTA PARA DAMA COLOR CAF? ,CORTE VACUNO ACABADO PIEL LISA, FORRO TEXTIL, SUELA SINTETICA CAF? ,CON AJUSTE DE RESORTE EN LATERALES Y TOBILLO, CON CINTA PARA FACILITAR EL CALZADO,  SIN BULLON, GRABADO DE LOGO EN PARTE EXTERIOR.SEG?N MUESTRA BD24",918.48,918.48,146.96,1065.44,,PC562,30
563,2025,143,84,244,BD38,"BOTA PARA DAMA COLOR NEGRO,  CORTE VACUNO, ACABADO PIEL VISALT, FORRO TEXTIL ACOJINADO, SUELA SINTETICA COLOR NEGRO, AJUSTE DE CIERRE EN LATERAL INTERIOR, AJUSTE DE RESORTE EN LATERAL EXTERIOR, SIN BULLON, CON CINTA PARA FACILITAR EL CALZADO, PESPUNTES VISIBLES, SEGUN MUESTRA BD38",1011.08,1011.08,161.77,1172.85,,PC563,30
564,2025,88,29,244,BV12,"BLUSA DE VESTIR PARA DAMA SIN MANGA  COLOR ROSA, DISE?O LISO, CONFECCIONADA EN TELA 100% POLIESTER, CUELLO TIPO SPORT FUSIONADO ,SIETE BOTONES DE AJUSTE AL FRENTE COLOR  ROSA/ PLATA, DOS PINZAS AL FRENTE CON CINTA DECORATIVA, DOS PINZAS TRASERAS. SEG?N MUESTRA BV12.",676.75,676.75,108.28,785.03,,PC564,35
565,2025,90,31,244,BV32,"BLUSA DE VESTIR PARA DAMA MANGA 3/4 ESTAMPADO COLOR REY/BLANCO, CONFECCIONADA EN TELA 100% POLIESTER,ESCOTE EN ""V"" CON DETALLE DE CINTA DECORATIVA CON DOS OJILLOS METALICOS COLOR PLATA , SEG?N MUESTRA BV32",696.06,696.06,111.37,807.43,,PC565,35
566,2025,90,31,244,BV35,"BLUSA DE VESTIR PARA DAMA MANGA LARGA COLOR  BLANCO  CON LINEAS VERTICALES COLOR GRIS,  CONFECCIONADA EN TELA 100% POLIESTER, CUELLO REDONDO,PU?O FUCIONADO, CON BOTON DE AJUSTE COLOR PLATA, PLIEGUES EN MANG, DOS PINZAS A LA ALTURA DEL PECHO SEG?N MUESTRA BV35",696.06,696.06,111.37,807.43,,PC566,35
