id,anio,producto_licitado_id,numero_partida,partida_especifica,clave,descripcion,precio_unitario,importe,iva,total,precio_alterno,referencia_codigo,clasificacion_principal_id
145,2025,131,72,244,BC18,"BOTA PARA CABALLERO COLOR CAFE, CORTE SINTETICO FORRO TEXTIL, SUELA SINTETICA COLOR CAFE, SEIS CINTAS TEXTILES PARA AJUSTE,CUATRO GANCHOS METALICOS, AJUSTE DE AGUJETAS COLOR NEGRO Y BLANCO, BULLON SUPERIOR SINTETICO, ACABADO TEXTURIZADO CON CINTA PARA FACILITAR CALZADO, PESPUNTES VISIBLES, FORRO INTERIOR ACOJINADO, GRABADO DE LOGO EN LA PARTE EXTERIOR.SEG?N MUESTRA BC18",1214.49,1214.49,194.32,1408.81,,PC145,30
146,2025,135,76,244,BC44,"BOTA PARA CABALLERO COLOR CHOCOLATE, ACABADO PIEL LISA, CORTE VACUNO, FORRO TEXTIL, SUELA SINTETICA COLOR CAF?, CON BULL?N TEXTURIZADO COLOR TABACO, CATORCE OJILLOS METALICOS COLOR CAF?, AJUSTE DE AGUJETA COLOR CHOCOLATE, FORRO INTERIOR ACOJINADO, PESPUNTES VISIBLES, GRABADO DE LOGO EN PARTE EXTERIOR. SEGUN MUESTRA BC44.",1195.18,1195.18,191.23,1386.41,,PC146,30
147,2025,135,76,244,BC42,"BOTA PARA CABALLERO COLOR AZUL MARINO, ACABADO TIPO NOBUCK,CORTE SINTETICO, FORRO TEXTIL, SUELA SINTETICA COLOR BLANCA, SIN BULL?N, DOS OIJILLOS METALICOS COLOR NATURAL, SEIS OJILLOS PERFORADOS, AJUSTE DE AGUJETA COLOR AZUL MARINO, CINTA PARA FACILITAR EL CALZADO, FORRO INTERIOR ACOJINADO, PESPUNTES VISIBLES, GRABADO DE LOGO EN PARTE EXTERIOR. SEGUN MUESTRA BC42.",1195.18,1195.18,191.23,1386.41,,PC147,30
148,2025,139,80,244,BD12,"BOTA PARA DAMA COLOR CAFE, CORTE VACUNO PIEL LISA, FORRO TEXTIL, SUELA SINTETICA COLOR CAF?, BULL?N PIEL ACABADO LISO, DOCE OJILLOS METALICOS, AJUSTE DE AGUJETA COLOR CAF?, PESPUNTES VISIBLES, CINTA PARA FACILITAR CALZADO,GRABADO DE LOGO EN PARTE EXTERIOR. SEG?N MUESTRA BD12",945.14,945.14,151.22,1096.36,,PC148,30
149,2025,140,81,244,BD13,"BOTA PARA DAMA COLOR ARENA,CORTE VACUNO, ACABADO PIEL NOBUK, FORRO TEXTIL ACOJINADO SUELA SINTETICA COLOR GRIS, BULLON  ACABADO PIEL LISA, SEIS OJILLOS METALICOS COLOR BEIGE, AGUJETA COLOR BEIGE, PESPUNTES VISIBLES, GRABADO DE LOGO EN PARTE EXTERIOR. SEGUN MUESTRA BD13",1019.69,1019.69,163.15,1182.84,,PC149,30
150,2025,140,81,244,BD16,"BOTA PARA DAMA COLOR MIEL, CORTE VACUNO ACABADO PIEL CRAZY,FORRO TEXTIL, SUELA SINTETICA COLOR BLANCO,BULLON ACABADO GAMUZA,DOCE OJILLOS METALICOS,AJUSTE DE AGUJETA COLOR CAFE,PESPUNTES VISIBLES,GRABADO DE LOGO EN PARTE EXTERIOR.SEG?N MUESTRA BD16",1019.69,1019.69,163.15,1182.84,,PC150,30
151,2025,142,83,244,BD35,"BOTA PARA DAMA COLOR CAFE, CORTE VACUNO,  ACABADO PIEL NOBUK,  FORRO TEXTIL, SUELA SINTETICA COLOR BEIGE, OCHO OJILLOS METALICOS Y DOS HERRAJES METALICOS , CIERRE EN LATERAL INTERNO, AHUJETA COLOR CAF?, BULLON ACABADO PIEL NOBUK, INTERIOR ACOJINADO, GRABADO DE LOGO EN LA PARTE EXTERIOR, PESPUNTES VISIBLES. SEG?N MUESTRA BD35",902.50,902.50,144.40,1046.90,,PC151,30
152,2025,143,84,244,BD39,"BOTA PARA DAMA COLOR CANELA,  CORTE VACUNO, ACABADO PIEL TEXTURIZADA, FORRO TEXTIL ACOJINADO, SUELA SINTETICA COLOR CHOCOLATE, PLANTILLA DE CERDO, AJUSTE DE CIERRESEN LATERALES, BULLON ACABADO NOBUK, CON CINTA PARA FACILITAR EL CALZADO, PESPUNTES VISIBLES, SEGUN MUESTRA BD39",1011.08,1011.08,161.77,1172.85,,PC152,30
153,2025,94,35,244,BM01,"BLUSA DE MEZCLILLA MANGA LARGA PARA DAMA EN COLOR AZUL CLARO, CONFECCIONADA EN ALGOD?N, BOLSILLO A LA ALTURA DEL PECHO LADO IZQUIERDO, FALDON CURVO, BOTONES EN LA PARTE DELANTERA, CUELLO SPORT, ALETILLA, PINZAS DELANTERAS Y TRASERAS. SEG?N MUESTRA BM01.",331.14,331.14,52.98,384.12,,PC153,33
154,2025,94,35,244,BM02,"BLUSA DE MEZCLILLA MANGA LARGA PARA DAMA EN COLOR AZUL STONE, CONFECCIONADA EN ALGOD?N, BOLSILLO A LA ALTURA DEL PECHO LADO IZQUIERDO, FALDON CURVO, BOTONES EN LA PARTE DELANTERA, CUELLO SPORT, ALETILLA, PINZAS DELANTERAS Y TRASERAS. SEG?N MUESTRA BM02.",331.14,331.14,52.98,384.12,,PC154,33
155,2025,87,28,244,BV04,"BLUSA DE VESTIR PARA DAMA SIN MANGA,DISE?O FLORAL MULTICOLOR, CONFECCIONADA EN TELA 100%POLIESTER, CUELLO MAO CON CADENA DE AJUSTE, PINZAS EN CUELLO, FALDON CURVO, ESCOTE EN V EG?N MUESTRA BV04.",715.37,715.37,114.46,829.83,,PC155,35
156,2025,87,28,244,BV06,"BLUSA DE VESTIR PARA DAMA,SIN MANGA TERMINADA EN SOLAPA, COLOR AZUL MARINO, CONFECCIONADA EN TELA 100%POLIESTER, CUELLO REDONDO,ABERTURA Y BOTON DE AJUSTE, DOS PINZAS AL FRENTE A LA ALTURA DEL PECHO, PRETINA ANCHA CON CINTA DE AJUSTE .SEG?N MUESTRA BV06.",715.37,715.37,114.46,829.83,,PC156,35
157,2025,89,30,244,BV30,"BLUSA DE VESTIR PARA DAMA MANGA LARGA, COLOR AZUL MULTI DEGRADADO, CONFECCIONADA EN TELA 100% POLIESTER, CUELLO TIPO SSPORT, ESCOTE ""V,CUATRO BOTONES EN LA PARTE DE AL FRENTE COLOR PLATA,PINZA EN LA PARTE TRASERA, PU?OS FUSIONADOS CON UN BOTON DE AJUSTE COLOR PLATA PLIEGUES EN  MANGA. SEG?N MUESTRA BV30.",697.99,697.99,111.68,809.67,,PC157,35
158,2025,89,30,244,BV23,"BLUSA DE VESTIR PARA DAMA, MANGA CORTA, COLOR CORAL,DISE?O LISO,CONFECCIONADA EN TELA 100% POLIESTER, CUELLO REDONDO, CON ESCOTE EN ""V""CON CINTA DE AJUSTE, RESORTE ALREDEDOR DE LA CINTURA PARA AJUSTE. SEG?N MUESTRA BV23.",697.99,697.99,111.68,809.67,,PC158,35
159,2025,90,31,244,BV36,"BLUSA DE VESTIR PARA DAMA MANGA LARGA COLOR PERLA  CONFECCIONADA EN TELA 100% POLIESTER,CUELLO EN ESCOTE ""V"" CON DETALLE DE CINTA DECORATIVA,UNA CADENA DECORATIVA EN CINTA,PU?OS FUSIONADOS CON UN BOTON. SEGUN MUESTRA BV36",696.06,696.06,111.37,807.43,,PC159,35
160,2025,91,32,244,BV58,"BLUSA DE VESTIR PARA DAMA,  COLOR BLANCO, ESTAMPADO FLOREADO MULTICOLOR, COMPOSICION 100% POLIESTER,  MANGA CORTA CON OLANES, ESCOTE EN V, 5 BOTONES SIMULADOS AL FRENTE.SEGUN MUESTRA BV58.",694.06,694.06,111.05,805.11,,PC160,35
161,2025,91,32,244,BV52,"BLUSA DE VESTIR PARA DAMA MANGA CORTA,EN COLOR BLANCO,ESTAMPADO EN HOJAS DE COLOR AZUL MARINO/NARANJA,COMPOSICI?N 92% POLIESTER 8% SPANDEX , CUELLO REDONDO, ESCOTE EN ""V"", REFUERZO EN  ESCOTE, UNA PINZA EN LA PARTE BAJA DEL ESCOTE. SEGUN MUESTRA BV52.",694.06,694.06,111.05,805.11,,PC161,35
162,2025,91,32,244,BV54,"BLUSA DE VESTIR PARA DAMA MANGA CORTA TERMINADA EN OLAN, COLOR AZUL MARINO, ESTAMPADO EN PETALOS  COLOR BLANCO, COMPOSICI?N  92% POLIESTER 8% SPANDEX,CUELLO TIPO MAO CON DOS CINTAS DE AJUSTE, ESCOTE EN ""V"".SEGUN MUESTRA BV54.",694.06,694.06,111.05,805.11,,PC162,35
163,2025,92,33,244,BV65,"BLUSA DE VESTIR PARA DAMA,  COLOR BLANCA, CON  CON ESTAMPADO FLOREADO COLOR AZUL, COMPOSICION, 100% POLIESTER,  MANGA LARGA, PU?O FUSIONADO CON BOTON DE AJUSTE, BOTON CON CINTA PARA AJUSTE DE MANGA, CUELLO TIPO SOLAPA, SEIS BOTONES AL FRENTE PARA AJUSTE COLOR NEGRO,  DOS PINZAS AL FRENTE Y DOS EN ESPALDA .SEGUN MUESTRA BV65",706.05,706.05,112.97,819.02,,PC163,35
164,2025,92,33,244,BV68,"BLUSA DE VESTIR PARA DAMA,  COLOR AZUL CIELO , CON  ESTAMPADO DE DIAMANTES EN COLOR BLANCO, COMPOSICION, 60% ALGODON, 40% POLIESTER,  MANGA LARGA, CUELLO FUSIONADO, PU?O FUSIONADO CON TRIPLE BOTON DE AJUSTE Y DOS PINZAS, CUELLO TIPO SOLAPA, SIETE BOTONES AL FRENTE PARA AJUSTE COLOR BLANCO, BOTON DE REPUESTO, CUATRO PINZAS AL FRENTE Y DOS EN ESPALDA, ABERTURAS EN LATERALES .SEGUN MUESTRA BV68",706.05,706.05,112.97,819.02,,PC164,35
165,2025,145,86,244,CF03,"CONJUNTO DE 3 PIEZAS PARA DAMA: SACO CONFECCIONADO EN TELA  POLIESTER, FORRO POLIESTER, CUELLO TIPO MAO CON BIES AZUL MARINO, COLOR BLANCO CON DETALLES MULTICOLOR, DOS BOLSAS SIMULADAS AL FRENTE A LA ATURA DEL ABDOMEN, PINZAS AL FRENTE A LA ALTURA DEL PECHO, TRES COSTURAS EN LA PARTE DE ATRAS. FALDA: CONFECCIONADA EN TELA  93% P0LIESTER 7% ELASTANO, COLOR GAZUL REY, CORTE RECTO,  CIERRE METALICO Y BOTON DE AJUSTE. BLUSA: CONFECCIONADA EN TELA 100% POLIESTER, COLOR BLANCO, CUELLO REDONDO, MANGA CORTA, ENCAJE DECORATIVO AL FRENTE, CINTAS DE AJUSTE EN CINTURA. SEG?N MUESTRA CP03.",2275.47,2275.47,364.08,2639.55,,PC165,35
166,2025,103,44,244,CHALC04,"CHALECO PARA CABALLERO COLOR CAF? CLARO, CONFECCIONADO EN TELA 100%  POLIESTER, FORRO POLIESTER, CAPITONADO HORIZONTAL, CUELLO ALTO, DOS BOLSILLOS AL FRENTE A LA ALTURA DEL ABDOMEN, CIERRE DE CARRO METALICO AL FRENTE. SEG?N MUESTRA CHALC04",795.50,795.50,127.28,922.78,,PC166,38
167,2025,104,45,244,CHALC09,"CHALECO PARA CABALLERO COLOR OLIVO, FORRO POLIESTER, CONFECCIONADO EN TELA 100% POLIESTER, CAPITONADO EN ROMBOS, CUELLO ALTO, DOS BOLSILLOS AL FRENTE A LA ALTURA DEL ABDOMEN, CIERRE DE CARRO METLICO AL FRENTE, BOLSA OCULTA DE LADO IZQUIERDO. SEG?N MUESTRA CHALC09",795.50,795.50,127.28,922.78,,PC167,38
168,2025,105,46,244,CHALC10,"CHALECO PARA CABALLERO COLOR ROJO, CONFECCIONADO EN TELA 100%  POLIESTER, FORRO POLIESTER, CUELLO ALTO , DOS BOLSILLOS AL FRENTE A LA ALTURA DEL ABDOMEN, CIERRE DE CARRO METALICO AL FRENTE, DOS BOLSAS OCULTAS EN INTERIOR A LA ALTURA DEL ABDOMEN. SEG?N MUESTRA CHALC10",836.05,836.05,133.77,969.82,,PC168,38
169,2025,106,47,244,CHALD04,"CHALECO PARA DAMA COLOR AZUL MARINO, CONFECCIONADO EN TELA 100% POLIESTER, FORRO POLIESTER , CON DETALLES EN LINEAS PUNTEADAS, BOLSAS EN AL FRENTE A LA ALTURA DEL ABDOMEN, CIERRE DE CARRO METALICO ALFRENTE, REPELENTE AL AGUA.SEGUN MUESTRA CHALD04.",818.66,818.66,130.99,949.65,,PC169,38
170,2025,106,47,244,CHALD06,"CHALECO PARA DAMA COLOR OLIVO, CONFECCIONADO EN TELA 100% POLIESTER, FORRO POLIESTER, CORTE CON SILUETA, CAPITONADO HORIZONTAL, BOLSAS AL FRENTE A LA ALTURA DEL ABDOMEN, CIERRE DE CARRO METALICO ALFRENTE, CUELLO TIPO MAO, CON RESORTE EN LA PARTE DE ATRAS, REPELENTE AL AGUA.SEGUN MUESTRA CHALD06",818.66,818.66,130.99,949.65,,PC170,38
171,2025,107,48,244,CHALD13,"CHALECO PARA DAMA COLOR AZUL MARINO, CONFECCIONADO EN TELA 100%  POLIESTER, FORRO POLIESTER, CAPITONADO ZIGZAG, DOS BOLSAS AL FRENTE CON CIERRE A LA ALTURA DEL ABDOMEN, CIERRE DE CARRO METALICO DE COLOR ROJO, DETALLE MULTICOLOR EN CINTURA DE AMBOS LADOS, RESORTE EN ESPALDA, CUELLO ALTO, CORTE CON SILUETA . SEG?N MUESTRA CHALD13",821.01,821.01,131.36,952.37,,PC171,38
172,2025,107,48,244,CHALD12,"CHALECO PARA DAMA COLOR ARENA, CONFECCIONADO EN TELA 100%  POLIESTER, FORRO POLIESTER AFELPADO, CAPITONADO HORIZONTAL, BOLSAS AL FRENTE A LA ALTURA DEL ABDOMEN, CIERRE DE CARRO METALICO ALFRENTE, CUELLO ALTO,SEGUN MUESTRA CHALD12",821.01,821.01,131.36,952.37,,PC172,38
173,2025,108,49,244,CHALD20,"CHALECO PARA DAMA COLOR VERDE, CONFECCIONADO EN TELA 100% POLIESTER, FORRO POLIESTER, CAPITONADO EN ROMBOS, DOS BOLSILLOS AL FRENTE CON CIERRE Y BIES PLASTICO A LA ALTURA DEL ABDOMEN, CIERRE DE ACRRO METALICO CON BIES PLASTICO EN COLOR NEGRO AL FRENTE, AJUSTE ELASTICO EN CINTURACON TOPE METALICO, CUELLO TIPO SPORT. SEG?N MUESTRA CHALD20",799.83,799.83,127.97,927.80,,PC173,38
174,2025,95,36,244,CHC05,"CHAMARRA PARA CABALLERO COLOR OLIVO/CAFE, CONFECCIONADA EN TELA 100% POLIESTER, FORRO POLIESTER, CUELLO ALTO,  DOS BOLSAS A LA ALTURA DEL ABDOMEN, DOBLE VISTA, TEJIDO EN CUELLO,  PU?O Y PRETINA,  REPELENTE AL AGUA. SEGUN MUESTRA CHC5",919.07,919.07,147.05,1066.12,,PC174,37
175,2025,96,37,244,CHC06,"CHAMARRA PARA CABALLERO COLOR ROJO/MARINO, CONFECCIONADA EN TELA 100% POLIESTER, FORRO POLIESTER, CUELLO ALTO,  DOS BOLSAS A LA ALTURA DEL ABDOMEN, DOBLE VISTA, TEJIDO EN CUELLO,  PU?O Y PRETINA,  REPELENTE AL AGUA. SEG?N MUESTRA CHC06",958.65,958.65,153.38,1112.03,,PC175,37
176,2025,96,37,244,CHC08,"CHAMARRA DE CABALLERO COLOR AZUL MARINO CON DETALLE EN LINEAS PUNTEADAS ,CONFECCIONADA EN TELA 100% POLIESTER, REPELENTE AL AGUA, FORRO POLIESTER, DOS BOLSILLOS DELANTEROS A LA ALTURA DEL ABDOMEN, CIERRE DE CARRO METALICO AL FRENTE, TEJIDO EN PU?OS Y PRETINA COLOR GRIS , ROJO Y MARINO, BOLSA OCULTA A LA ALTURA DEL ABDOMEN, CUELLO ALTO. SEG?N MUESTRA CHC08.",958.65,958.65,153.38,1112.03,,PC176,37
177,2025,96,37,244,CHC10,"CHAMARRA DE CABALLERO COLOR AZUL ACERO, CONFECCIONADO EN TELA  100%POLIESTER, FORRO POLIESTER, DOS BOLSILLOS DELANTEROS A LA ATURA DEL ABDOMEN, CIERRE DE CARRO METALICO AL FRENTE, REPELENTE AL AGUA, GORRO DESMONTABLE CON CIERRE DE CARRO METALICO, BOLSAS INTERIORES OCULTAS A LA ALTURA DEL ABDOMEN, AJUSTE DE RESORTE CON TOPE DE PLASTICO EN GORRO, RESORTE EN PU?OS Y CINTURA, CUELLO ALTO. SEG?N MUESTRA CHC10.",958.65,958.65,153.38,1112.03,,PC177,37
178,2025,97,38,244,CHC18,"CHAMARRA PARA CABALLERO COLOR PLATA, CONFECCIONADA EN TELA 100% POLIESTER, FORRO POLIESTER, DOS BOLSAS AL FRENTE A LA ALTURA DEL ABDOMEN, CIERRE  DE CARRO METALICO AL FRENTE, TEJIDO EN CUELLO,  BOLSA INTERNA OCULTA A LA ALTURA DEL ABDOMEN, PU?OS Y PRETINA CON DETALLES MULTICOLOR, SEG?N MUESTRA CHC18.",959.83,959.83,153.57,1113.40,,PC178,37
179,2025,99,40,244,CHD03,"CHAMARRA PARA DAMA COLOR NEGRO, CONFECCIONADA EN TELA 100% POLIESTER REPELENTE AL AGUA, FORRO POLIESTER, DOS BOLSILLOS AL FRENTE A A LA ALTURA DEL ABDOMEN, CIERRE DE CARRO METALICO CON REFLEJANTE  EN BIES, AJUSTE ELASTICO CON TOPE PLASTICO EN CUELLO Y PRETINA, PU?O CON BIES, CUELLO ALTO, . SEG?N MUESTRA CHD03",944.38,944.38,151.10,1095.48,,PC179,37
180,2025,100,41,244,CHD07,"CHAMARRA DE DAMA COLOR NEGRO, CONFECCIONADA EN TELA 100% POLIESTER REPELENTE AL AGUA, FORRO POLIESTER, CAPITONADO EN HORIZONTAL, DOS BOLSILLOS DELANTEROS CON DOS BROCHES MET?LICOS CADA BOLSA, CIERRE DE CARRO METALICO AL FRENTE, AJUSTE ELASTICO CON TOPE EN GORRO  CIERRES Y BROCE METALICO PARA DESMONTAR. SEG?N MUESTRA CHD07.",944.38,944.38,151.10,1095.48,,PC180,37
181,2025,101,42,244,CHD09,"CHAMARRA PARA DAMA COLOR AZUL ACERO, CONFECCIONADA EN TELA  100% POLIESTER REPELENTE AL AGUA, FORRO POLIESTER,CORTE CON SILUETA, CIERRE  DE CARRO METALICO AL FRENTE, CUELLO ALTO, AJUSTE ELASTICO CON TOPE PLASTICO EN CUELLO.. SEG?N MUESTRA CHD09",966.89,966.89,154.70,1121.59,,PC181,37
182,2025,101,42,244,CHD08,"CHAMARRA PARA DAMA COLOR PLATA, CONFECCIONADA EN TELA  100% POLIESTER REPELENTE AL AGUA, FORRO POLIESTER,CORTE CON SILUETA, CIERRE  DE CARRO METALICO AL FRENTE, CUELLO ALTO, AJUSTE ELASTICO CON TOPE PLASTICO EN CUELLO.. SEG?N MUESTRA CHD08",966.89,966.89,154.70,1121.59,,PC182,37
183,2025,102,43,244,CHD19,"CHAMARRA PARA DAMA COLOR CAFE, CONFECCIONADA EN TELA 100% POLIESTER, REPELENTE AL AGUA, FORRO POLIESTER, CAPITONADO EN FORMA DE PETALO, DOS BOLSAS   AL FRENTE CON CIERRE, SEIS BROCHES PARA CERRAR LA PRENDA HASTA EL CUELLO, CUELLO ALTO, DOS BOLSAS OCULTAS EN EL INTERIOR A LA ALTURA DEL ABDOMEN. SEG?N MUESTRA CHD18",918.10,918.10,146.90,1065.00,,PC183,37
184,2025,86,27,244,CM01,"CAMISA DE MEZCLILLA MANGA LARGA PARA CABALLERO COLOR AZUL CLARO, CONFECCIONADA EN ALGOD?N, BOLSILLO A LA ALTURA DEL PECHO LADO IZQUIERDO, PU?OS FUSIONADOS CON BOT?N DE AJUSTE, ALETILLA Y BOTONES AL FRENTE. SEG?N MUESTRA CM01.",449.88,449.88,71.98,521.86,,PC184,33
185,2025,86,27,244,CM02,"CAMISA DE MEZCLILLA MANGA LARGA PARA CABALLERO COLOR AZUL STONE, CONFECCIONADA EN ALGOD?N, BOLSILLO A LA ALTURA DEL PECHO LADO IZQUIERDO, PU?OS FUSIONADOS CON BOT?N DE AJUSTE, ALETILLA Y BOTONES AL FRENTE. SEG?N MUESTRA CM02.",449.88,449.88,71.98,521.86,,PC185,33
186,2025,146,87,244,CP02,"CONJUNTO DE 3 PIEZAS PARA DAMA: SACO CONFECCIONADO EN TELA  POLIESTER, FORRO POLIESTER, CUELLO REDONDO, LINEAS HORIZONTALES EN COLOR GRIS Y BEIGE, CORTE CON SILUETA Y TRES COSTURAS EN ESPALDA. PANTALON: CONFECCIONADO EN TELA 100% P0LIESTER, COLOR GRIS OXFORD, CORTE RECTO, CIERRE METALICO Y BOTON DE AJUSTE  AL FRENTE, DOS PINZAS EN LA PARTE DE ATRAS A LA ALTURA DE LA CADERA, ABERTURA EN TOBILLOS DE AMBOS LADOS. BLUSA: CONFECCIONADA EN TELA 100% POLIESTER, COLOR HUESO, CUELLO TIPO SPORT CON CINTAS DECORATIVAS, DOS BOTONES DE AJUSTE CON CADENA, ESCOTE EN V, MANGA LARGA, PU?O FUSIONADO CON BOTON DE AJUSTE Y PLIEGUES, SEG?N MUESTRA CP02.",2275.47,2275.47,364.08,2639.55,,PC186,33
187,2025,80,21,244,CV06,"CAMISA DE VESTIR MANGA LARGA PARA CABALLERO COLOR BLANCO, DISE?O DE FIGURAS EN PUNTOS AZUL CIELO  Y LINEAS AZUL MARINO, COMPOSICI?N 60% POLIESTER 40%  ALGOD?N, CUELLO FUSIONADO CON DOS BOTONES DE AJUSTE, PU?OS FUSIONADOS CON DOBLE BOT?N DE AJUSTE, SIETE BOTONES DE AJUSTE EN COLOR BLANCO, FALD?N CURVO,DOS BOT?NES DE REPUESTO, BOLSILLO A LA ALTURA DEL PECHO LADO IZQUIERDO, SEG?N MUESTRA CV06.",693.16,693.16,110.91,804.07,,PC187,34
188,2025,81,22,244,CV19,"CAMISA DE VESTIR MANGA LARGA PARA CABALLERO COLOR AZUL ACERO, DISE?O TIPO JASPEADO, COMPOSICION 60% POLIESTER 40%  ALGODON, CUELLO FUSIONADO, PU?OS FUSIONADOS CON DOBLE BOTON DE AJUSTE, SIETE BOTONES DE AJUSTE EN COLOR AZUL MARINO, FALDON CURVO, DOS BOTONES DE REPUESTO, BOLSILLO A LA ALTURA DEL PECHO LADO IZQUIERDO, SEGUN MUESTRA CV19.",693.15,693.15,110.90,804.05,,PC188,34
189,2025,83,24,244,CV33,"CAMISA DE VESTIR MANGA LARGA PARA CABALLERO COLOR AZUL MARINO, ESTAMPADO A LINEAS EN COLOR ROSA Y VERDE LIMON, COMPOSICI?N 60% POLIESTER 40%  ALGOD?N, CUELLO FUSIONADO, PU?OS FUSIONADOS CON DOBLE BOT?N DE AJUSTE, SIETE BOTONES DE AJUSTE EN COLOR ROSA, FALD?N CURVO, DOS BOT?NES DE REPUESTO, BOLSILLO A LA ALTURA DEL PECHO LADO IZQUIERDO, SEG?N MUESTRA CV33.",693.16,693.16,110.91,804.07,,PC189,34
190,2025,83,24,244,CV37,"CAMISA DE VESTIR MANGA LARGA PARA CABALLERO COLOR AZUL MARINO,DISE?O DE ROMBOS Y PUNTOS EN COLOR ABLANCO Y AZUL FRANCIA, COMPOSICI?N 60% POLIESTER 40%  ALGOD?N, CUELLO FUSIONADO, PU?OS FUSIONADOS CON DOBLE BOT?N DE AJUSTE, SIETE BOTONES DE AJUSTE EN COLOR AZUL MARINO, FALD?N CURVO, DOS BOT?NES DE REPUESTO, BOLSILLO A LA ALTURA DEL PECHO LADO IZQUIERDO, SEG?N MUESTRA CV37.",693.16,693.16,110.91,804.07,,PC190,34
191,2025,84,25,244,CV42,"CAMISA DE VESTIR MANGA LARGA PARA CABALLERO COLOR BLANCO, ESTAMPADO DE LINEAS COLOR CELESTE, AZUL MARINO, Y NEGRO, COMPOSICI?N 60% POLIESTER 40%  ALGOD?N, CUELLO FUSIONADO CON DOS BOTONES DE AJUSTE, PU?OS FUSIONADOS CON DOBLE BOT?N DE AJUSTE, SIETE BOTONES DE AJUSTE EN COLOR BLANCO, FALD?N CURVO, DOS BOT?NES DE REPUESTO, BOLSILLO A LA ALTURA DEL PECHO LADO IZQUIERDO, SEG?N MUESTRA CV42.",693.16,693.16,110.91,804.07,,PC191,34
192,2025,84,25,244,CV43,"CAMISA DE VESTIR MANGA LARGA PARA CABALLERO COLOR BLANCO, ESTAMPADO DE LINEAS, EN VERTICAL COLOR CELESTE, EN HORIZONTAL EN COLOR VERDE LIM?N, COMPOSICI?N 60% POLIESTER 40%  ALGOD?N, CUELLO FUSIONADO CON DOS BOTONES DE AJUSTE, PU?OS FUSIONADOS CON DOBLE BOT?N DE AJUSTE, SIETE BOTONES DE AJUSTE EN COLOR CELESTE, FALD?N CURVO, DOS BOT?NES DE REPUESTO, BOLSILLO A LA ALTURA DEL PECHO LADO IZQUIERDO, SEG?N MUESTRA CV43.",693.16,693.16,110.91,804.07,,PC192,34
193,2025,84,25,244,CV51,"CAMISA DE VESTIR MANGA LARGA PARA CABALLERO COLOR NEGRO, ESTAMPADO DE LINEAS EN COLOR BLANCO COMPOSICI?N 20% POLIESTER 80%  ALGODON, CUELLO FUSIONADO, PU?OS FUSIONADOS CON DOBLE BOT?N DE AJUSTE, SIETE BOTONES DE AJUSTE EN COLOR NEGRO, FALDON CURVO, BOT?N DE REPUESTO, BOLSILLO A LA ALTURA DEL PECHO LADO IZQUIERDO, SEG?N MUESTRA CV51",693.16,693.16,110.91,804.07,,PC193,34
194,2025,84,25,244,CV44,"CAMISA DE VESTIR MANGA LARGA PARA CABALLERO COLOR BLANCO, ESTAMPADO DE LINEAS, EN VERTICAL COLOR TURQUESA Y  CAFE,  EN HORIZONTAL EN COLOR CELESTE Y NEGRO, COMPOSICI?N 100%  ALGOD?N, CUELLO FUSIONADO, PU?OS FUSIONADOS CON DOBLE BOT?N DE AJUSTE, SIETE BOTONES DE AJUSTE EN COLOR CAF?, FALD?N CURVO, DOS BOT?NES DE REPUESTO, BOLSILLO A LA ALTURA DEL PECHO LADO IZQUIERDO, SEG?N MUESTRA CV44.",693.16,693.16,110.91,804.07,,PC194,34
195,2025,148,89,244,JPC04,"JUEGO DEPORTIVO PARA CABALLERO COMPOSICI?N EN TELA 100% POLIESTER; COMPUESTO DE CHAMARRA EN COLOR AMARILLO FOSFORESCENTE,CON DOS BOLSAS AL FRENTE A LA ALTURA DEL ABDOMEN TIPO OJAL, CUELLO ALTO,CIERRE AL FRENTE, GORRO; PANTS COLOR  NEGRO, DOS BOLSAS LATERALES, RESORTE EN LA CINTURA,CORTE RECTO. SEGUN MUESTRA JPC04",1004.99,1004.99,160.80,1165.79,,PC195,37
196,2025,150,91,244,JPD05,"JUEGO DEPORTIVO PARA DAMA EN COLOR NEGRO , CONFECCIONADO EN TELA 100% POLIESTER; SUDADERA CON UN BOLSILLO AL FRENTE TIPO CANGURO, CIERRE,GORRO,PANTS COLOR NEGRO, AJUSTE ELASTICO EN CINTURA, DOS BOLSAS LATERALES. SEG?N MUESTRA JPD05",1050.37,1050.37,168.06,1218.43,,PC196,42
197,2025,11,11,244,PGC03,"PANTALON DE GABARDINA PARA CABALLERO COLOR VERDE OLIVO, CONFECCIONADO EN 98% ALGOD?N 2% ELASTANO, CUATRO BOLSILLOS, DOS AL FRENTE DIAGONALES Y DOS TRASEROS TIPO OJAL, TIRO  MEDIO, CORTE RECTO, PIERNA Y VALENCIANA RELAJADA, CIERRE DE CARRO  METALICO EN BRAGUETA Y BOTON PLASTICO PARA AJUSTE, CINCO PRESILLAS. SEG?N MUESTRA PGC03",560.90,560.90,89.74,650.64,,PC197,33
198,2025,12,12,244,PGC17,"PANTALON DE GABARDINA PARA CABALLERO COLOR NEGRO, COMPOSICI?N 57% ALGOD?N 43% POLIESTER, CINCO BOLSILLOS: TRES AL FRENTE Y DOS ATRAS, CIERRE DE CARRO METALICO, EN BRAGUETA Y BOT?N MET?LICO PARA AJUSTE, REMACHES MET?LICOS EN BOLSILLOS DELANTEROS, CORTE REGULAR, CINTURA ALTA, PIERNA RELAJADA Y VALENCIANA PARA BOTA, CINCO PRESILLAS. SEG?N MUESTRA PGC15",552.47,552.47,88.40,640.87,,PC198,30
199,2025,13,13,244,PGC18,"PANTALON DE GABARDINA PARA CABALLERO COLOR VERDE OLIVO, COMPOSICI?N 98% ALGOD?N 2% ELASTANO, CUATRO BOLSILLOS:  DOS AL FRENTE DIAGONALES Y DOS ATRAS TIPO OJAL CON BOTON, CIERRE DE CARRO METALICO EN BRAGUETA Y BOT?N PLASTICO PARA AJUSTE, CORTE RECTO, PIERNA Y VALENCIANA RELAJADO, CINCO PRESILLAS. SEG?N MUESTRA PGC18",582.15,582.15,93.14,675.29,,PC199,33
200,2025,13,13,244,PGC22,"PANTALON DE GABARDINA PARA CABALLERO COLOR GRIS OXFORD, COMPOSICI?N 98% ALGOD?N 2% ELASTANO, CUATRO BOLSILLOS:  DOS AL FRENTE DIAGONALES Y DOS ATRAS TIPO OJAL CON BOTON, CIERRE DE CARRO METALICO EN BRAGUETA Y BOT?N PLASTICO PARA AJUSTE, CORTE SLIM, PIERNA Y VALENCIANA SEMI JUSTO, CINCO PRESILLAS. SEG?N MUESTRA PGC22",582.15,582.15,93.14,675.29,,PC200,33
201,2025,17,17,244,PGD01,"PANTALON DE GABARDINA PARA DAMA, COLOR KHAKI, COMPOSICI?N 97% ALGOD?N 3% ELASTANO, CINCO BOLSILLOS; TRES AL FRENTE Y DOS ATR?S, CINTURA MEDIA, CORTE RECTO, PIERNA Y VALENCIANA RELAJADA, CIERRE DE CARRO METALICO  EN BRAGUETA, UN BOT?N MET?LICO PARA AJUSTE, REMACHES METALICOS EN BOLSILLOS DELANTEROS, CINCO PRESILLAS. SEG?N MUESTRA PGD01",569.59,569.59,91.13,660.72,,PC201,33
202,2025,18,18,244,PGD05,"PANTAL?N DE GABARDINA PARA DAMA, COLOR KHAKI, COMPOSICI?N 97% ALGOD?N 3% ELASTANO, DOS BOLSILLOS EN DIAGONAL AL FRENTE, DOS BOLSAS SIMULADAS ATR?S TIPO OJAL, CORTE SKINNY, PIERNA Y VALENCIANA AJUSTADA,  CIERRE DE CARRO  METALICO EN BRAGUETA, UN BOTON DE PL?STICO PARA AJUSTE, CINCO PRESILLAS. SEGUN MUESTRA PDG05",582.15,582.15,93.14,675.29,,PC202,56
203,2025,19,19,244,PGD12,"PANTALON DE GABARDINA PARA DAMA, COLOR CAF?, COMPOSICION  98% ALGOD?N 2% ELASTANO, CINTURA ALTA, CORTE SKINNY, PIERNA Y VALENCIANA AJUSTADA, CIERRE DE CARRO MET?LICO, BOTON DE PL?STICO EN BRAGUETA PARA AJUSTE, DOS BOSILLOS EN DIAGONAL AL FRENTE Y DOS BOLSAS SIMULADAS TIPO OJAL EN LA PARTE DE ATRAS, CINCO PRESILLAS. SEG?N MUESTRA PGD12",578.44,578.44,92.55,670.99,,PC203,33
204,2025,19,19,244,PGD10,"PANTALON DE GABARDINA PARA DAMA, COLOR VERDE OLIVO, COMPOSICION  98% ALGOD?N 2% ELASTANO, CINTURA ALTA, CORTE RECTO, PIERNA Y VALENCIANA RELAJADA, CIERRE DE CARRO METALICO Y BOTON METALICOS EN BRAGUETA PARA AJUSTE, CINCO BOSILLOS: TRES AL FRENTE Y DOS ATR?S, REMACHES METALICOS EN BOLSILLOS DELANTEROS, CINCO PRESILLAS. SEG?N MUESTRA PGD10",578.44,578.44,92.55,670.99,,PC204,33
205,2025,19,19,244,PGD11,"PANTALON DE GABARDINA PARA DAMA, COLOR KHAKI, COMPOSICION  98% ALGOD?N 2% ELASTANO, CINTURA REGULAR, CORTE SKINNY, PIERNA Y VALENCIANA AJUSTADA, CIERRE DE CARRO METALICO Y BOTON METALICO EN BRAGUETA PARA AJUSTE, CINCO BOSILLOS: TRES AL FRENTE Y DOS ATR?S, REMACHES METALICOS EN BOLSILLOS DELANTEROS, CINCO PRESILLAS. SEG?N MUESTRA PGD11",578.44,578.44,92.55,670.99,,PC205,33
206,2025,154,95,244,PLC01,"PLAYERA TIPO POLO PARA CABALLERO COLOR SALMON , COMPOSICI?N EN 50% ALGOD?N 50% POLIESTER, MANGA CORTA, 3 BOTONES AL FRENTE, CUELLO Y PU?OS TEJIDOS CON DETALLES EN COLOR NEGRO Y BLANCO, DISE?O BORDADO EN PARTE IFERIOR COLOR NEGRO. SEG?N MUESTRA PLC01.",294.45,294.45,47.11,341.56,,PC206,36
207,2025,1,1,244,PMC04,"PANTALON DE MEZCLILLA PARA CABALLERO COLOR INDIGO JASPEADO,COMPOSICI?N 100% ALGOD?N, CUATRO BOLSILLOS:  DOS AL FRENTE  Y DOS ATRAS, CINTURA MEDIA, CIERRE DE CARRO METALICO EN BRAGUETA Y BOT?N METALICO PARA AJUSTE, CORTE RECTO, SEIS PRESILLAS. SEG?N MUESTRA PMC04.",598.55,598.55,95.77,694.32,,PC207,33
208,2025,2,2,244,PMC10,"PANTAL?N DE MEZCLILLA PARA CABALLERO, COLOR INDIGO, COMPOSICI?N 70% ALGOD?N 26% POLIESTER, 2%ELASTANO Y 2% VISCOSA, CINCO BOLSILLOS: TRES AL FRENTE Y DOS ATRAS, TIRO BAJO, CORTE SEMI AJUSTADO,  PIERNA AJUSTADA CIERRE DE CARRO METALICO EN BRAGUETA, UN BOTON METALICO PARA AJUSTE, REMACHES METALICOS EN BOLSILLOS DELANTEROS, SEIS PRESILLAS. SEGUN MUESTRA PMC10",607.61,607.61,97.22,704.83,,PC208,33
209,2025,2,2,244,PMC07,"PANTAL?N DE  MEZCLILLA PARA CABALLERO,COLOR AZUL CLARO, COMPOSICI?N 98% ALGOD?N 2% ELASTANO, CINCO BOLSILLOS: TRES ALFRENTE Y DOS ATRAS, CINTURA REGULAR, CORTE SEMI-AJUSTADO, CIERRE DE CARRO METALICO EN BRAGUETA, UN BOTON METALICO PARA AJUSTE, REMACHES METALICOS EN BOLSILLOS DELANTEROS, SEIS PRESILLAS. SEGUN MUESTRA PMC07",607.61,607.61,97.22,704.83,,PC209,33
210,2025,5,5,244,PMC23,"PANTALON DE MEZCLILLA PARA CABALLERO COLOR AZUL INDIGO, COMPOSICION 99% ALGOD?N 1% ELASTANO,CINCO BOLSILLOS: TRES AL FRENTE Y DOS  ATRAS, CORTE SLIM, TIRO BAJO, PIERNA AJUSTADA, VALENCIANA SEMI AJUSTADA CIERRE DE CARRO METALICO EN BRAGUETA Y BOTON METALICO PARA AJUSTE, CORTE SLIM, CON REMACHES METALICOS EN  BOLSILLOS  Y CINCO PRESILLAS.SEGUN MUESTRA PMC23.",598.55,598.55,95.77,694.32,,PC210,33
211,2025,5,5,244,PMC22,"PANTALON DE MEZCLILLA PARA CABALLERO COLOR AZUL PLEACH, COMPOSICION 98% ALGOD?N 2% ELASTANO,CINCO BOLSILLOS: TRES AL FRENTE Y DOS  ATRAS, CORTE SLIM, TIRO BAJO, PIERNA AJUSTADA, VALENCIANA SEMI AJUSTADA CIERRE DE CARRO METALICO EN BRAGUETA Y BOTON METALICO PARA AJUSTE, CORTE SLIM, CON REMACHES METALICOS EN  BOLSILLOS  Y CINCO PRESILLAS.SEGUN MUESTRA PMC22.",598.55,598.55,95.77,694.32,,PC211,33
212,2025,6,6,244,PMC31,"PANTALON DE MEZCLILLA PARA CABALLERO COLOR MARINO OBSCURO, CONFECCIONADO EN TELA 100%  ALGOD?N, CINCO BOLSILLOS: TRES AL FRENTE Y DOS ATR?S, CIERRE DE CARRO METALICO EN BRAGUETA Y BOTON METALICO PARA AJUSTE, CORTE RECTO, CINTURA ALTA, PIERNA RELAJADA, VALENCIANA PARA BOTA  Y CINCO PRESILLAS. SEG?N MUESTRA PMC31.",566.70,566.70,90.67,657.37,,PC212,30
