id,partida_id,tipo_partida_especifica_id,lote,descripcion,marca,unidad_medida,codigo,medida,origen,legacy_propuesta_id,created_at,updated_at
1,62,1,1,"PANTALÓN DE MEZCLILLA PARA CABALLERO, COLOR AZUL MARINO, COMPOSICIÓN 64 % ALGODÓN 36% POLIÉSTER, CUATRO BOLSILLOS: DOS AL FRENTE Y DOS ATRÁS, CINTURA MEDIA, CORTE RECTO, CIERRE DE CARRO METÁLICO EN BRAGUETA, UN BOTÓN METÁLICO PARA AJUSTE, REMACHES METÁLICOS EN BOLSILLOS DELANTEROS, SEIS PRESILLAS. SEGÚN MUESTRA PMC06.","SILVER PLATE",Pieza,53101502,P,propuesta,1,"2026-03-31 11:48:04","2026-03-31 11:48:04"
2,63,1,1,"PANTALÓN DE MEZCLILLA PARA CABALLERO, COLOR ÍNDIGO OBSCURO, COMPOSICIÓN 99% ALGODÓN 1% ELASTANO, CUATRO BOLSILLOS: TRES AL FRENTE Y DOS ATRÁS, CORTE SEMI AJUSTADO, CIERRE DE CARRO METÁLICO EN BRAGUETA, UN BOTÓN METÁLICO PARA AJUSTE, REMACHES METÁLICOS EN BOLSILLOS DELANTEROS, SEIS PRESILLAS. SEGÚN MUESTRA PMC09.","SILVER PLATE",Pieza,53101502,P,propuesta,2,"2026-03-31 11:48:04","2026-03-31 11:48:04"
3,64,1,1,"PANTALÓN DE MEZCLILLA PARA CABALLERO, COLOR NEGRO, COMPOSICIÓN 84% ALGODÓN, 14% POLIÉSTER 2% ELASTANO, CINCO BOLSILLOS: TRES AL FRENTE Y DOS ATRÁS, CORTE AJUSTADO, TIRO BAJO, VALENCIANA AJUSTADA, PIERNA AJUSTADA, CIERRE DE CARRO METÁLICO EN BRAGUETA, UN BOTÓN METÁLICO PARA AJUSTE, REMACHES METÁLICOS EN BOLSILLOS DELANTEROS, CINCO PRESILLAS. SEGÚN MUESTRA PMC14.","SILVER PLATE",Pieza,53101502,P,propuesta,3,"2026-03-31 11:48:04","2026-03-31 11:48:04"
4,65,1,1,"PANTALÓN DE MEZCLILLA PARA CABALLERO COLOR AZUL JASPEADO, COMPOSICIÓN 99% ALGODÓN 1% ELASTANO, CINCO BOLSILLOS: TRES AL FRENTE Y DOS ATRÁS, CIERRE DE CARRO METÁLICO EN BRAGUETA Y BOTÓN METÁLICO PARA JUSTE, CORTE SLIM, PIERNA AJUSTADA, VALENCIANA SEMI AJUSTADA, CON REMACHES METÁLICOS EN LOS BOLSILLOS Y CINCO PRESILLAS. SEGÚN MUESTRA PMC20.",OGGI,Pieza,53101502,P,propuesta,4,"2026-03-31 11:48:04","2026-03-31 11:48:04"
5,66,1,1,"PANTALÓN DE MEZCLILLA PARA CABALLERO COLOR AZUL ÍNDIGO, COMPOSICIÓN 99% ALGODÓN 1% ELASTANO, CINCO BOLSILLOS: TRES AL FRENTE Y DOS ATRÁS, CORTE SLIM, TIRO BAJO, PIERNA AJUSTADA, VALENCIANA SEMI AJUSTADA CIERRE DE CARRO METÁLICO EN BRAGUETA Y BOTÓN METÁLICO PARA AJUSTE, CON REMACHES METÁLICOS EN BOLSILLOS Y CINCO PRESILLAS. SEGÚN MUESTRA PMC23.",OGGI,Pieza,53101502,P,propuesta,5,"2026-03-31 11:48:04","2026-03-31 11:48:04"
6,99,1,1,"PANTALÓN DE MEZCLILLA PARA CABALLERO COLOR AZUL TONO ALTO CONFECCIONADO EN TELA 99% ALGODÓN 1% ELASTANO, CINCO BOLSILLOS: TRES AL FRENTE Y DOS ATRÁS, CIERRE DE CARRO METÁLICO EN BRAGUETA Y BOTÓN METÁLICO PARA AJUSTE, CORTE RECTO, CINTURA ALTA, PIERNA RELAJADA, VALENCIANA PARA BOTA Y CINCO PRESILLAS. SEGÚN MUESTRA PMC30.",FUROR,Pieza,53101502,P,propuesta,6,"2026-03-31 11:48:04","2026-03-31 11:48:04"
7,67,1,1,"PANTALÓN DE MEZCLILLA PARA DAMA COLOR STONE, COMPOSICIÓN 98% ALGODÓN, 2% ELASTANO, CINCO BOLSILLOS: TRES AL FRENTE Y DOS ATRÁS, TIRO MEDIO, CIERRE DE CARRO METÁLICO EN BRAGUETA Y BOTÓN METÁLICO PARA AJUSTE, CORTE RECTO, PIERNA Y VALENCIANA RELAJADA, CON REMACHES METÁLICOS EN BOLSILLOS DELANTEROS, CINCO PRESILLAS. SEGÚN MUESTRA PMD03.",OGGI,Pieza,53101504,P,propuesta,7,"2026-03-31 11:48:04","2026-03-31 11:48:04"
8,68,1,1,"PANTALÓN DE MEZCLILLA PARA DAMA COLOR AZUL MARINO COMPOSICIÓN 87% ALGODÓN 11% POLIÉSTER 2% ELASTANO, CINCO BOLSILLOS: TRES AL FRENTE Y DOS ATRÁS, CINTURA ALTA, CIERRE DE CARRO METÁLICO EN BRAGUETA Y DOS BOTONES METÁLICOS PARA AJUSTE, CORTE SKINNY, CON REMACHES METÁLICOS EN LOS BOLSILLOS DELANTEROS, PUSH UP, CINCO PRESILLAS. SEGÚN MUESTRA PMD09.",OGGI,Pieza,53101504,P,propuesta,8,"2026-03-31 11:48:04","2026-03-31 11:48:04"
9,69,1,1,"PANTALÓN DE MEZCLILLA PARA DAMA COLOR STONE OBSCURO, COMPOSICIÓN 83% ALGODÓN 16% POLIÉSTER 1% ELASTANO, CINCO BOLSILLOS: TRES AL FRENTE Y DOS ATRÁS, CINTURA ALTA, CIERRE DE CARRO METÁLICO EN BRAGUETA, UN BOTÓN METÁLICO PARA JUSTE, CORTE RECTO, PIERNA Y VALENCIANA RELAJADA, CON REMACHES COLOR BRONCE EN BOLSILLOS DELANTEROS, CINCO PRESILLAS. SEGÚN MUESTRA PMD23.",FUROR,Pieza,53101504,P,propuesta,9,"2026-03-31 11:48:04","2026-03-31 11:48:04"
10,100,1,1,"PANTALÓN DE MEZCLILLA PARA DAMA COLOR AZUL CLARO, CONFECCIONADO EN 62% ALGODÓN, 32% POLIÉSTER, 4% RAYÓN, 2% ELASTANO, CINCO BOLSILLOS TRES AL FRENTE Y DOS ATRÁS, CINTURA MEDIA, CIERRE DE CARRO METÁLICO EN BRAGUETA Y BOTÓN METÁLICO PARA AJUSTE, CORTE RECTO, PUSH UP, PIERNA Y VALENCIANA RECTO, CON REMACHES METÁLICOS EN LOS BOLSILLOS DELANTEROS, CINCO PRESILLAS. SEGÚN MUESTRA PMD25.",ESCANDIA,Pieza,53101504,P,propuesta,10,"2026-03-31 11:48:04","2026-03-31 11:48:04"
11,54,1,1,"PANTALÓN DE GABARDINA PARA CABALLERO COLOR VERDE OLIVO, CONFECCIONADO EN 98% ALGODÓN 2% ELASTANO, CUATRO BOLSILLOS, DOS AL FRENTE DIAGONALES Y DOS TRASEROS TIPO OJAL, TIRO MEDIO, CORTE RECTO, PIERNA Y VALENCIANA RELAJADA, CIERRE DE CARRO METÁLICO EN BRAGUETA Y BOTÓN PLÁSTICO PARA AJUSTE, CINCO PRESILLAS. SEGÚN MUESTRA PGC03.","SILVER PLATE",Pieza,53101502,P,propuesta,11,"2026-03-31 11:48:04","2026-03-31 11:48:04"
12,55,1,1,"PANTALÓN DE GABARDINA PARA CABALLERO COLOR AZUL MARINO, COMPOSICIÓN 57% ALGODÓN 43% POLIÉSTER, CINCO BOLSILLOS: TRES AL FRENTE Y DOS ATRÁS, CIERRE DE CARRO METÁLICO, EN BRAGUETA Y BOTÓN METÁLICO PARA AJUSTE, REMACHES METÁLICOS EN BOLSILLOS DELANTEROS, CORTE REGULAR, CINTURA ALTA, PIERNA RELAJADA Y VALENCIANA PARA BOTA, CINCO PRESILLAS. SEGÚN MUESTRA PGC15.",FUROR,Pieza,53101502,P,propuesta,12,"2026-03-31 11:48:04","2026-03-31 11:48:04"
13,56,1,1,"PANTALÓN DE GABARDINA PARA CABALLERO COLOR TABACO, COMPOSICIÓN 98% ALGODÓN 2% ELASTANO, CUATRO BOLSILLOS:  DOS AL FRENTE DIAGONALES Y DOS ATRÁS TIPO OJAL CON BOTÓN, CIERRE DE CARRO METÁLICO EN BRAGUETA Y BOTÓN PLÁSTICO PARA AJUSTE, CORTE SLIM, PIERNA Y VALENCIANA SEMI JUSTO, CINCO PRESILLAS. SEGÚN MUESTRA PGC19.",OGGI,Pieza,53101502,P,propuesta,13,"2026-03-31 11:48:04","2026-03-31 11:48:04"
14,57,1,1,"PANTALÓN DE GABARDINA PARA CABALLERO COLOR AZUL MARINO, COMPOSICIÓN 98% ALGODÓN 2% ELASTANO, CINCO BOLSILLOS: TRES AL FRENTE Y DOS ATRÁS, CORTE SLIM, PIERNA AJUSTADA, VALENCIANA SEMI AJUSTADA, CIERRE DE CARRO METÁLICO EN BRAGUETA Y BOTÓN METÁLICO, CINCO PRESILLAS, REMACHES METÁLICOS EN BOLSILLOS DELANTEROS. SEGÚN MUESTRA PGC23.",OGGI,Pieza,53101502,P,propuesta,14,"2026-03-31 11:48:04","2026-03-31 11:48:04"
15,153,1,1,"PANTALÓN DE GABARDINA GACELA PARA CABALLERO EN COLOR CAQUI, COMPOSICIÓN 40% POLIÉSTER 60% ALGODÓN, CUATRO BOLSILLOS, DOS AL FRENTE DIAGONAL, DOS ATRÁS CON UN SOLO BOTÓN LADO IZQUIERDO CINTURA MEDIA, CIERRE EN BRAGUETA CON GANCHO Y BOTÓN, CORTE RECTO, SIETE PRESILLAS. SEGÚN MUESTRA PGG01.",GACELA,Pieza,53101502,P,propuesta,15,"2026-03-31 11:48:04","2026-03-31 11:48:04"
16,70,1,1,"PANTALÓN DE VESTIR PARA CABALLERO COLOR NEGRO, COMPOSICIÓN 65% POLIÉSTER 35% VISCOSA, CUATRO BOLSILLOS, DOS AL FRENTE EN DIAGONAL, DOS ATRÁS CON UN SOLO BOTÓN PLÁSTICO LADO DERECHO, CIERRE METÁLICO EN BRAGUETA CON AJUSTE DE CINTURA DE GANCHO Y BOTÓN PLÁSTICO, CORTE RECTO, CINTURA REGULAR, SEIS PRESILLAS. SEGÚN MUESTRA PVC01.","PIETRO CAVALLINI",Pieza,53101502,P,propuesta,16,"2026-03-31 11:48:04","2026-03-31 11:48:04"
17,58,1,1,"PANTALÓN DE GABARDINA PARA DAMA, COLOR NEGRO, COMPOSICIÓN 97% ALGODÓN 3% ELASTANO, CINCO BOLSILLOS; TRES AL FRENTE Y DOS ATRÁS, CINTURA MEDIA, CORTE RECTO, PIERNA Y VALENCIANA RELAJADA, CIERRE DE CARRO METÁLICO EN BRAGUETA, UN BOTÓN METÁLICO PARA AJUSTE, REMACHES METÁLICOS EN BOLSILLOS DELANTEROS, CINCO PRESILLAS. SEGÚN MUESTRA PGD04.",OGGI,Pieza,53101504,P,propuesta,17,"2026-03-31 11:48:04","2026-03-31 11:48:04"
18,59,1,1,"PANTALÓN DE GABARDINA PARA DAMA, COLOR NEGRO, COMPOSICIÓN 97% ALGODÓN 3% ELASTANO, DOS BOLSILLOS EN DIAGONAL AL FRENTE, DOS BOLSAS SIMULADAS ATRÁS TIPO OJAL, CORTE SKINNY, PIERNA Y VALENCIANA AJUSTADA, CIERRE DE CARRO METÁLICO EN BRAGUETA, UN BOTÓN DE PLÁSTICO PARA AJUSTE, CINCO PRESILLAS. SEGÚN MUESTRA PDG08.",OGGI,Pieza,53101504,P,propuesta,18,"2026-03-31 11:48:04","2026-03-31 11:48:04"
19,60,1,1,"PANTALÓN DE GABARDINA PARA DAMA, COLOR AZUL MARINO, COMPOSICIÓN 98% ALGODÓN 2% ELASTANO, CINTURA ALTA, CORTE RECTO, PIERNA Y VALENCIANA RELAJADA, CIERRE DE CARRO METÁLICO Y BOTÓN METÁLICO EN BRAGUETA PARA AJUSTE, CINCO BOLSILLOS: TRES AL FRENTE Y DOS ATRÁS, REMACHES METÁLICOS EN BOLSILLOS DELANTEROS, CINCO PRESILLAS. SEGÚN MUESTRA PGD13",ESCANDIA,Pieza,53101504,P,propuesta,19,"2026-03-31 11:48:04","2026-03-31 11:48:04"
20,71,1,1,"PANTALÓN DE VESTIR PARA DAMA COLOR GRIS OXFORD, TOBILLO CON APERTURA, CONFECCIONADO EN TELA 100% POLIÉSTER, CORTE RECTO, CINTURA MEDIA, CIERRE METÁLICO Y BOTÓN PLÁSTICO PARA AJUSTE DE LA PRENDA AL FRENTE, SIN BOLSAS. SEGÚN MUESTRA PVD01.",VANITY,Pieza,53101504,P,propuesta,20,"2026-03-31 11:48:04","2026-03-31 11:48:04"
21,13,1,8,"MOCHILA ERGONÓMICA COLOR GRIS COMPOSICIÓN 100% NAILON, FORRO 100% POLIÉSTER, CUATRO COMPARTIMIENTOS CON CIERRE, CON ESPACIO PARA LAPTOP, ASA SUPERIOR, RESPALDO Y TIRANTES ACOJINADOS, DOS BOLSAS LATERALES CON MALLA. LOGO EN PARTE DELANTERA. SEGÚN MUESTRA AC68.","Royal Swiss",Pieza,24111514,P,propuesta,21,"2026-03-31 11:48:04","2026-03-31 11:48:04"
22,14,1,8,"MOCHILA ERGONÓMICA COLOR AZUL ACERO, COMPOSICIÓN 100% NAILON, FORRO 100% POLIÉSTER, CUATRO COMPARTIMIENTOS CON CIERRE, ASA SUPERIOR, RESPALDO Y TIRANTES ACOJINADOS, DOS BOLSAS LATERALES CON MALLA. LOGO EN PARTE DELANTERA. SEGÚN MUESTRA AC72.","Swiss Navy",Pieza,24111514,P,propuesta,22,"2026-03-31 11:48:04","2026-03-31 11:48:04"
23,104,1,8,"MALETA DEPORTIVA COLOR NEGRO CON COMPARTIMENTO PRINCIPAL CON CIERRE DOBLE, DOS BOLSILLOS LATERALES, BOLSA DE MALLA Y CIERRE EN LADO DERECHO Y BOLSA DE CIERRE EN LADO IZQUIERDO, MANGOS DOBLE Y CORREAS PARA EL HOMBRO, FABRICADA EN POLIÉSTER 100%. SEGÚN MUESTRA AC02.",Nike,Pieza,53121500,P,propuesta,23,"2026-03-31 11:48:04","2026-03-31 11:48:04"
24,144,1,8,"MALETÍN PORTAHERRAMIENTAS COLOR GRIS Y NARANJA, FABRICADO EN 100% POLIÉSTER DE 300 DENIERS, RECUBIERTA EN SU INTERIOR DE POLI CLORURÓ DE VINILO (PVC), ASA CON VELCRO, CORREA AL HOMBRO Y SEIS COMPARTIMIENTOS. SEGÚN MUESTRA AC63.",Truper,Pieza,27112809,P,propuesta,24,"2026-03-31 11:48:04","2026-03-31 11:48:04"
25,131,1,8,"PORTAFOLIO COLOR NEGRO, CONFECCIONADO 100% POLIÉSTER Y FORRO 100% POLIAMIDA, SEIS BOLSAS CON CIERRE, CINTA AJUSTABLE, AGARRADERA CON VELCRO, ESPACIO PARA LAPTOP. SEGÚN MUESTRA AC64.","X Gear",Pieza,53121704,P,propuesta,25,"2026-03-31 11:48:04","2026-03-31 11:48:04"
26,117,2,9,"BATA DE MÉDICO PARA CABALLERO MANGA LARGA COLOR BLANCO, CONFECCIONADO EN 100% ALGODÓN, CUELLO CON SOLAPA, ALETILLA Y CUATRO BOTONES PARA CERRAR LA PRENDA, ABERTURAS LATERALES, TRES BOLSAS AL FRENTE, CINTA TRASERA CON DOS BOTONES. SEGÚN MUESTRA BMC01.","Nurse Y Doc",Par,42131607,A,propuesta,26,"2026-03-31 11:48:04","2026-03-31 11:48:04"
27,118,2,9,"BATA DE MÉDICO PARA DAMA MANGA LARGA COLOR BLANCO, CONFECCIONADO EN 100% POLIÉSTER, CUELLO CON SOLAPA, ALETILLA Y TRES BOTONES PARA CERRAR LA PRENDA, DOS BOLSILLOS DELANTEROS, CINTA TRASERA, DOS PINZAS AL FRENTE Y EN LA PARTE DE ATRÁS.  SEGÚN MUESTRA BMD01.","Nurse Y Doc",Par,42131607,A,propuesta,27,"2026-03-31 11:48:04","2026-03-31 11:48:04"
28,113,2,9,"BATA PARA ASISTENTE EDUCATIVO COLOR MEZCLILLA, CONFECCIONADAS EN 100% ALGODÓN, DETALLE EN LATERALES CUADRICULADO ROSA, SIN MANGAS, DOS BOLSAS AL FRENTE, CINTA DE AJUSTE EN LATERALES. SEGÚN MUESTRA BAE02.",Journal,Pieza,46181533,P,propuesta,28,"2026-03-31 11:48:04","2026-03-31 11:48:04"
29,27,2,9,"BATA UNISEX TIPO INDUSTRIAL MANGA LARGA EN COLOR AZUL MARINO, CONFECCIONADO EN GABARDINA100% ALGODÓN, CUELLO CON SOLAPA, ALETILLA Y CUATRO BOTONES PARA CERRAR LA PRENDA, TRES BOLSILLOS AL FRENTE, ABERTURAS LATERALES, CINTA TRASERA CON DOS BOTONES. SEGÚN MUESTRA BI01.",Journal,Pieza,46181533,P,propuesta,29,"2026-03-31 11:48:04","2026-03-31 11:48:04"
30,28,2,9,"BATA UNISEX TIPO INDUSTRIAL MANGA LARGA EN COLOR GRIS OXFORD, CONFECCIONADO EN GABARDINA 100% ALGODÓN, CUELLO CON SOLAPA, ALETILLA Y CUATRO BOTONES PARA CERRAR LA PRENDA, TRES BOLSILLOS AL FRENTE, ABERTURAS LATERALES, CINTA TRASERA CON DOS BOTONES. SEGÚN MUESTRA BI02.",Journal,Pieza,46181533,P,propuesta,30,"2026-03-31 11:48:04","2026-03-31 11:48:04"
31,123,2,9,"OVEROL UNISEX COLOR AZUL REY, CONFECCIONADO EN GABARDINA 100% ALGODÓN, CON CINTA REFLEJANTE EN BRAZOS Y PIERNAS, CIERRE REFORZADO AL FRENTE CON DOBLE ACCIÓN, DOS BROCHES DE PRESIÓN EN LA PARTE SUPERIOR DEL CIERRE, DOS BOLSAS DE PARCHE EN LA PARTE SUPERIOR, DOS BOLSAS LATERALES EN DIAGONAL, DOS ABERTURAS A LA CADERA. SEGÚN MUESTRA OV01.",Unitam,Pieza,46181503,P,propuesta,31,"2026-03-31 11:48:04","2026-03-31 11:48:04"
32,132,2,9,"CHALECO DE SEGURIDAD ROJO, FABRICADO EN TELA POLIÉSTER, CON CINTAS DE ALTA VISIBILIDAD AL FRENTE Y EN LA ESPALDA, CIERRE FRONTAL VERTICAL, SEIS BOLSAS FRONTALES: DOS CON CIERRE, DOS TIPOS PARCHE Y DOS CON VELCRO; Y UNA BOLSA TRASERA CON VELCRO. SEGÚN MUESTRA AC77","Sin Marca",Pieza,46181507,P,propuesta,32,"2026-03-31 11:48:04","2026-03-31 11:48:04"
33,109,2,9,"LENTES DE SEGURIDAD CON PATILLAS AJUSTABLES, MICA AZUL ESPEJO DE POLICARBONATO CON PROTECCIÓN UV Y ANTIRAYADURAS, PUENTE SUAVE. CUMPLE CON LA NORMA ANSI Z87.1. SEGÚN MUESTRA AC32.",Truper,Pieza,46181802,P,propuesta,33,"2026-03-31 11:48:04","2026-03-31 11:48:04"
34,137,2,9,"GOGGLES DE SEGURIDAD DE VISIÓN PANORÁMICA O PERIFÉRICA, MICA TRASPARENTE DE POLICARBONATO CON PROTECCIÓN UV Y ANTIRAYADURAS, AJUSTADOR ELÁSTICO, ARMAZÓN SUAVE Y FLEXIBLE, CUMPLE CON LA NORMA ANSI Z87.1. SEGÚN MUESTRA AC24.",Truper,Pieza,46181811,P,propuesta,34,"2026-03-31 11:48:04","2026-03-31 11:48:04"
35,156,2,9,"GOGGLES PARA NATACIÓN TRANSPARENTE CON CORREA FÁCILMENTE AJUSTABLE, LENTES CON VENTANA LATERAL, ANTIEMPAÑANTES, PUENTE PARA LA NARIZ, SIN FILTRACIONES DE AGUA, CON PROTECCIÓN UV. SEGÚN MUESTRA AC43.",Arena,Pieza,49141606,P,propuesta,35,"2026-03-31 11:48:04","2026-03-31 11:48:04"
36,127,2,9,"BOTAS TIPO JARDINERA COLOR NEGRO, FABRICADA EN PVC, EMPEINE Y TOBILLOS CONFORTABLES, PUNTA REFORZADA, SUELA ANTIDERRAPANTE, ALTURA 35 CM. SEGÚN MUESTRA AC03.",Truper,Par,46181604,A,propuesta,36,"2026-03-31 11:48:04","2026-03-31 11:48:04"
37,111,2,9,"BOTA PANTALONERA COLOR NEGRO, FABRICADA CON PETO DE PVC (CLORURO DE POLIVINILO) AHULADO SELLADO A LA BOTA DE PVC 100% IMPERMEABLE, CON TIRANTES ELÁSTICOS AJUSTABLES. SEGÚN MUESTRA AC52.","Dita Flex",Par,46181604,A,propuesta,37,"2026-03-31 11:48:04","2026-03-31 11:48:04"
38,1,2,9,"FAJA DE PROTECCIÓN LUMBAR, FABRICADA EN FIBRAS SINTÉTICAS, TIRANTES AJUSTABLES, VARILLAS EN ESPALDA Y CINTURÓN AJUSTABLE CON CIERRE MEDIANTE VELCRO. SEGÚN MUESTRA AC04.",Truper,Pieza,46182201,P,propuesta,38,"2026-03-31 11:48:04","2026-03-31 11:48:04"
39,107,2,9,"FAJA DE PROTECCIÓN, FABRICADO CON DOBLE MALLA ELÁSTICA TRANSPIRABLE DE FIBRAS SINTÉTICAS, CON 3 VARILLAS PARA SOPORTE LUMBAR Y CIERRE CON VELCRO. SEGÚN MUESTRA AC14.",Truper,Pieza,46182201,P,propuesta,39,"2026-03-31 11:48:04","2026-03-31 11:48:04"
40,80,2,9,"RESPIRADOR MEDIA CARA DE DOS FILTROS, PARA PROTECCIÓN MULTI-GAS/VAPORES ORGÁNICOS, CON CARTUCHOS INCLUIDOS Y BANDAS ELÁSTICAS AJUSTABLES. CUMPLE CON LA APROBACIÓN KOSHA. SEGÚN MUESTRA AC05.",Truper,Pieza,46182002,P,propuesta,40,"2026-03-31 11:48:04","2026-03-31 11:48:04"
41,135,2,9,"RESPIRADOR MEDIA CARA DE UN FILTRO, PARA PROTECCIÓN MULTIGAS/VAPORES ORGÁNICOS, BANDA ELÁSTICA AJUSTABLE, NO INCLUYE CARTUCHO. SEGÚN MUESTRA AC07.",Pretul,Pieza,46182002,P,propuesta,41,"2026-03-31 11:48:04","2026-03-31 11:48:04"
42,128,2,9,"RESPIRADOR DESECHABLE CON VÁLVULA, PARA PROTECCIÓN CONTRA POLVO Y PARTÍCULAS SIN ACEITE, PARA APLICACIONES INDUSTRIALES, BANDA ELÁSTICA AJUSTABLE Y PUENTE NASAL SUAVE. CUMPLE CON LA APROBACIÓN KOSHA. SEGÚN MUESTRA AC08",Truper,Pieza,46182002,P,propuesta,42,"2026-03-31 11:48:04","2026-03-31 11:48:04"
43,139,2,9,"CARTUCHO DE REPUESTO PARA RESPIRADOR DE PROTECCIÓN MULTI-GAS/VAPORES ORGÁNICOS. CUMPLE CON LA APROBACIÓN  KOSHA. SEGÚN MUESTRA AC06.",Truper,Pieza,46182005,P,propuesta,43,"2026-03-31 11:48:04","2026-03-31 11:48:04"
44,81,2,9,"LINTERNA LED DE MANO RECARGABLE FABRICADA EN PLÁSTICO, 350 LÚMENES, PILA RECARGABLE DE ION LITIO PROTECCIÓN IPX3 CONTRA AGUA Y POLVO INCLUYE CABLE USB DE CARGA. SEGÚN MUESTRA AC10.",Truper,Pieza,39111610,P,propuesta,44,"2026-03-31 11:48:04","2026-03-31 11:48:04"
45,105,2,9,"LÁMPARA LED DE MANO, CUERPO DE ALUMINIO, 500 LÚMENES, UTILIZA PILA RECARGABLE, LENTE CON LUPA, PROTECCIÓN CONTRA POLVO Y AGUA Y CARGADOR, TRES MODOS DE ILUMINACIÓN, ALTO, MEDIO, BAJO, INTERMITENTE Y SOS. SEGÚN MUESTRA AC11.",Truper,Pieza,39112006,P,propuesta,45,"2026-03-31 11:48:04","2026-03-31 11:48:04"
46,110,2,9,"SLEEPING COLOR AZUL MARINO, COMPOSICIÓN FORRO Y REVESTIMIENTO 100% POLIÉSTER INCLUYE CAPUCHA, CIERRE DE CARRO METÁLICO, BOLSA DE TRANSPORTE. SEGÚN MUESTRA AC36.",Coleman,Pieza,49121504,P,propuesta,46,"2026-03-31 11:48:04","2026-03-31 11:48:04"
47,141,2,9,"PORTA HERRAMIENTA GRANDE DE CARNAZA, CON 13 COMPARTIMIENTOS CON COSTURA REFORZADA Y CINTURÓN AJUSTABLE CON BROCHE DE PLÁSTICO. SEGÚN MUESTRA AC12.",Truper,Pieza,27112809,P,propuesta,47,"2026-03-31 11:48:04","2026-03-31 11:48:04"
48,142,2,9,"PORTA HERRAMIENTA GRANDE DE POLIÉSTER, CON 20 COMPARTIMIENTOS, COSIDO Y REMACHADO, PORTA MARTILLOS, CLIP METÁLICO PARA FLEXÓMETRO Y CINTURÓN AJUSTABLE DE BROCHE DE PLÁSTICO. SEGÚN MUESTRA AC13.",Truper,Pieza,27112809,P,propuesta,48,"2026-03-31 11:48:04","2026-03-31 11:48:04"
49,148,2,9,"FILTRO DE POLICARBONATO DEL NO. 12 PARA CARETA DE SOLDAR, RESISTENTE A LOS IMPACTOS. SEGÚN MUESTRA AC18.",Truper,Pieza,40161500,P,propuesta,49,"2026-03-31 11:48:04","2026-03-31 11:48:04"
50,149,2,9,"PROTECTOR FACIAL CON MICA DE POLICARBONATO ANTIRAYADURAS, PARA PROTECCIÓN DE ROSTRO Y CUELLO, AJUSTADOR DE MATRACA. SEGÚN MUESTRA AC19.",Truper,Pieza,46181709,P,propuesta,50,"2026-03-31 11:48:04","2026-03-31 11:48:04"
51,129,2,9,"CASCO DE SEGURIDAD COLOR AMARILLO, TIPO 1 CLASE E, FABRICADO EN POLIETILENO DE ALTA DENSIDAD CON AJUSTADOR DE MATRACA, RESISTENCIA ELÉCTRICA HASTA DE 20,000 V. CUMPLE CON LA NORMA NOM-115-STPS-2009 Y ANSI/ISEA-Z89.1-2014. SEGÚN MUESTRA AC2.",Truper,Pieza,46181704,P,propuesta,51,"2026-03-31 11:48:04","2026-03-31 11:48:04"
52,147,2,9,"CASCO DE SEGURIDAD CLASE C, FABRICADO EN ALUMINIO COLOR NATURAL, SUSPENSIÓN DE 4 PUNTOS, CON REFUERZO ADICIONAL EN LA PARTE SUPERIOR CENTRAL PARA SOPORTAR IMPACTOS. SEGÚN MUESTRA AC58.",Infra,Pieza,46181704,P,propuesta,52,"2026-03-31 11:48:04","2026-03-31 11:48:04"
53,12,2,9,"CASCO PARA MOTOCICLISTA EN COLOR NEGRO MATE, RENDIJA DE VENTILACIÓN EN LA PARTE SUPERIOR, ABATIBLE, MICA TRANSPARENTE DE POLICARBONATO, LENTE OBSCURO INTEGRADO DE POLICARBONATO, ANTIRAYADURAS, INTERIOR ACOJINADO, BROCHE MILIMÉTRICO PARA AJUSTE, CUMPLE CON LA CERTIFICACIÓN DOT FMVSS NO 218.  SEGÚN MUESTRA AC65.",R7,Pieza,46181705,P,propuesta,53,"2026-03-31 11:48:04","2026-03-31 11:48:04"
54,152,2,9,"CASCO PARA CICLISTA COLOR BLANCO CON DETALLE ROJO, CON SISTEMA DE AJUSTE, CON VENTILACIÓN, IDEAL PARA ADULTOS. SEGÚN MUESTRA AC75.",Helmet,Pieza,49221504,P,propuesta,54,"2026-03-31 11:48:04","2026-03-31 11:48:04"
55,150,2,9,"CARETA PARA SOLDAR COLOR NEGRO CON LENTE ABATIBLE, PARA SOLDAR CON ELECTRODO, PROTECCIÓN TOTAL DE CARA Y CUELLO VENTANILLA MÓVIL, CON LENTES INTERCAMBIABLES SUSPENSIÓN TIPO MATRACA, FABRICADA EN PLÁSTICO CON SUSPENSIÓN DE AJUSTE TIPO MATRACA, CUMPLE CON NORMA ANSI Z87.1. SEGÚN MUESTRA AC22.",Truper,Pieza,46181703,P,propuesta,55,"2026-03-31 11:48:04","2026-03-31 11:48:04"
56,108,2,9,"IMPERMEABLE TIPO GABARDINA COLOR AMARILLO, FABRICADO EN PVC DE 5 CM DE ESPESOR EN BRAZOS, FORRO INTERIOR DE POLIÉSTER, CAPUCHA AJUSTABLE CON CORDÓN, CIERRE Y/O BROCHES A PRESIÓN PARA EL CIERRE DE LA PRENDA CAPA DE VENTILACIÓN EN ESPALDA Y ABERTURAS BAJO LOS BRAZOS BOLSILLOS DE PARCHE CON SOLAPA AL FRENTE. SEGÚN MUESTRA AC28.","Mr Seguridad",Pieza,23141607,P,propuesta,56,"2026-03-31 11:48:04","2026-03-31 11:48:04"
57,106,2,9,"CONJUNTO IMPERMEABLE DE DOS PIEZAS COLOR AMARILLO: CHAMARRA QUE INCLUYE AJUSTE CON CORDÓN, CIERRE TIPO ZIPPER REFORZADO DE PLÁSTICO, SOLAPA CON 4 BROCHES DE AJUSTE A PRESIÓN, CAPUCHA, PANTALÓN CON AJUSTE ELÁSTICO EN LA CINTURA, REFUERZO EN ENTREPIERNA; AJUSTE DE BROCHES EN MUÑECAS Y PIERNAS, REFLEJANTES DE 2""/5 CM PLASTIFICADOS EN BRAZOS Y PIERNAS. SEGÚN MUESTRA AC131.","Mr Seguridad",Conjunto,23141607,D,propuesta,57,"2026-03-31 11:48:04","2026-03-31 11:48:04"
58,2,2,9,"JUEGO DE IMPERMEABLE UNISEX TIPO DEPORTIVO, CONFECCIONADO EN TELA 100 % POLIÉSTER; CHAMARRA COLOR VERDE OLIVO, CON REFLEJANTE AL FRENTE A LA ALTURA DE LOS HOMBROS, Y EN ESPALDA, CON DOS BOLSAS LATERALES, CIERRE DE CARRO METÁLICO AL FRENTE PARA AJUSTE, RESORTE EN PUÑOS, CUELLO ALTO CON GORRO; PANTS COLOR NEGRO LISO, AJUSTE ELÁSTICO EN CINTURA, DOS BOLSAS LATERALES, REFLEJANTE AL FRENTE. SEGÚN MUESTRA AC102.",Journal,Juego,23141607,J,propuesta,58,"2026-03-31 11:48:04","2026-03-31 11:48:04"
59,3,2,9,"CHAMARRA IMPERMEABLE UNISEX TIPO DEPORTIVO, CONFECCIONADO EN TELA 100 % POLIÉSTER; CHAMARRA COLOR VERDE OLIVO, CON REFLEJANTE AL FRENTE A LA ALTURA DE LOS HOMBROS, Y EN ESPALDA, CON DOS BOLSAS LATERALES, CIERRE DE CARRO METÁLICO AL FRENTE PARA AJUSTE, RESORTE EN PUÑOS. SEGÚN MUESTRA AC107.",Journal,Pieza,23141607,P,propuesta,59,"2026-03-31 11:48:04","2026-03-31 11:48:04"
60,151,2,9,"AHUYENTADOR DE PERROS FABRICADO PLÁSTICO RESISTENTE A IMPACTOS, PORTÁTIL, COMPACTO Y LIGERO, FUNCIONA CON BATERÍA DE 9V. SEGÚN MUESTRA AC34.",Dazzer,Pieza,60131105,P,propuesta,60,"2026-03-31 11:48:04","2026-03-31 11:48:04"
61,4,2,9,"GUANTE DE LÁTEX 100% NATURAL, COLOR NEGRO DE USO INDUSTRIAL Y LABORATORIOS, PARA MANEJO DE ÁCIDOS Y PRODUCTOS QUÍMICOS, PUÑO ENROLLADO, PUÑO EXTRA LARGO PARA PROTECCIÓN DE ANTEBRAZO. SEGÚN MUESTRA AC26.",Truper,Par,42132200,A,propuesta,61,"2026-03-31 11:48:04","2026-03-31 11:48:04"
62,5,2,9,"GUANTE DE LÁTEX NATURAL COLOR NARANJA, PUÑO LARGO Y SUPERFICIE DE PALMA ANTIDERRAPANTE, PARA LIMPIEZA DOMÉSTICA, DETERGENTES, JABONES Y PRODUCTOS QUÍMICOS LIGEROS. SEGÚN MUESTRA AC27.",Truper,Par,42132200,A,propuesta,62,"2026-03-31 11:48:04","2026-03-31 11:48:04"
63,15,2,9,"GUANTE DE LÁTEX COLOR NEGRO PARA TRABAJOS DE PINTADO Y ACTIVIDADES DE AGRICULTURA, INTERIOR AFELPADO CON PUÑO LARGO. SEGÚN MUESTRA AC74.",Truper,Par,42132200,A,propuesta,63,"2026-03-31 11:48:04","2026-03-31 11:48:04"
64,9,2,9,"GUANTE DE LÁTEX PARA EXPLORACIÓN ESTÉRIL, DESECHABLE, AMBIDIESTRO, ATOXICO EN COLOR NATURAL, PUÑO ENROLLADO, AJUSTE CÓMODO. SEGÚN MUESTRA AC42.",Ambiderm,Par,42132200,A,propuesta,64,"2026-03-31 11:48:04","2026-03-31 11:48:04"
65,6,2,9,"GUANTES DE CARNAZA UNITALLA PARA SOLDADURA Y HERRERÍA, PUÑO LARGO PARA PROTECCIÓN EN ANTEBRAZO, CON FORRO INTERNO TEXTIL, PROTECCIÓN ADICIONAL CONTRA CHISPAS Y SALPICADURAS AL SOLDAR. SEGÚN MUESTRA AC37.",Truper,Par,46181504,A,propuesta,65,"2026-03-31 11:48:04","2026-03-31 11:48:04"
66,82,2,9,"GUANTE DE CARNAZA UNITALLA PARA ELECTRICISTA Y PROCESO DE SOLDADURA LIGERA, PUÑO CORTO CON AJUSTE EN MUÑECA, REFUERZO EN PALMAS. SEGÚN MUESTRA AC38.",Truper,Par,46181504,A,propuesta,66,"2026-03-31 11:48:04","2026-03-31 11:48:04"
67,7,2,9,"GUANTE DE CARNAZA COLOR AMARILLO UNITALLA, PUÑOS DE SEGURIDAD, IDEAL PARA MANEJO DE MATERIALES DE CONSTRUCCIÓN. SEGÚN MUESTRA AC39.",Pretul,Par,46181504,A,propuesta,67,"2026-03-31 11:48:04","2026-03-31 11:48:04"
68,10,2,9,"GUANTE DIELÉCTRICO COLOR AMARILLO, PIEL VACUNA, CON AJUSTADOR EN MUÑECA, MANEJO DE HERRAMIENTAS ELÉCTRICAS. SEGÚN MUESTRA AC49.",S/M,Par,46181504,A,propuesta,68,"2026-03-31 11:48:04","2026-03-31 11:48:04"
69,136,2,9,"GUANTES UNITALLA EN COLOR BLANCO, FABRICADOS EN ALGODÓN CON APLICACIONES DE PUNTOS NEGROS DE PVC, TEJIDO ELÁSTICO EN MUÑECA. SEGÚN MUESTRA AC17.",Pretul,Par,46181504,A,propuesta,69,"2026-03-31 11:48:04","2026-03-31 11:48:04"
70,143,2,9,"GUANTE PARA MANEJO DE ARCHIVOS BLANCO, FABRICADO EN TELA 100 % ALGODÓN PARA MANEJO DE ARCHIVO. SEGÚN MUESTRA AC59.",S/M,Par,46181504,A,propuesta,70,"2026-03-31 11:48:04","2026-03-31 11:48:04"
71,11,2,9,"GUANTE PARA MOTOCICLISTA COLOR NEGRO, CONFECCIONADO EN 60% POLIÉSTER 20% NYLON 20% POLIVINILO, DISEÑO DEPORTIVO, RESISTENTES A LA ABRASIÓN, PROTECCIÓN EN NUDILLOS, ANTIDERRAPANTE EN PALMA Y AJUSTE EN LA MUÑECA DE VELCRO. SEGÚN MUESTRA AC53.",Roda,Par,46181504,A,propuesta,71,"2026-03-31 11:48:04","2026-03-31 11:48:04"
72,84,2,9,"GUANTE PARA EL FRIO UNISEX, COLOR NEGRO, FABRICADO EN 100% POLIÉSTER CON FORRO TEXTIL, CON AJUSTADOR DE HEBILLA, APLICACIONES DE PUNTOS NEGROS EN LA PALMA ANTIDERRAPANTE. SEGÚN MUESTRA AC57.",S/M,Par,46181504,A,propuesta,72,"2026-03-31 11:48:04","2026-03-31 11:48:04"
73,130,2,9,"GUANTE DE MEDIO DEDO PARA PESISTA COLOR NEGRO, CONFECCIONADO EN PIEL, FORRO SINTÉTICO, CON AJUSTADOR VELCRO CON DISEÑO ERGONÓMICO. SEGÚN MUESTRA AC60.",S/M,Par,46181504,A,propuesta,73,"2026-03-31 11:48:04","2026-03-31 11:48:04"
74,8,2,9,"CUBRE BOCA EN BLANCO Y AZUL DE ALGODÓN, CON TRES PLIEGUES AL CENTRO PARA MEJOR AJUSTE, DE TELA NO TEJIDA DESECHABLE SELLADO AL CALOR PARA MAYOR PROTECCIÓN, BANDA ELÁSTICA. SEGÚN MUESTRA AC41.",S/M,Pieza,42131606,P,propuesta,74,"2026-03-31 11:48:04","2026-03-31 11:48:04"
75,154,2,9,"GORRO PARA PANADERO EN COLOR NEGRO, CONFECCIONADO EN TELA 65% POLIÉSTER 35% ACRÍLICO. SEGÚN MUESTRA AC113.",Journal,Pieza,46181522,P,propuesta,75,"2026-03-31 11:48:04","2026-03-31 11:48:04"
76,140,2,9,"MANDIL PARA COCINERO EN FABRICADO EN TELA 100% POLIÉSTER, TRES BOLSAS AL FRENTE, CINTA AL CUELLO, CINTAS PARA AJUSTE EN LA CINTURA. SEGÚN MUESTRA AC112.",Journal,Pieza,46181501,P,propuesta,76,"2026-03-31 11:48:04","2026-03-31 11:48:04"
77,83,2,9,"MANDIL DE CARNAZA PARA SOLDAR COLOR AMARILLO, CORTE VACUNO, CINTAS PARA AJUSTE DE CINTURA Y CINTA EN CUELLO. SEGÚN MUESTRA AC51.",S/M,Pieza,46181501,P,propuesta,77,"2026-03-31 11:48:04","2026-03-31 11:48:04"
