id,partida_id,tipo_partida_especifica_id,lote,descripcion,marca,unidad_medida,codigo,medida,origen,legacy_propuesta_id,created_at,updated_at
625,99,1,,"PANTALON DE MEZCLILLA PARA CABALLERO COLOR AZUL MEDIO, COMPOSICION 98% ALGODÓN 2% ELASTANO,CINCO BOLSILLOS: TRES AL FRENTE Y DOS ATRAS, CIERRE DE CARRO METALICO EN BRAGUETA Y BOTON METALICO PARA AJUSTE, CORTE RECTO, CINTURA ALTA, PIERNA Y VALENCIANA RELAJADA Y SEIS PRESILLAS.SEGUN MUESTRA PMC27.",,PZA,,,concentrado,,"2026-03-31 11:49:44","2026-03-31 12:17:54"
626,99,1,,"PANTALON DE MEZCLILLA PARA CABALLERO COLOR AZUL MARINO, CONFECCIONADO EN TELA 100% ALGODÓN,CINCO BOLSILLOS: TRES AL FRENTE Y DOS ATRÁS, CIERRE DE CARRO METALICO EN BRAGUETA Y BOTON METALICO PARA AJUSTE, CORTE RECTO, CINTURA ALTA, PIERNA RELAJADA, VALENCIANA PARA BOTA  Y CINCO PRESILLAS. SEGÚN MUESTRA PMC33.",,PZA,,,concentrado,,"2026-03-31 11:49:44","2026-03-31 12:17:54"
627,99,1,,"PANTALON DE MEZCLILLA PARA CABALLERO COLOR NEGRO, CONFECCIONADO EN TELA 71% ALGODÓN,27% POLIESTER 2% ELASTANO, CINCO BOLSILLOS: TRES AL FRENTE Y DOS ATRÁS, CIERRE DE CARRO METALICO EN BRAGUETA Y BOTON METALICO PARA AJUSTE, CORTE RECTO, CINTURA ALTA, PIERNA RELAJADA, VALENCIANA PARA BOTA  Y SEIS PRESILLAS. SEGÚN MUESTRA PMC34.",,PZA,,,concentrado,,"2026-03-31 11:49:44","2026-03-31 12:17:54"
628,68,1,,"PANTALON DE MEZCLILLA PARA DAMA COLOR AZUL BLEACH, COMPOSICIÓN 87% ALGODÓN 11% POLIESTER 2% ELASTANO, CINCO BOLSILLOS: TRES ADELANTE Y DOS ATRÁS, CINTURA MEDIA, CIERRRE DE CARRO METALICO EN BRAGUETA Y BOTÓN METÁLICO PARA AJUSTE, CORTE SUPER SKINNY, CON REMACHES METALICOS EN LOS BOLSILLOS DELANTEROS ,  CINCO PRESILLAS. SEGÚN MUESTRA PMD010",,PZA,,,concentrado,,"2026-03-31 11:49:44","2026-03-31 12:17:54"
629,68,1,,"PANTALON DE MEZCLILLA PARA DAMA COLOR AZUL STONE COMPOSICIÓN 83.5% ALGODÓN 14.5% POLIESTER 2% ELASTANO, CINCO BOLSILLOS: TRES AL FRENTE Y DOS ATRÁS, CINTURA ALTA, CIERRRE  DE CARRO METALICO EN BRAGUETA Y DOS BOTONES METÁLICOS PARA AJUSTE, CORTE SUPER SKINNY, CON REMACHES METALICOS EN LOS BOLSILLOS DELANTEROS, PUSH UP, CINCO PRESILLAS, SEGUN MUESTRA PMD08.",,PZA,,,concentrado,,"2026-03-31 11:49:44","2026-03-31 12:17:54"
630,69,1,,"PANTALON DE MEZCLILLA PARA DAMA COLOR STONE, COMPOSICIÓN 64% ALGODÓN 29.3% POLIESTER 3.9% VISCOSA 2.8% ELASTANO, CINCO BOLSAS: TRES AL AFRENTE Y DOS ATRAS, CIERRE DE CARRO METALICO EN BRAGUETA Y BOTÓNMETALICO PARA AJUSTE, CORTE SKINNY, TIRO MEDIO, PIERNA Y VALENCIANA SEMI AJUSTADA, CON REMACHES EN BOLSILLOS DELANTEROS, CINCO PRESILLAS, SEGUN MUESTRA PMD17.",,PZA,,,concentrado,,"2026-03-31 11:49:44","2026-03-31 12:17:54"
631,100,1,,"PANTALON DE MEZCLILLA PARA DAMA AZUL CLARO, CONFECCIONADO EN 67.4% ALGODÓN, 23% POLIESTER, 3% ELASTANO, CINCO BOLSILLOS: TRES AL FRENTE Y DOS ATRAS, TIRO MEDIO, CIERRE DE CARRO METALICO EN BRAGUETA Y BOTÓN METALICO PARA AJUSTE, CORTE SKINNY, PUSH UP, PIERNA Y VALENCIANA JUSTA, CON REMACHES METALICOS EN LOS BOLSILLOS DELANTEROS, CINCO PRESILLAS, SEGÚN MUESTRA PMD31.",,PZA,,,concentrado,,"2026-03-31 11:49:44","2026-03-31 12:17:54"
632,100,1,,"PANTALON DE MEZCLILLA PARA DAMA COLOR NEGRO, CONFECCIONADO EN 70% ALGODÓN, 28% POLIESTER, 2% ELASTANO, CINCO BOLSILLOS TRES AL FRENTE Y DOS ATRAS, TIRO BAJO, CIERRE DE CARRO METALICO EN BRAGUETA Y BOTÓN METALICO PARA AJUSTE, CORTE RECTO, PUSH UP, PIERNA Y VALENCIANA RECTO, CON REMACHES METALICOS EN  LOS BOLSILLOS DELANTEROS, CINCO PRESILLAS, SEGÚN MUESTRA PMD27.",,PZA,,,concentrado,,"2026-03-31 11:49:44","2026-03-31 12:17:54"
633,72,1,,"ZAPATO DE VESTIR PARA CABALLERO COLOR TAN, CORTE VACUNO ACABADO PIEL LISA, FORRO TEXTIL, SUELA SINTETICA COLOR CAFE OSCURO,  PLANTILLA DE CERDO,  OCHO OJILLOS PERFORADOS, AJUSTE DE AGUJETAS COLOR CAF? OSCURO, PESPUNTES VISIBLES,PUNTERA REDONDA, SEGÚN MUESTRA ZC04",,PZA,,,concentrado,,"2026-03-31 11:49:44","2026-03-31 12:17:54"
634,102,1,,"ZAPATO DE VESTIR PARA CABALLERO COLOR OPORTO,CORTE VACUNO ACABADO PIEL TEXTURIZADO,FORRO TEXTIL,SUELA SINTETICA COLOR CAF? OSCURO,PLANTILLA DE CERDO,OCHO OJILLOS PERFORADOS,AJUSTE DE AGUJETAS COLOR CAFE,PESPUNTES VISIBLES,PUNTA REDONDA,SEGÚN MUESTRA ZC12.",,PZA,,,concentrado,,"2026-03-31 11:49:44","2026-03-31 12:17:54"
635,76,1,,"ZAPATO DE VESTIR PARA CABALLERO COLOR  NEGRO, CORTE SINTETICO, ACABADO LISO, FORRO TEXTIL, SUELA SINTETICA COLOR NEGRO/CAFE, SEIS OJILLOS PERFORADOS,DOS OJILLOS METALICOS COLOR NEGRO, AJUSTE DE AGUJETA COLOR NEGRO, AJUSTE DE RESORTE PARA MEJORAR ,PUNTERA REDONDA, CON CINTA PARA FACILITAR EL CALZADO. SEGÚN MUESTRA ZC36",,PZA,,,concentrado,,"2026-03-31 11:49:44","2026-03-31 12:17:54"
636,76,1,,"ZAPATO DE VESTIR PARA CABALLERO COLOR FERRERO CORTE SINTETICO ACABADO TEXTURIZADO, FORRO TEXTIL, SUELA SINTETICA COLOR BLANCO,SEIS OJILLOS PERFORADOS,DOS OJILLOS METALICOS, PLANTILLA SINTETICA, AJUSTE DE AGUJETA COLOR CAFE, CON CINTA PARA FACILITAR EL CALZADO,PUNTERA OVALADA, SEGÚN MUESTRA ZC40.",,PZA,,,concentrado,,"2026-03-31 11:49:44","2026-03-31 12:17:54"
637,76,1,,"ZAPATO DE VESTIR PARA CABALLERO COLOR CHOCOLATE, CORTE VACUNO, ACABADO PIEL LISO, FORRO PORCINO, SUELA SINTETICA COLOR CHOCOLATE/BLANCO,PESPUNTES VISIBLES, OCHO OJILLOS PERFORADOS, AJUSTE DE AGUJETA COLOR CHOCOLATE,PUNTERA REDONDA.SEGÚN MUESTRA ZC35",,PZA,,,concentrado,,"2026-03-31 11:49:44","2026-03-31 12:17:54"
638,134,1,,"SANDALIA PARA DAMA COLOR MEZCLILLA,CORTE VACUNO ACABADO TEXTURIZADO, FORRO DE CERDO, SUELA SINTETICA  COLOR CAFE CON TACON,CHINELA  GRUESA,CINTA DE AJUSTE  CON CINCO PERFORACIONES Y HEBILLA METALICA,PESPUNTES VISIBLES. SEGÚN MUESTRA ZD25.",,PZA,,,concentrado,,"2026-03-31 11:49:44","2026-03-31 12:17:54"
639,79,1,,"ZAPATO DE VESTIR PARA DAMA COLOR NEGRO CORTE SINTETICO, ACABADO TEXTURIZADO,FORRO SINTETICO ACOJINADO,SUELA SINTETICA COLOR BLANCO, DIEZ OJILLOS PERFORADOS, AJUSTE DE AGUJETA COLOR NEGRO,REFORZADO EN PUNTA Y TOBILLO, PESPUNTES VISIBLES, GRABADO DE LOGO EN PARTE EXTERIOR. SEGUN MUESTRA ZD29.",,PZA,,,concentrado,,"2026-03-31 11:49:44","2026-03-31 11:49:44"
640,103,1,,"ZAPATO DE VESTIR PARA DAMA COLOR ANTIMONIO , CORTE VACUNO,ACABADO PIEL LISA, FORRO SINTETICO, SUELA SINTETICA COLOR MADERA CON PLATAFORMA,PLANTILLA CERDO,CHINELA CRUZAD,CINTA CON VELCRO PARA AJUSTE DE CALZADO,HEBILLA METALICA ZD45.",,PZA,,,concentrado,,"2026-03-31 11:49:44","2026-03-31 11:49:44"
641,87,1,,"BOTA PARA DAMA COLOR NEGRO CORTE VACUNO  ACABADO PIEL LISA, FORRO TEXTIL ACOJINADO, SUELA SINTETICA COLOR NEGRA, CON AJUSTE DE RESORTE EN LOS LATERALES, CINTA PARA FACILITAR EL CALZADO, SIN BULLON , REFUERZO EN PUNTA CON ACABADOTEXTURIZADO, GRABADO DE LOGO EN PARTE EXTERIOR. SEGÚN MUESTRA BD31.",,PZA,,,concentrado,,"2026-03-31 11:49:44","2026-03-31 12:17:54"
642,26,1,,"BOTA PARA DAMA COLOR NEGRO CORTE SINTETICO, FORRO TEXTIL ACOJINADO, SUELA SINTETICA COLOR NEGRO,BULLON TEXTIL CON CINTA PARA FACILITAR EL CALZADO, DIEZ OJILLOS METALICOS, AGUJETA COLOR NEGRO,  REFUERZO EN PUNTA, PESPUNTES VISIBLES, GRABADO DE LOGO EN LA PARTE EXTERIOR. SEGÚN MUESTRA BD44",,PZA,,,concentrado,,"2026-03-31 11:49:44","2026-03-31 12:17:54"
643,31,1,,"BLUSA DE VESTIR PARA DAMA, SIN MANGA. COLOR AMARILLO LIMON, CONFECCIONADA EN TELA 10% POLIESTER, CUELLO SPORT, ESCOTE EN V, PINZAS AL FRENTE A LA ALTUR ADEL PECHO, AJUSTE DE CINTA EN CINTURA. SEGÚN MUESTRA BV29.",,PZA,,,concentrado,,"2026-03-31 11:49:44","2026-03-31 12:17:54"
644,33,1,,"BLUSA DE VESTIR PARA DAMA,  COLOR VERDE MANZANA, ACABADO DE BORDADO EN FLORES, COMPOSICION 100% POLIESTER,  MANGA CORTA , PINZA A LA ALTURA DEL PECHO Y EN ESPALDA,  ESCOTE EN V, FORRO INTERIOR, ONDEADO EN LA PARTE INFERIOR .SEGUN MUESTRA BV59.",,PZA,,,concentrado,,"2026-03-31 11:49:44","2026-03-31 11:49:44"
645,39,1,,"CHAMARRA DE CABALLERO COLOR NEGRO, CONFECCIONADO EN TELA 100 % POLIESTER, REPELENTE AL AGUA, FORRO POLIESTER, DOS BOLSILLOS DELANTEROS CON CIERRE A LA ALTURA DEL ABDOMEN, CIERRE  DE CARRO METALICO AL FRENTE, CUELLO TIPO SPORT, TEJIDO EN CUELLO, PU?OS Y PRETINA, BOLSA OCULTA A LA ALTURA DEL PECHO DE LADO IZQUIERDO . SEGÚN MUESTRA CHC24.",,PZA,,,concentrado,,"2026-03-31 11:49:44","2026-03-31 12:17:54"
646,42,1,,"CHAMARRA PARA DAMA COLOR AZUL MARINO , CONFECCIONADA EN TELA POLIAMIDA REPELENTE AL AGUA, FORRO POLIAMIDA, RELLENO POLIESTER, CAPITONADO HORIZONTAL, DOS BOLSILLOS CON CIERRE AL FRENTE, CIERRE DE CARRO METALICO AL FRENTE AL FRENTE, CUELLO ALTO, CORTE CON SILUETA, BOLSA OCULTA A LA ALTURA DEL ABDOMEN DE LADO IZQUIERDO, BOLSA PARA FACILITAR SU GUARDADO. SEGÚN MUESTRA CHD13",,PZA,,,concentrado,,"2026-03-31 11:49:44","2026-03-31 12:17:54"
647,58,1,,"PANTALON DE GABARDINA PARA DAMA, COLOR AZUL MARINO, COMPOSICIÓN 97% ALGODÓN 3% ELASTANO,  CINCO BOLSILLOS; TRES AL FRENTE Y DOS ATRÁS, CINTURA MEDIA, CORTE RECTO, PIERNA Y VALENCIANA RELAJADA, CIERRE DE CARRO METALICO  EN BRAGUETA, UN BOTÓN METÁLICO PARA AJUSTE, REMACHES METALICOS EN BOLSILLOS DELANTEROS, CINCO PRESILLAS. SEGÚN MUESTRA PGD03",,PZA,,,concentrado,,"2026-03-31 11:49:44","2026-03-31 12:17:54"
648,59,1,,"PANTALÓN DE GABARDINA PARA DAMA, COLOR VERDE OLIVO, COMPOSICIÓN 97% ALGODÓN 3% ELASTANO, DOS BOLSILLOS EN DIAGONAL AL FRENTE, DOS BOLSAS SIMULADAS ATRÁS TIPO OJAL, CORTE SKINNY, PIERNA Y VALENCIANA AJUSTADA,  CIERRE DE CARRO  METALICO EN BRAGUETA, UN BOTON DE PL?STICO PARA AJUSTE, CINCO PRESILLAS. SEGUN MUESTRA PDG06",,PZA,,,concentrado,,"2026-03-31 11:49:44","2026-03-31 12:17:54"
649,75,1,,"ZAPATO TIPO SNEAKER PARA CABALLERO COLOR NEGRO, CORTE SINTETICO ACABADO TEXTURIZADO, FORRO SINTETICO, SUELA SINTETICA COLOR BLANCO,CON PERFORACCIONES TRANSPIRABLES EN LATERALES Y PUNTA, PESPUNTES VISIBLES, OCHO OJILLOS PERFORADOS,DOS OJILLOS METALICOS, AJUSTE DE AGUJETA COLOR NEGRO,PUNTA REDONDA, SEGÚN MUESTRA ZC31.",,PZA,,,concentrado,,"2026-03-31 11:49:44","2026-03-31 12:17:54"
650,132,1,,"CHALECO DE SEGURIDAD AZUL REY, FABRICADO EN TELA POLIÉSTER, CON CINTAS  DE ALTA VISIBILIDAD AL FRENTE Y EN LA ESPALDA, CIERRE FRONTAL VERTICAL, CINCO BOLSAS FRONTALES: TRES CON BROCHE, UNA TIPO PARCHE Y UNA CON VELCRO; Y UNA BOLSA TRASERA CON CIERRE. SEGÚN MUESTRA AC78",,PZA,,,concentrado,,"2026-03-31 11:49:44","2026-03-31 12:17:54"
651,89,1,,"BLUSA DE VESTIR PARA DAMA,SIN MANGA COLOR VERDE ESMERALDA,EN TELA 100 % POLIESTER ,CUELLO REDONDO CON ESCOTE ""V"", ADORNO DE BOTONES EN ESCOTE. SEGÚN MUESTRA BV05.",,PZA,,,concentrado,,"2026-03-31 11:49:44","2026-03-31 12:17:55"
652,33,1,,"BLUSA DE VESTIR PARA DAMA MANGA CORTA,TIPO DE MANGA DOLGAN, COLOR BLANCO,ESTAMPADO EN RAYAS DE COLOR AZUL MARINO/ROJO,COMPOSICIÓN 100% RAYON,ESCOTE EN ""V"",  BOLSA TIPO PARCHE AL FRENTE A LA ALTURA DEL PECHO LADO IZQUIERDO. SEGUN MUESTRA BV53.",,PZA,,,concentrado,,"2026-03-31 11:49:44","2026-03-31 12:17:55"
653,119,1,,"BLUSA DE VESTIR PARA DAMA, MANGA CORTA, COLOR AZUL FRANCIA, CONFECCIONADA 47% ALGODON, 3% ELASTANO, 50% POLIESTER, CUELLO FUSIONADO, SIETE BOTONES DE AJUSTE AL FRENTE,  Y BOTON DE REPUESTO, CUATRO PINZAS AL FRENTE Y DOS ATRAS, ABERTURA EN LATERAL,  CORTE CON SILUETA. SEGÚN MUESTRA, BV76",,PZA,,,concentrado,,"2026-03-31 11:49:44","2026-03-31 12:17:55"
654,119,1,,"BLUSA DE VESTIR PARA DAMA, MANGA CORTA, COLOR BLANCA CON LINEAS CUADRICULADAS COLOR NEGRO, CONFECCIONADA 55% BAMBOO, 4% ELASTANO, 41% POLIESTER, CUELLO FUSIONADO, SIETE BOTONES DE AJUSTE AL FRENTE,  Y BOTON DE REPUESTO, CUATRO PINZAS AL FRENTE Y DOS ATRAS, ABERTURA EN LATERAL,  CORTE CON SILUETA. SEGÚN MUESTRA, BV74",,PZA,,,concentrado,,"2026-03-31 11:49:44","2026-03-31 12:17:55"
655,95,1,,"CHALECO PARA DAMA COLOR AZUL MARINO, CONFECCIONADO EN TELA 100% POLIESTER, FORRO POLIESTER ,CAPITONADO HORIZONTAL,CON DETALLES MULTICOLOR  EN EL HOMBRO DERECHO ,BOLSAS AL FRENTE A LA ALTURA DEL ABDOMEN, CIERRE DE CARRO METALICO ALFRENTE,CUELLO ALTO,CON RESORTE EN LA PARTE DE ATRÁS, REPELENTE AL AGUA.SEGUN MUESTRA CHALD08",,PZA,,,concentrado,,"2026-03-31 11:49:44","2026-03-31 12:17:55"
656,38,1,,"CHAMARRA DE CABALLERO COLOR TOPO, CONFECCIONADO EN TELA 100% POLIESTER, REPELENTE AL AGUA, FORRO POLIESTER, DOS BOLSILLOS DELANTEROS A LA ALTURA DEL ABDOMEN, CIERRE DE CARRO METALICO AL FRENTE, TEJIDO EN CUELLO PU?OS Y PRETINA, BOLSA OCULTA A LA ALTURA DEL PECHO. SEGUN MUESTRA CHC20.",,PZA,,,concentrado,,"2026-03-31 11:49:44","2026-03-31 11:49:44"
657,44,1,,"CONJUNTO DE 3 PIEZAS PARA DAMA: SACO CONFECCIONADO EN TELA  POLIESTER, FORRO POLIESTER, CUELLO TIPO MAO, COLOR GRIS OXFORD A CUADROS CONTRASTANTES, BOTON DE AJUSTE, DOS BOLSAS  AL FRENTE A LA ATURA DEL ABDOMEN, PINZAS AL FRENTE A LA ALTURA DEL PECHO,CORTE CON SILUETA. PANTALON: CONFECCIONADO EN TELA 100% P0LIESTER , COLOR GRIS OXFORD A CUADROS CONTRASTANTES, CORTE RECTO, DOS PINZAS EN LA PARTE DE ATRAS A LA ALTURA DE LA CADERA, CIERRE METALICO Y BOTON DE AUJSTE AL FRENTE. BLUSA: CONFECCIONADA EN TELA 100% POLIESTER, COLOR AZUL MARINO, CUELLO TIPO MAO CON CADENA DE AJUSTE, ESCOTE EN V, MANGA 3/4, CUATRO PINZAS AL FRENTE A LA ALTURA DE LOS HOMBROS, PLIEGUE EN LA ESPALDA. SEGÚN MUESTRA CP05.",,PZA,,,concentrado,,"2026-03-31 11:49:44","2026-03-31 12:17:55"
658,97,1,,"CAMISA DE VESTIR MANGA LARGA PARA CABALLERO COLOR BLANCO, ESTAMPADO DE LINEAS EN VERTICAL AZUL ACERO  HORIZONTAL AZUL CLARO, COMPOSICIÓN 60% POLIESTER 40%  ALGODÓN, CUELLO FUSIONADO, PU?OS FUSIONADOS CON DOBLE BOTÓN DE AJUSTE, SIETE BOTONES DE AJUSTE EN COLOR BLANCO, FALDON CURVO, DOS BOTONES DE REPUESTO, BOLSILLO A LA ALTURA DEL PECHO LADO IZQUIERDO, SEGÚN MUESTRA CV45.",,PZA,,,concentrado,,"2026-03-31 11:49:44","2026-03-31 12:17:55"
659,97,1,,"CAMISA DE VESTIR MANGA LARGA PARA CABALLERO COLOR HUESO, DISEÑO LISO, COMPOSICIÓN 20% POLIESTER 80%  ALGODÓN, CUELLO FUSIONADO , PU?OS FUSIONADOS CON DOBLE BOTÓN DE AJUSTE, SIETE BOTONES DE AJUSTE EN COLOR BLANCO, FALDON CURVO, UN BOTÓN DE REPUESTO, BOLSILLO A LA ALTURA DEL PECHO LADO IZQUIERDO, SEGÚN MUESTRA CV46",,PZA,,,concentrado,,"2026-03-31 11:49:44","2026-03-31 12:17:55"
660,97,1,,"CAMISA DE VESTIR MANGA LARGA PARA CABALLERO COLOR VINO, DISEÑO LISO, COMPOSICIÓN 20% POLIESTER 80%  ALGODÓN, CUELLO FUSIONADO , PU?OS FUSIONADOS CON DOBLE BOTÓN DE AJUSTE, SIETE BOTONES DE AJUSTE EN COLOR VINO, FALDON CURVO, UN BOTÓN DE REPUESTO, BOLSILLO A LA ALTURA DEL PECHO LADO IZQUIERDO, SEGÚN MUESTRA CV49",,PZA,,,concentrado,,"2026-03-31 11:49:44","2026-03-31 12:17:55"
661,49,1,,"FALDA DE VESTIR PARA DAMA COLOR AZUL MARINO, COMPOSICIÓN 65% POLIESTER 35% ACRILICO, CORTE RECTO,  DOS PINZAS AL FRENTE Y ATRAS, ABERTURA TRASERA, CIERRE  DE CARRO METALICO CON BOTON PASTICO COLOR NEGRO, EN LA PARTE DE ATRÁS, BOLSAS EN DIAGONALES LATERALES . SEGÚN MUESTRA FV04.",,PZA,,,concentrado,,"2026-03-31 11:49:44","2026-03-31 12:17:55"
662,51,1,,"JUEGO DEPORTIVO PARA CABALLERO COMPOSICIÓN EN TELA 100% POLIESTER; COMPUESTO DE CHAMARRA EN COLOR AZUL MARINO CON DOS BOLSAS AL FRENTE A LA ALTURA DEL ABDOMEN TIPO CANGURO, CIERRE AL FRENTE, CON GORRO; PANTS COLOR  AZUL MARINO, DOS BOLSAS LATERALES, RESORTE EN LA CINTURA,TEJIDO EN PU?OS Y PRETINA,CORTE RECTO. SEGUN MUESTRA JPC06",,PZA,,,concentrado,,"2026-03-31 11:49:44","2026-03-31 12:17:55"
663,54,1,,"PANTALON DE GABARDINA PARA CABALLERO COLOR CAMEL, CONFECCIONADO EN 98% ALGODÓN 2% ELASTANO, CUATRO BOLSILLOS, DOS AL FRENTE DIAGONALES Y DOS TRASEROS TIPO OJAL, TIRO  MEDIO, CORTE RECTO, PIERNA Y VALENCIANA RELAJADA, CIERRE DE CARRO  METALICO EN BRAGUETA Y BOTON PLASTICO PARA AJUSTE, CINCO PRESILLAS. SEGÚN MUESTRA PGC01",,PZA,,,concentrado,,"2026-03-31 11:49:44","2026-03-31 12:17:55"
664,56,1,,"PANTALON DE GABARDINA PARA CABALLERO COLOR KHAKI, COMPOSICIÓN 98% ALGODÓN 2% ELASTANO, CUATRO BOLSILLOS:  DOS AL FRENTE DIAGONALES Y DOS ATRAS TIPO OJAL CON BOTON, CIERRE DE CARRO METALICO EN BRAGUETA Y BOTÓN PLASTICO PARA AJUSTE, CORTE SLIM, PIERNA Y VALENCIANA SEMI JUSTO, CINCO PRESILLAS. SEGÚN MUESTRA PGC20",,PZA,,,concentrado,,"2026-03-31 11:49:44","2026-03-31 12:17:55"
665,56,1,,"PANTALON DE GABARDINA PARA CABALLERO COLOR NEGRO, COMPOSICIÓN 98% ALGODÓN 2% ELASTANO, CUATRO BOLSILLOS:  DOS AL FRENTE DIAGONALES Y DOS ATRAS TIPO OJAL CON BOTON, CIERRE DE CARRO METALICO EN BRAGUETA Y BOTÓN PLASTICO PARA AJUSTE, CORTE SLIM, PIERNA Y VALENCIANA SEMI JUSTO, CINCO PRESILLAS. SEGÚN MUESTRA PGC21",,PZA,,,concentrado,,"2026-03-31 11:49:44","2026-03-31 12:17:55"
666,98,1,,"PLAYERA TIPO POLO PARA CABALLERO COLOR MARINO, COMPOSICIÓN EN 50% ALGODÓN 50% POLIESTER, MANGA CORTA, 3 BOTONES AL FRENTE, CUELLO Y PU?OS TEJIDOS CON DETALLES EN COLOR MARINO, DISEÑO BORDADO EN EL PECHO IZQUIERDO COLOR BLANCO. SEGÚN MUESTRA PLC09.",,PZA,,,concentrado,,"2026-03-31 11:49:44","2026-03-31 12:17:55"
667,98,1,,"PLAYERA TIPO POLO PARA CABALLERO COLOR BLANCA, COMPOSICIÓN EN 50% ALGODÓN 50% POLIESTER, MANGA CORTA, 3 BOTONES AL FRENTE, CUELLO Y PU?OS TEJIDOS CON DETALLES EN COLOR BLANCO. SEGÚN MUESTRA PLC07.",,PZA,,,concentrado,,"2026-03-31 11:49:44","2026-03-31 12:17:55"
668,62,1,,"PANTALON DE MEZCLILLA PARA CABALLERO COLOR AZUL CLARO JASPEADO, COMPOSICIÓN 100% ALGODÓN ,CUATRO BOLSILLOS:  TRES AL FRENTE Y DOS ATRAS, CINTURA MEDIA, CIERRE DE CARRO METALICO EN BRAGUETA Y BOTÓN METALICO PARA AJUSTE, CORTE RECTO, SEIS PRESILLAS. SEGÚN MUESTRA PMC01.",,PZA,,,concentrado,,"2026-03-31 11:49:44","2026-03-31 12:17:55"
669,100,1,,"PANTALON DE MEZCLILLA PARA DAMA INDIGO OBSCURO, CONFECCIONADO EN 62% ALGODÓN, 32% POLIESTER, 4% RAYON, 2% ELASTANO, CINCO BOLSILLOS: TRES AL FRENTE Y DOS ATRAS, TIRO ALTO, CIERRE DE CARRO METALICO EN BRAGUETA Y BOTÓN METALICO PARA AJUSTE, CORTE SKINNY, PUSH UP, PIERNA Y VALENCIANA JUSTA, CON REMACHES METALICOS EN LOS BOLSILLOS DELANTEROS, CINCO PRESILLAS, SEGÚN MUESTRA PMD30.",,PZA,,,concentrado,,"2026-03-31 11:49:44","2026-03-31 12:17:55"
670,100,1,,"PANTALON DE MEZCLILLA PARA DAMA COLOR STONE, CONFECCIONADO EN 74% ALGODÓN, 23% POLIESTER, 3% ELASTANO, CINCO BOLSILLOS: TRES AL FRENTE Y DOS ATRAS, TIRO MEDIO, CIERRE DE CARRO METALICO EN BRAGUETA Y BOTÓN METALICO PARA AJUSTE, CORTE SKINNY, PUSH UP, PIERNA Y VALENCIANA JUSTA, CON REMACHES METALICOS EN LOS BOLSILLOS DELANTEROS, CINCO PRESILLAS, SEGÚN MUESTRA PMD33.",,PZA,,,concentrado,,"2026-03-31 11:49:44","2026-03-31 12:17:55"
671,100,1,,"PANTALON DE MEZCLILLA PARA DAMA COLOR INDIGO, CONFECCIONADO EN 74% ALGODÓN, 23% POLIESTER, 3% ELASTANO, CINCO BOLSILLOS: TRES AL FRENTE Y DOS ATRAS, TIRO MEDIO, CIERRE DE CARRO METALICO EN BRAGUETA Y BOTÓN METALICO PARA AJUSTE, CORTE SKINNY, PUSH UP, PIERNA Y VALENCIANA JUSTA, CON REMACHES METALICOS EN LOS BOLSILLOS DELANTEROS, CINCO PRESILLAS, SEGÚN MUESTRA PMD32.",,PZA,,,concentrado,,"2026-03-31 11:49:44","2026-03-31 12:17:55"
672,102,1,,"ZAPATO DE VESTIR PARA CABALLERO COLOR NEGRO,CORTE VACUNO ACABADO PIEL LISA,FORRO TEXTIL,SUELA SINTETICA COLOR NEGRO,OCHO OJILLOS PERFORADOS,AJUSTE DE AGUJETA COLOR NEGRO ,DETALLE DE PERFORACIONES EN LATERALES Y EMPEINE,PESPUNTES VISIBLES,PUNTA REDONDA,SEGÚN MUESTRA ZC13.",,PZA,,,concentrado,,"2026-03-31 11:49:44","2026-03-31 12:17:55"
673,102,1,,"ZAPATO DE VESTIR PARA CABALLERO COLOR NOGAL, CORTE VACUNO ACABADO PIEL LISO, FORRO TEXTIL, SUELA SINTETICA COLOR NEGRO PLANTILLA DE RES, OCHO OJILLOS PERFORADOS, AJUSTE DE AGUJETAS COLOR CAFE OSCURO,DETALLES DE ORIFICIOS EN LATERALES Y PUNTA, PESPUNTES VISIBLES,PUNTA OVALADA CON DETALLES, SEGÚN MUESTRA ZC10.",,PZA,,,concentrado,,"2026-03-31 11:49:44","2026-03-31 12:17:55"
674,78,1,,"ZAPATO DE VESTIR PARA DAMA TIPO MOCASIN COLOR NEGRO, CORTE BOVINO ACABADO PIEL LISA, FORRO TEXTIL ACOJINADO, SUELA SINTETICA  COLOR NEGRO,HEBILLA METALICA EN EMPEINE, PESPUNTES VISIBLES,PUNTERA REDONDA.SEGÚN MUESTRA ZD04.",,PZA,,,concentrado,,"2026-03-31 11:49:44","2026-03-31 12:17:55"
675,135,1,,"RESPIRADOR MEDIA CARA DE UN FILTRO, PARA PROTECCIÓN MULTIGAS/VAPORES ORG?NICOS, BANDA EL?STICA AJUSTABLE, NO INCLUYE CARTUCHO. DEBE CUMPLIR CON LA NORMA NOM-116-STPS. SEGÚN MUESTRA AC07",,PZA,,,concentrado,,"2026-03-31 11:49:44","2026-03-31 12:17:55"
676,136,1,,"GUANTES UNITALLA EN COLOR BLANCO, FABRICADOS EN ALGODÓN CON APLICACIONES DE PUNTOS NEGROS DE PVC, TEJIDO EL?STICO EN MUÑECA. SEGÚN  MUESTRA AC17.",,PZA,,,concentrado,,"2026-03-31 11:49:44","2026-03-31 12:17:55"
677,86,1,,"BOTA PARA DAMA COLOR NEGRO, CORTE VACUNO ACABADO PIEL CRAZY, FORRO TEXTIL ACOJINADO, SUELA SINTETICA COLOR CAF?, BULLON GAMUZA, DIEZ OJILLOS METALICOS,AGUJETA COLOR NEGRO CON GRIS, GRABADO DE LOGO EN PARTE EXTERIOR. SEGÚN MUESTRA BD010",,PZA,,,concentrado,,"2026-03-31 11:49:44","2026-03-31 12:17:55"
678,116,1,,"BOTA PARA DAMA COLOR NEGRO, CORTE VACUNO ACABADO PIEL LISA, FORRO TEXTIL ACOJINADO, SUELA SINTETICA COLOR NEGRO,DIEZ OJILLOS PERFORADOS,CUATRO GANCHOS METALICOS, AJUSTE DE AGUJETA COLOR NEGRO,BULLON ALCOLCHADO CON CINTA PARA FACILITAR EL CALZADO,CON UN CIERRE EN LATERAL INTERNO, PESPUNTES VISIBLES, GRABADO DE LOGO EN PARTE EXTERIOR. SEGÚN MUESTRA BD22",,PZA,,,concentrado,,"2026-03-31 11:49:44","2026-03-31 12:17:55"
679,89,1,,"BLUSA DE VESTIR PARA DAMA, SIN MANGA, COLOR LIMON, CONFECCIONADA EN TELA 100% POLIESTER , CUELLO REDONDO, DOS BOTONES DE AJUSTE EN  LA ESPALDA A LA ALTURA DEL CUELLO EN COLOR PLATA, CINTA Y RESORTE EN LA PARTE INFERIOR PARA JUSTE. SEGÚN MUESTRA BV01.",,PZA,,,concentrado,,"2026-03-31 11:49:44","2026-03-31 12:17:55"
680,89,1,,"BLUSA DE VESTIR PARA DAMA, SIN MANGAS, COLOR HUESO ESTAMPADO FLORAL,  CUELLO REDONDO, CON AVERTURA EN ESPALDA, DOS BOTONES DE AJUSTE COLOR HUESO, FALDON CURVO, OLIEGUES EN CUELLO, SEGÚN MUESTRA BV03.",,PZA,,,concentrado,,"2026-03-31 11:49:44","2026-03-31 12:17:55"
681,31,1,,"BLUSA DE VESTIR PARA DAMA MANGA LARGA, COLOR NEGRO Y BLANCO, CONFECCIONADA EN TELA 100%  POLIESTER, CUELLO TIPO SPORT, ESCOTE EN V, CINCO BOTONES DE AJUSTE AL FRENTE  COLOR PLATA, PU?OS FUSIONADOS CON UN BOTON DE AJUSTE, FALDON CURVO.SEGÚN MUESTRA BV28.",,PZA,,,concentrado,,"2026-03-31 11:49:44","2026-03-31 12:17:55"
682,119,1,,"BLUSA DE VESTIR PARA DAMA, MANGA 3/4 COLOR MIL RAYAS VERDE MENTA, CON DETALLES DE LINEAS  BLANCO EN CUELLO Y PU?OS, CONFECCIONADA EN TELA 75% POLIESTER, 25% ALGODÓN, CUELLO FUSIONADO, ECOTE EN V, SIETE BOTONES DE AJUSTE AL FRENTE COLOR AZUL,  Y BOTON DE REPUESTO,  DOS PINZAS AL FRENTE Y DOS EN ESPALDA,, CORTE CON SILUETA, FALDON CURVO,  ABERTURA EN LATERALES. SEGÚN MUESTRA, BV75",,PZA,,,concentrado,,"2026-03-31 11:49:44","2026-03-31 12:17:55"
683,91,1,,"CHALECO PARA CABALLERO DOBLE VISTA COLOR AZUL MARINO Y CAFE OBSCURO, CONFECCIONADO EN TELA  100% POLIESTER, FORRO P?LIESTER, CAPITONADO DE CUADROS , CUELLO ALTO, DOS BOLSILLOS AL FRENTE CON CIERRE A LA ALTURA DEL ABDOMEN, CIERRE DE CARRO METALICO AL FRENTE.DOS BOLSILLOS INTERNOS A LA ALTURA DEL ABDO3.",,PZA,,,concentrado,,"2026-03-31 11:49:44","2026-03-31 11:49:44"
684,121,1,,"FILIPINA PARA CABALLERO MANGA CORTA COLOR ARENA, COMPOSICIÓN 65% POLIESTER 35% ACRILICO, CUELLO TIPO SPORT, CIERRE DE CARRO METALICO AL FRENTE, DOS BOLSAS AL FRENTE A LA ALTURA DEL ABDOMEN, DOS PINZAS EN LA PARTE DE ATRÁS, DOS ABERTURAS EN LATERALES. SEGÚN MUESTRA FL01.",,PZA,,,concentrado,,"2026-03-31 11:49:44","2026-03-31 12:17:55"
685,57,1,,"PANTALON DE GABARDINA PARA CABALLERO COLOR AZUL MARINO, COMPOSICION 100% ALGODÓN , CINCO BOLSILLOS: TRES AL FRENTE Y DOS ATRAS, CORTE RECTO, CINTURA ALTA, PIERNA Y VALENCIANA RELAJADA, CIERRE DE CARRO METALICO EN BRAGUETA Y BOTÓN METALICO PARA AJUSTE, CINCO PRESILLAS, REMACHES METALICOS EN BOLSILLOS DELANTEROS. SEGÚN MUESTRA PGC25",,PZA,,,concentrado,,"2026-03-31 11:49:44","2026-03-31 12:17:55"
686,69,1,,"PANTALON DE MEZCLILLA PARA DAMA COLOR INDIGO CLARO, COMPOSICIÓN 65.5% ALGODÓN 28.1% POLIESTER 3.1% VISCOSA 3.3% ELASTANO, CINCO BOLSILLOS: TRES AL FRENTE Y ATRAS, CINTURA ALTA, CIERRE DE CARRO METALICO EN BRAGUETA Y TRES BOTONES METALICOS PARA AJUSTE, CORTE SUPER SKINNY, CON REMACHES METALICOS EN LOS BOLSILLOS DELANTEROS, PRETINA ANCHA, PIERNA AJUSTADA, SEIS PRESILLAS, CON SISTEMA PUSH UP. SEGUN MUESTRA PMD14.",,PZA,,,concentrado,,"2026-03-31 11:49:44","2026-03-31 12:17:55"
687,69,1,,"PANTALON DE MEZCLILLA PARA DAMA COLOR INDIGO, COMPOSICIÓN 65.4% ALGODÓN 28% POLIESTER 3.4% VISCOSA 3.2% ELASTANO, CINCO BOLSAS: TRES AL AFRENTE Y DOS ATRAS, CIERRE DE CARRO METALICO EN BRAGUETA Y BOTÓNMETALICO PARA AJUSTE, CORTE SKINNY, TIRO MEDIO, PIERNA Y VALENCIANA SEMI AJUSTADA, CON REMACHES EN BOLSILLOS DELANTEROS, CINCO PRESILLAS, SEGUN MUESTRA PMD18.",,PZA,,,concentrado,,"2026-03-31 11:49:44","2026-03-31 12:17:55"
688,100,1,,"PANTALON DE MEZCLILLA PARA DAMA AZUL CLARO, CONFECCIONADO EN 70% ALGODÓN, 28% POLIESTER, 2% ELASTANO, CINCO BOLSILLOS: TRES AL FRENTE Y DOS ATRAS, TIRO ALTO, CIERRE DE CARRO METALICO EN BRAGUETA Y BOTÓN METALICO PARA AJUSTE, CORTE SKINNY, PUSH UP, PIERNA Y VALENCIANA JUSTA, CON REMACHES METALICOS EN  LOS BOLSILLOS DELANTEROS, CINCO PRESILLAS, SEGÚN MUESTRA PMD28.",,PZA,,,concentrado,,"2026-03-31 11:49:44","2026-03-31 12:17:55"
689,72,1,,"ZAPATO DE VESTIR PARA CABALLERO COLOR CAFE, CORTE VACUNO ACABADO PIEL TEXTURIZADA, FORRO TEXTIL, SUELA SINTETICA COLOR CAFE OSCURO,  PLANTILLA DE CERDO,  OCHO OJILLOS METALICOS COLOR BRONCE, AJUSTE DE AGUJETAS COLOR CAFE OSCURO, PESPUNTES VISIBLES,PUNTA LIGERAMNET CUADRADA, SEGÚN MUESTRA ZC02",,PZA,,,concentrado,,"2026-03-31 11:49:44","2026-03-31 12:17:55"
690,20,1,,"BOTA PARA CABALLERO COLOR CAFE, CORTE VACUNO, ACABADO PIEL LISA CON DETALLES TEXTILES EN EMPEINE Y LATERALES, FORRO TEXTIL, SUELA SINTETICA COLOR CAFE,SEIS CINTAS TEXTILES PARA AJUSTE,  CUATRO HERRAJES METALICOS, BULLON SUPERIOR SINTETICO ACABADO TEXTURIZADO, CON CINTA PARA FACILITAR CALZADO, AJUSTE DE AGUJETA COLOR NEGROY GRIS, PESPUNTES VISIBLES, GRABADO DE LOGO EN LA PARTE EXTERIOR,SEGUN MUESTRA BC15.",,PZA,,,concentrado,,"2026-03-31 11:49:44","2026-03-31 11:49:44"
691,87,1,,"BOTA PARA DAMA COLOR NEGRO, CORTE VACUNO ACABADO PIEL TEXTURIZADA, FORRO TEXTIL ACOJINADO, SUELA SINTETICA COLOR NEGRO, AJUSTE DE CIERRE EN LATERAL INTERIOR,RESORTE DE AJUSTE EN TOBILLO, ADORNO DE CINTA CON BROCHE METALICO COLOR NEGROL, PESPUNTES VISIBLES, GRABADO DE LOGO EN LA PARTE EXTERIOR, SEGUN MUESTRA BD36",,PZA,,,concentrado,,"2026-03-31 11:49:44","2026-03-31 11:49:44"
