id,partida_id,tipo_partida_especifica_id,lote,descripcion,marca,unidad_medida,codigo,medida,origen,legacy_propuesta_id,created_at,updated_at
420,20,1,,"BOTA PARA CABALLERO COLOR MOKA, CORTE VACUNO, ACABADO PIEL TEXTURIZADO, FORRO TEXTIL , SUELA SINTETICA COLOR GRIS, DIEZ OJILLOS METALICOS , AJUSTE DE AGUJETA COLOR CAFE,BULLON SUPERIOR SINTETICO ACABADO TEXTURIZADO, CON CINTA PARA FACILITAR CALZADO, PESPUNTES VISIBLES, GRABADO DE LOGO EN LA PARTE EXTERIOR,SEGUN MUESTRA BC23.",,PZA,,,concentrado,,"2026-03-31 11:49:44","2026-03-31 11:49:44"
421,20,1,,"BOTA PARA CABALLERO COLOR VERDE OLIVO , CORTE NOBUCK,  FORRO TEXTIL, SUELA SINTETICA CON DETALLES EN COLOR VERDE OLIVO Y NEGRO,  OCHO OJILLOS METALICOS,CUATRO GANCHOS ,AJUSTE DE AGUJETAS COLOR GRIS ,BULLON SUPERIOR SINTETICO ACABADO TEXTURIZADO, CINTA PARA FACILITAR CALZADO, PESPUNTES VISIBLES, FORRO INTERIOR ACOJINADO, GRABADO DE LOGO EN LA PARTE EXTERIOR.SEGÚN MUESTRA BC19",,PZA,,,concentrado,,"2026-03-31 11:49:44","2026-03-31 12:17:51"
422,20,1,,"BOTA PARA CABALLERO COLOR MOSTAZA , CORTE NOBUCK,  FORRO TEXTIL, SUELA SINTETICA CON DETALLES EN COLOR ARENA CON MOSTAZA,  OCHO OJILLOS METALICOS,CUATRO GANCHOS ,AJUSTE DE AGUJETAS COLOR BEIGE CON GRIS ,BULLON SUPERIOR SINTETICO ACABADO TEXTURIZADO, CINTA PARA FACILITAR CALZADO, PESPUNTES VISIBLES, FORRO INTERIOR ACOJINADO, GRABADO DE LOGO EN LA PARTE EXTERIOR.SEGÚN MUESTRA BC19",,PZA,,,concentrado,,"2026-03-31 11:49:44","2026-03-31 12:17:51"
423,20,1,,"BOTA PARA CABALLERO COLOR GRIS ,CORTE SINTETICO ACABADO GAMUSA , FORRO TEXTIL, SUELA SINTETICA COLOR NEGRO,  AJUSTE DE AGUJETA COLOR NEGRO Y AMARILLO, DIEZ HERRAJES METALICOS ,CUATRO GANCHOS METALICOS,BULLON SUPERIOR SINTETICO ACABADO TEXTURIZADO CON CINTA PARA FACILITAR CALZADO, REFUERZO  SINTETICO COLOR NEGRO EN TALON Y PUNTA, PESPUNTES VISIBLES, INTERIOR ACOJINADO,HORMA REDONDA,SEGÚN MUESTRA BC21.",,PZA,,,concentrado,,"2026-03-31 11:49:44","2026-03-31 12:17:51"
424,115,1,,"BOTA PARA CABALLERO COLOR NEGRO, CORTE SINTETICO ACABADO NOBUCK, FORRO TEXTIL, SUELA SINTETICA COLOR NEGRO, BULLON SUPERIOR GAMUSA, FORRO INTERIOR ACOJINADO, CATORCE OJILLOS METALICOS,  AJUSTE DE AGUJETA COLOR NEGRO, PESPUNTES VISIBLES,ETIQUETA DE LOGO EN LA PARTE EXTERIOR , SEGÚN MUESTRA BC25.",,PZA,,,concentrado,,"2026-03-31 11:49:44","2026-03-31 12:17:51"
425,115,1,,"BOTA PARA CABALLERO COLOR TAN, CORTE SINTETICO, ACABADO LISO, FORRO TEXTIL, SUELA SINTETICA COLOR CAFE, BULLON SUPERIOR SINTETICO ACABADO TEXTURIZADO, PESPUNTES VISIBLES, PUNTERA CON DETALLE EN CAF? , CATORCE OJILLOS METALICOS, AJUSTE DE AGUJETA COLOR CAF?, PESPUNTES VISIBLES, CINTA PARA FACILITAR EL CALZADO, GRABADO DE LOGO EN LA PARTE EXTERIOR.SEGÚN MUESTRA BC24.",,PZA,,,concentrado,,"2026-03-31 11:49:44","2026-03-31 12:17:51"
426,24,1,,"BOTA PARA DAMA COLOR GRIS OXFORD, CORTE SINTETICO ACABADO  NOBUCK, FORRO TEXTIL ACOJINADO, SUELA SINTETICA COLOR NEGRO Y GRIS, BULLON TEXTIL, DIEZ OJILLOS METALICOS, CUATRO GANCHOS METALICOS, AGUJETA COLOR GRIS, GRABADO DE LOGO EN LA PARTE EXTERIOR. SEGÚN MUESTRA BD07",,PZA,,,concentrado,,"2026-03-31 11:49:44","2026-03-31 12:17:51"
427,25,1,,"BOTA PARA DAMA COLOR NEGRO CORTE VACUNO ,ACABADO PIEL LISA,SIN FORRO,SIN BULLON SUELA SINTETICA  CON TACON COLOR NEGRO,AJUSTE DE RESORTE EN LATERALES,PESPUNTES VISIBLES,CINTA PARA FACILITAR CALZADO, GRABADO DE LOGO EN LA PARTE EXTERIOR.  SEGÚN MUESTRA BD17",,PZA,,,concentrado,,"2026-03-31 11:49:44","2026-03-31 12:17:51"
428,116,1,,"BOTA PARA DAMA COLOR TABACO, CORTE VACUNO, FORRO TEXTIL, ACABADO GAMUZA, SUELA SINTETICA COLOR BEIGE, CON AJUSTE DE RESORTE EN LATERALES, CINTA PARA FACILITAR EL CALZADO GRABADO DE LOGO EN LA PARTE EXTERIOR.SEGUN MUESTRA BD28",,PZA,,,concentrado,,"2026-03-31 11:49:44","2026-03-31 11:49:44"
429,116,1,,"BOTA PARA DAMA COLOR NEGRO, CORTE VACUNO, FORRO TEXTIL, ACABADO GAMUZA, SUELA SINTETICA COLOR NEGRO Y CAF? , CON AJUSTE DE RESORTE EN LATERALES, CINTA PARA FACILITAR EL CALZADO GRABADO DE LOGO EN LA PARTE EXTERIOR.SEGÚN MUESTRA BD29.",,PZA,,,concentrado,,"2026-03-31 11:49:44","2026-03-31 12:17:51"
430,29,1,,"BLAZER PARA DAMA COLOR KHAKI, CONFECCIONADO EN TELA  POLIESTER, FORRO POLIESTER, CUELLO CON SOLAPA, MANGA AJUSTABLE CON CINTA Y BOTON, DOS BOLSAS SIMULADAS AL FRENTE TIPO RIBETE, COSTURAS VISIBLES AL FRENTE Y ESPALDA, APERTURA EN APRTE BAJA DE LA ESPALDA. SEGÚN MUESTRA BL02.",,PZA,,,concentrado,,"2026-03-31 11:49:44","2026-03-31 12:17:51"
431,117,1,,"BATA DE MEDICO PARA CABALLERO MANGA LARGA COLOR BLANCO, CONFECCIONADO EN ALGODÓN, CUELLO CON SOLAPA, ALETILLA Y BOTONES PARA CERRAR LA PRENDA, ABERTURAS LATERALES, TRES BOLSAS AL FRENTE, CINTA TRASERA CON BOTONES. SEGÚN MUESTRA BMC01.",,PZA,,,concentrado,,"2026-03-31 11:49:44","2026-03-31 12:17:51"
432,118,1,,"BATA DE MEDICO PARA DAMA MANGA LARGA COLOR BLANCO, CONFECCIONADO EN POLIESTER, CUELLO CON SOLAPA, ALETILLA Y BOTONES PARA CERRAR LA PRENDA, DOS BOLSILLOS DELANTEROS, CINTA TRASERA, DOS PINZAS AL FRENTE Y EN LA PARTE DE ATRÁS  SEGÚN MUESTRA BMD01.",,PZA,,,concentrado,,"2026-03-31 11:49:44","2026-03-31 12:17:51"
433,118,1,,"BATA DE MEDICO PARA DAMA MANGA LARGA COLOR BLANCO, CONFECCIONADO EN  100%  ALGODON, CUELLO EN COMBINACI?N CON TELA MULTICOLOR, ALETILLA Y BOTONES PARA CERRAR LA PRENDA, CINCO BOLSILLOS DELANTEROS, PU?OS EN COMBINACI?N CON TELA MULTICOLOR. SEGÚN MUESTRA  BMD03",,PZA,,,concentrado,,"2026-03-31 11:49:44","2026-03-31 12:17:51"
434,118,1,,"BATA DE MEDICO PARA DAMA MANGA LARGA COLOR BLANCO, CONFECCIONADA EN POLIESTER, CUELLO CON SOLAPA, ALETILLA Y BOTONES PARA CERRAR LA PRENDA, DOS BOLSILLOS DELANTEROS Y UN BOLSILLO A LA ALTURA DEL PECHO,  CINTA TRASERA  CON BOTON Y ABERTURAS LATERALES . SEGÚN  MUESTRA BMD02.",,PZA,,,concentrado,,"2026-03-31 11:49:44","2026-03-31 12:17:51"
435,30,1,,"BLUSA DE VESTIR PARA DAMA SIN MANGA, COLOR FIUSHA, CONFECCIONADA EN TELA 100% POLIESTER, CUELLO TIPO SPORT CON CINTA DECORATIVA, ECOTE EN V, FALDON CURVO.SEGÚN MUESTRA BV10.",,PZA,,,concentrado,,"2026-03-31 11:49:44","2026-03-31 12:17:51"
436,30,1,,"BLUSA DE VESTIR PARA DAMA SIN MANGA,COLOR BLANCO CON LINEAS NEGRAS, CONFECCIONADA EN TELA 100%POLIESTER, CUELLO REDONDO CON SOLAPA, BOTON DE AJUSTE EN CUELLO CON ABERTURA, DOS PINZAS AL FRENTE A LA ALTURA DEL PECHO, ABERTURA EN LATERALES. SEGÚN MUESTRA BV07.",,PZA,,,concentrado,,"2026-03-31 11:49:44","2026-03-31 12:17:51"
437,31,1,,"BLUSA DE VESTIR PARA DAMA MANGA LARGA,COLOR LILA, CONFECCIONADA EN TELA 100% POLIESTER, CUELLO  TIPO SPORT CON CINTA DECORATIVA CVADENA DECORATIVA, ESCOTE ""V"", PU?OS FUSIONADOS CON UN BOTON DE AJUSTE, FALDON CURVO. SEGÚN MUESTRA BV27",,PZA,,,concentrado,,"2026-03-31 11:49:44","2026-03-31 12:17:51"
438,31,1,,"BLUSA DE VESTIR PARA DAMA COLOR NEGRO, SIN MANGA, DISEÑO LISO, CONFECCIONADA EN TELA 100% POLIESTER, CUELLO TIPO COLUMPIO, CADENA ANCHA DECORATIVA EN HOMBROS, FALDON CURVO. SEGÚN MUESTRA BV20.",,PZA,,,concentrado,,"2026-03-31 11:49:44","2026-03-31 12:17:51"
439,31,1,,"BLUSA DE VESTIR PARA DAMA, MANGA LARGA, COLOR BLANCO LISA, CONFECCIONADA EN TELA 100% POLIESTER, TERMINADA CON BIES RAYAS EN COLOR AZUL MARINO/AZUL AL FRENTE Y EN MANGAS, CUELLO TIPO SPORT, CINCO BOTONES  DE AUSTE  AL FRENTE, PU?OS FUSIONADOS CON UN BOTON DE AJUSTE, DOS PINZAS AL FRENTE Y ATRAS, FALDON CURVO. SEGÚN MUESTRA BV25.",,PZA,,,concentrado,,"2026-03-31 11:49:44","2026-03-31 12:17:51"
440,32,1,,"BLUSA DE VESTIR PARA DAMA, COLOR VERDE MANZANA,CONFECCIONADA EN TELA 100% POLIESTER, DISEÑO LISO,CUELLO REDONDO,DOS PINZAS EN LA PARTE DE ALFRENTE A LA ALTURA DEL PECHO,DOS PINZAS EN LA PARTE TRASERA. TIRAS EN HOMBRO CON MOÑO DECORATIVO LADO IZQUIERDO, SEGÚN MUESTRA BV40.",,PZA,,,concentrado,,"2026-03-31 11:49:44","2026-03-31 12:17:51"
441,32,1,,"BLUSA DE VESTIR PARA DAMA MANGA 3/4 COLOR NARANJA CONFECCIONADA EN TELA 100% POLIESTER, DISEÑO LISO,CUELLO  ESCOTE EN ""V"" CON SOLAPA , FALDON CURVO, PINZA AL FRENTE A LA ALTURA DEL PECHO, FALDON CURVO,SEGÚN MUESTRA BV39",,PZA,,,concentrado,,"2026-03-31 11:49:44","2026-03-31 12:17:51"
442,32,1,,"BLUSA DE VESTIR PARA DAMA  SIN MANGA COLOR HUESO EN LA PARTE DE ALFRENTE,COLOR NEGRO EN LA PARTE TRASERA, CONFECCIONADA EN TELA 100% POLIESTER, CUELLO SPORT CON ESCOTE EN ""V"" DOS PINZAS DELANTERAS A LA ALTURA DEL PECHO SEGÚN MUESTRA BV37",,PZA,,,concentrado,,"2026-03-31 11:49:44","2026-03-31 12:17:51"
443,32,1,,"BLUSA DE VESTIR PARA DAMA COLOR NEGRO/GRIS, MANGA 3/4 TERMINADA CON CINTA  DE AJUSTE   CONFECCIONADA EN TELA 100% POLIESTER, CUELLO EN ESCOTE EN ""V"",SEGÚN MUESTRA BV33",,PZA,,,concentrado,,"2026-03-31 11:49:44","2026-03-31 12:17:51"
444,33,1,,"BLUSA DE VESTIR PARA DAMA,  COLOR AZUL MARINO, CON DETALLES DE LINEAS HORIZAONTALES COLOR BLANCO, COMPOSICION 61% ALGODON, 31% POLIESTER 8% ELASTNO,  MANGA CORTA , BORTONES DECORATIVOS A  LA ALTURA DEL HOMBRO .SEGUN MUESTRA BV61",,PZA,,,concentrado,,"2026-03-31 11:49:44","2026-03-31 11:49:44"
445,34,1,,"BLUSA DE VESTIR PARA DAMA, MANGA 3/4 COLOR MELON JASPEADO, CONFECCIONADA EN TELA 75% POLIESTER, 25% ALGODÓN, CUELLO TIPO MAO, ECOTE EN V, SEIS BOTONES DE AJUSTE AL FRENTE,  Y BOTON DE REPUESTO, CUATRO PLIEGUES  AL FRENTE,  DOS PINZAS A LA ALTURA DEL PECHO, Y DOS PINZAS EN LA PARTE DEL ATRAS, CORTE CON SILUETA, FALDON CURVO. SEGÚN MUESTRA, BV70",,PZA,,,concentrado,,"2026-03-31 11:49:44","2026-03-31 12:17:51"
446,34,1,,"BLUSA DE VESTIR PARA DAMA COLOR BLANCO, MANGA LARGA CONFECCIONADA EN TELA 70% POLIESTER 30% ALGODÓN, CUELLO TIPO SPORT CON ESCOTE EN ""V"" BIES COLOR BLANCO CON DETALLES PUNTEADO MULTICOLOR,  SEIS BOTONES AL FRENTE PARA  AJUSTE Y BOTON DE REPUESTO, BOLSA EN PECHO LADO IZQUIERDO, DOS PINSAS AL FRENTE Y DOS PINZAS EN PARTE TRASERA. MANGA FUCIONADA CON 3 BOTONES DE AJUSTE, DETALLE EN MANGA PUNTEADO MULTICOLOR, PLIEGUES EN MANGA, AVERTURA AL COSTADO, SEGUN MUESTRA BV69.",,PZA,,,concentrado,,"2026-03-31 11:49:44","2026-03-31 12:17:51"
447,119,1,,"BLUSA DE VESTIR PARA DAMA, MANGA CORTA TIPO TULIPAN, COLOR MIL RAYAS AZUL CIELO, CONFECCIONADA EN TELA  100% POLIESTER, CUELLO FUSIONADO, SEIS BOTONES DE AJUSTE AL FRENTE,  Y BOTON DE REPUESTO, DOS PINZAS AL FRENTE Y DOS EN ESPALDA, CORTE CON SILUETA, FALDON CURVO, . SEGÚN MUESTRA, BV79",,PZA,,,concentrado,,"2026-03-31 11:49:44","2026-03-31 12:17:51"
448,119,1,,"BLUSA DE VESTIR PARA DAMA, MANGA CORTA TIPO TULIPAN, COLOR CORAL, CONFECCIONADA EN TELA  100% POLIESTER, CUELLO FUSIONADO, SEIS BOTONES DE AJUSTE AL FRENTE,  Y BOTON DE REPUESTO, DOS PINZAS AL FRENTE Y DOS EN ESPALDA, CORTE CON SILUETA, FALDON CURVO, . SEGÚN MUESTRA, BV78",,PZA,,,concentrado,,"2026-03-31 11:49:44","2026-03-31 12:17:51"
449,90,1,,"CONJUNTO DE 3 PIEZAS PARA DAMA: SACO CONFECCIONADO EN TELA  POLIESTER, FORRO POLIESTER, CUELLO REDONDO, LINEAS HORIZONTALES EN COLOR GRIS Y BEIGE, CORTE CON SILUETA Y TRES COSTURAS EN ESPALDA. FALDA: CONFECCIONADA EN TELA 100% P0LIESTER, COLOR GRIS OXFORD, CORTE RECTO,  CIERRE METALICO Y BOTON DE AJUSTE. BLUSA: CONFECCIONADA EN TELA 100% POLIESTER, COLOR HUESO, CUELLO TIPO SPORT CON CINTAS DECORATIVAS, DOS BOTONES DE AJUSTE CON CADENA, ESCOTE EN V, MANGA LARGA, PU?O FUSIONADO CON BOTON DE AJUSTE Y PLIEGUES, SEGÚN MUESTRA CP02.",,PZA,,,concentrado,,"2026-03-31 11:49:44","2026-03-31 12:17:51"
450,91,1,,"CHALECO PARA CABALLERO COLOR AZUL MARINO, CONFECCIONADO EN TELA 100%  POLIESTER, FORRO POLIESTER , CON DETALLES EN LINEAS PUNTEADAS, CUELLO ALTO, DOS BOLSILLOS AL FRENTE A LA ALTURA DEL ALDOMEN CON BIES COLOR ROJO, CIERRE  DE CARRO METALICO AL FRENTE COLOR ROJO, REPELENTE AL AGUA, BOLSA OCULTA DE LADO IZQUIERDO A LA ALTURA DEL ABDOMEN. SEGÚN MUESTRA CHALC05.",,PZA,,,concentrado,,"2026-03-31 11:49:44","2026-03-31 12:17:51"
451,91,1,,"CHALECO PARA CABALLERO DOBLE VISTA COLOR NEGRO Y CAF?, CONFECCIONADO EN TELA  100% POLIESTER, FORRO P?LIESTER, CAPITONADO DE CUADROS , CUELLO ALTO, DOS BOLSILLOS AL FRENTE CON CIERRE A LA ALTURA DEL ABDOMEN, CIERRE DE CARRO METALICO AL FRENTE.DOS BOLSILLOS INTERNOS A LA ALTURA DEL ABDOMEN, REPELENTE AL AGUA. SEGÚN MUESTRA CHALC02.",,PZA,,,concentrado,,"2026-03-31 11:49:44","2026-03-31 12:17:51"
452,93,1,,"CHALECO PARA CABALLERO COLOR AZUL ACERO, CONFECCIONADO EN TELA 100%  POLIESTER, FORRO POLIESTER, CUELLO ALTO , DOS BOLSILLOS AL FRENTE A LA ALTURA DEL ABDOMEN, CIERRE DE CARRO METALICO AL FRENTE, DOS BOLSAS OCULTAS EN INTERIOR A LA ALTURA DEL ABDOMEN. SEGÚN MUESTRA CHALC11",,PZA,,,concentrado,,"2026-03-31 11:49:44","2026-03-31 12:17:51"
453,93,1,,"CHALECO PARA CABALLERO COLOR NEGRO, CONFECCIONADO EN TELA 100% POLIESTER, FORRO POLIESTER, DOS BOLSAS AL FRENTE CON BROCHE METALICO A LA ALTURA DEL ABDOMEN, DETALLE CAPITONADO HOTRIZONTAL EN HOMBROS, CIERRE DE CARRO METICO EN HOMBROS, BOLSA INTERNA OCULTA  AL ALTURA DEL PECHO  SEGÚN MUESTRA CHALC14",,PZA,,,concentrado,,"2026-03-31 11:49:44","2026-03-31 12:17:51"
454,93,1,,"CHALECO PARA CABALLERO COLOR LADRILLO,  CONFECCIONADO EN TELA 100 % POLIESTER, FORRO POLIESTER,  DOS  BOLSAS AL FRENTE AL ALTURA DEL ABDOMEN, CUELLO ALTO, CIERRE DE CARRO METALICO ALFRENTE.SEGÚN MUESTRA CHALC12",,PZA,,,concentrado,,"2026-03-31 11:49:44","2026-03-31 12:17:51"
455,93,1,,"CHALECO PARA CABALLERO COLOR AZUL MARINO, CONFECCIONADO EN TELA 100% POLIESTER, FORRO POLIESTER, DOS BOLSAS AL FRENTE CON BROCHE METALICO A LA ALTURA DEL ABDOMEN, DETALLE CAPITONADO HOTRIZONTAL EN HOMBROS, CIERRE DE CARRO METICO EN HOMBROS, BOLSA INTERNA OCULTA  AL ALTURA DEL PECHO  SEGÚN MUESTRA CHALC14",,PZA,,,concentrado,,"2026-03-31 11:49:44","2026-03-31 12:17:51"
456,94,1,,"CHALECO PARA DAMA COLOR MALVA, CONFENCCIONADO EN TELA 100% POLIESTER, FORRO POLIESTER, CAPITONADO EN ROMBOS, BOLSAS AL FRENTE A LA ALTURA DEL ABDOMEN, CIERRE DE CARRO METALICO ALFRENTE, CUELLO ALTO, CON RESORTE EN LA PARTE DE ATRAS, REPELENTE AL AGUA.SEGUN MUESTRA CHALD05",,PZA,,,concentrado,,"2026-03-31 11:49:44","2026-03-31 11:49:44"
457,94,1,,"CHALECO PARA DAMA COLOR NEGRO, CONFECCIONADO EN TELA 100% POLIESTER, FORRO POLIESTER , CON DETALLES EN LINEAS PUNTEADAS, BOLSAS EN AL FRENTE A LA ALTURA DEL ABDOMEN, CIERRE DE CARRO METALICO ALFRENTE, REPELENTE AL AGUA.SEGUN MUESTRA CHALD03",,PZA,,,concentrado,,"2026-03-31 11:49:44","2026-03-31 11:49:44"
458,95,1,,"CHALECO PARA DAMA COLOR NEGRO, CONFECCIONADO EN TELA 100%  POLIESTER, FORRO POLIESTER, CAPITONADO ZIGZAG, DOS BOLSAS AL FRENTE CON CIERRE A LA ALTURA DEL ABDOMEN, CIERRE DE CARRO METALICO DE COLOR ROJO, DETALLES GRISES EN CINTURA DE AMBOS LADOS, RESORTE EN ESPALDA, CUELLO ALTO, CORTE CON SILUETA . SEGÚN MUESTRA CHALD13",,PZA,,,concentrado,,"2026-03-31 11:49:44","2026-03-31 12:17:51"
459,95,1,,"CHALECO PARA DAMA COLOR AZUL MARINO, CONFECCIONADO EN TELA 100% POLIESTER, FORRO POLIESTER, CORTE CON SILUETA, CAPITONADO HORIZONTAL, BOLSAS AL FRENTE A LA ALTURA DEL ABDOMEN, CIERRE DE CARRO METALICO ALFRENTE, CUELLO TIPO MAO, CON RESORTE EN LA PARTE DE ATRAS, REPELENTE AL AGUA.SEGUN MUESTRA CHALD07",,PZA,,,concentrado,,"2026-03-31 11:49:44","2026-03-31 11:49:44"
460,35,1,,"CHALECO PARA DAMA COLOR CEREZA, CONFECCIONADO EN TELA 100% POLIESTER, FORRO POLIESTER, CAPITONADO EN PETALOS, CUELLO ALTO, CIERRE DE CARRO METALICO AL FRENTE , DOS BOLSILLOS AL FRENTE CON CIERRE A LA ALTURA DEL ABDOMEN, BOLSA INTERNA OCULTA EN AMBOS LADOS. SEGÚN MUESTRA CHALD15",,PZA,,,concentrado,,"2026-03-31 11:49:44","2026-03-31 12:17:51"
461,35,1,,"CHALECO PARA DAMA COLOR ROJO, CONFECCIONADO EN TELA 100% POLIESTER, FORRO POLIESTER, CAPITONADO EN ROMBOS, DOS BOLSILLOS AL FRENTE CON CIERRE Y BIES PLASTICO A LA ALTURA DEL ABDOMEN, CIERRE DE ACRRO METALICO CON BIES PLASTICO EN COLOR NEGRO AL FRENTE, AJUSTE ELASTICO EN CINTURACON TOPE METALICO, CUELLO TIPO SPORT. SEGÚN MUESTRA CHALD21",,PZA,,,concentrado,,"2026-03-31 11:49:44","2026-03-31 12:17:51"
462,120,1,,"CHALECO TIPO REPORTERO UNISEX COLOR KAKHI, CONFECCIONADO EN TELA GABARDINA ALGODÓN, CIERRE FROTAL, TRECE BOLSILLOS AL FRENTE, UNO EN ESPALDA Y TRES AL INTERIOR. SEGÚN MUESTRA CHALR01.",,PZA,,,concentrado,,"2026-03-31 11:49:44","2026-03-31 12:17:51"
463,36,1,,"CHAMARRA DE CABALLERO COLOR NEGRO, CONFECCIONADA EN TELA 100% POLIESTER, REPELENTE AL AGUA, FORRO POLIESTER, CAPITONADO EN HORIZONTAL, DOS BOLSILLOS DELANTEROS CON DOS BROCHES METÁLICOS  EN CADA BOLSA, CIERRE DE CARRO METALICO AL FRENTE, AJUSTE ELASTICO CON TOPE  PLASTICO EN GORRO, CIERRES Y BROCE METALICO PARA DESMONTAR. SEGÚN MUESTRA CHC04.",,PZA,,,concentrado,,"2026-03-31 11:49:44","2026-03-31 12:17:51"
464,38,1,,"CHAMARRA DE CABALLERO COLOR AZUL MARINO/ ARENA,CONFECCIONADO EN TELA 92 %POLIESTER 8% POLIAMIDA, REPELENTE AL AGUA, FORRO POLIESTER, REPELENTE AL AGUA, DOS BOLSILLOS DELANTEROS A LA ALTURA DEL ABDOMEN, CIERRE DE ACRRO METALICO AL FRENTE, TEJIDO EN CUELLO, PU?OS Y PRETINA. SEGÚN MUESTRA CHC15",,PZA,,,concentrado,,"2026-03-31 11:49:44","2026-03-31 12:17:51"
465,38,1,,"CHAMARRA PARA CABALLERO COLOR NARANJA, CONFECCIONADA EN TELA 100% POLIESTER, FORRO POLIESTER, DOS BOLSAS AL FRENTE A LA ALTURA DEL ABDOMEN, CIERRE  DE CARRO METALICO AL FRENTE, TEJIDO EN CUELLO,BOLSA INTERNA OCULTA A LA ALTURA DEL ABDOMNEN, PU?OS Y PRETINA CON DETALLES MULTICOLOR, SEGÚN MUESTRA CHC17",,PZA,,,concentrado,,"2026-03-31 11:49:44","2026-03-31 12:17:51"
466,38,1,,"CHAMARRA DE CABALLERO COLOR AZUL MARINO,CONFECCIONADO EN TELA 100% POLIESTER, FORRO POLIESTER, CAPITONADO HORIZONTAL, REPELENTE AL AGUA, DOS BOLSILLOS DELANTEROS A LA ALTURA DEL ABDOMEN, CIERRE DE CARRO METALICO AL FRENTE, TEJIDO EN CUELLO, PU?OS Y PRETINA CON LINEAS MULTICOLOR, BOLSA INTERNA OCULTO A LA ALTURA DEL ABDOMEN. SEGÚN MUESTRA CHC14.",,PZA,,,concentrado,,"2026-03-31 11:49:44","2026-03-31 12:17:51"
467,39,1,,"CHAMARRA DE CABALLERO COLOR AZUL MARINO, CONFECCIONADO EN TELA 100 % POLIESTER, REPELENTE AL AGUA, FORRO POLIESTER, DOS BOLSILLOS DELANTEROS CON CIERRE A LA ALTURA DEL ABDOMEN, CIERRE  DE CARRO METALICO AL FRENTE, CUELLO TIPO SPORT, TEJIDO EN CUELLO, PU?OS Y PRETINA, BOLSA OCULTA A LA ALTURA DEL PECHO DE LADO IZQUIERDO . SEGÚN MUESTRA CHC25.",,PZA,,,concentrado,,"2026-03-31 11:49:44","2026-03-31 12:17:51"
468,40,1,,"CHAMARRA PARA DAMA COLOR AZUL MARINO, CONFECCIONADA EN TELA 100% POLIESTER FORRO POLIESTER, CIERRE AL FRENTE,  DOS BOLSAS AL FRENTE A LA ALTURA DEL ABDOMEN, CORET RECTO, DISEÑO DE LINEAS PUNTEADAS, TEJIDO EN  PU?O Y PRETINA, CUELLO ALTO. SEGÚN MUESTRA CHD01",,PZA,,,concentrado,,"2026-03-31 11:49:44","2026-03-31 12:17:51"
469,42,1,,"CHAMARRA PARA DAMA COLOR ROJO , CONFECCIONADA EN TELA POLIAMIDA REPELENTE AL AGUA, FORRO POLIAMIDA, RELLENO POLIESTER, CAPITONADO HORIZONTAL, DOS BOLSILLOS CON CIERRE AL FRENTE, CIERRE DE CARRO METALICO AL FRENTE AL FRENTE, CUELLO ALTO, CORTE CON SILUETA, BOLSA OCULTA A LA ALTURA DEL ABDOMEN DE LADO IZQUIERDO, BOLSA PARA FACILITAR SU GUARDADO. SEGÚN MUESTRA CHD13",,PZA,,,concentrado,,"2026-03-31 11:49:44","2026-03-31 12:17:52"
470,42,1,,"CHAMARRA PARA DAMA COLOR AMARILLO , CONFECCIONADA EN TELA POLIAMIDA REPELENTE AL AGUA, FORRO POLIAMIDA, RELLENO POLIESTER, CAPITONADO HORIZONTAL, DOS BOLSILLOS AL FRENTE, CIERRE DE CARRO METALICO AL FRENTE AL FRENTE, CUELLO ALTO, CORTE CON SILUETA, BOLSA OCULTA A LA ALTURA DEL ABDOMEN DE LADO IZQUIERDO, BOLSA PARA FACILITAR SU GUARDADO. SEGÚN MUESTRA CHD12",,PZA,,,concentrado,,"2026-03-31 11:49:44","2026-03-31 12:17:52"
471,43,1,,"CHAMARRA PARA DAMA COLOR AZUL CIELO, CONFECCIONADA EN TELA 100% POLIESTER REPELENTE AL AGUA, FORRO POLIAMIDA,RELLENO POLIESTER, CAPITONADO HORIZONTAL, DOS BOLSILLOS AL FRENTE CON DOS BROCHES DE PRESION  EN CADA BOLSA COLOR CIELO, CIERRE DE CARRO METALICO AL FRENTE, CUELLO ALTO, SEGÚN MUESTRA CHD15",,PZA,,,concentrado,,"2026-03-31 11:49:44","2026-03-31 12:17:52"
472,43,1,,"CHAMARRA PARA DAMA COLOR VERDE FLUORECENTE, CONFECCIONADA EN TELA 100% POLIESTER REPELENTE AL AGUA, FORRO POLIAMIDA,RELLENO POLIESTER, CAPITONADO HORIZONTAL, DOS BOLSILLOS AL FRENTE CON DOS BROCHES DE PRESION  EN CADA BOLSA COLOR VERDE, CIERRE DE CARRO METALICO AL FRENTE, CUELLO ALTO, SEGÚN MUESTRA CHD15",,PZA,,,concentrado,,"2026-03-31 11:49:44","2026-03-31 12:17:52"
473,44,1,,"CONJUNTO DE 3 PIEZAS PARA DAMA COLOR UVA: SACO CONFECCIONADO EN TELA  POLIESTER, FORRO POLIESTER, CUELLO CON SOLAPA, DOS BOLSAS SIMULADAS AL FRENTE TIPO FLAP, BOTON DE AJUSTE AL FRENTE, DOS PINZAS AL FRENTE, PU?O FUSIONADO CON CUATRO BOTONES DE AJUSTE. PANTALON: CONFECCIONADO EN TELA 100% P0LIESTER, COLOR UVA, CORTE RECTO,  CIERRE METALICO Y BOTON DE AJUSTE  AL FRENTE, BOLSA SIMULADA TIPO OJAL A LA ALTURA DE LA CADERA, DOS PINZAS EN LA PARTE TRASERA A LA ALTURA DE LA CADERA. BLUSA: CONFECCIONADA EN TELA 100% POLIESTER, COLOR BLANCO CON DETALLES DE LINEAS EN COLOR UVA, CUELLO TIPO MAO, ESCOTE EN V, MANGA LARGA, PU?O FUSIONADO CON BOTON DE AJUSTE Y PLIEGUES, CINCO BOTONES DE AJUSTE AL FRENTE, SEGÚN MUESTRA CP04.",,PZA,,,concentrado,,"2026-03-31 11:49:44","2026-03-31 12:17:52"
474,45,1,,"CAMISA DE VESTIR MANGA LARGA PARA CABALLERO COLOR BLANCO, DISEÑO LISO, COMPOSICIÓN 85% POLIESTER 12%  ALGODÓN 3% EXPANDEX, CUELLO FUSIONADO CON DOS BOTONES DE AJUSTE, PU?OS FUSIONADOS CON DOBLE BOTÓN DE AJUSTE, SIETE BOTONES DE AJUSTE EN COLOR NEGRO, FALD?N CURVO, DOS BOTONES DE REPUESTO, BOLSILLO A LA ALTURA DEL PECHO LADO IZQUIERDO, SEGÚN MUESTRA CV02.",,PZA,,,concentrado,,"2026-03-31 11:49:44","2026-03-31 12:17:52"
475,46,1,,"CAMISA DE VESTIR MANGA LARGA PARA CABALLERO COLOR AZUL CLARO, DISEÑO DE ROMBOS BLANCOS Y LINEAS AZUL MARINO, COMPOSICIÓN 60% POLIESTER 40%  ALGODÓN, CUELLO FUSIONADO, PU?OS FUSIONADOS CON DOBLE BOTÓN DE AJUSTE, SIETE BOTONES DE AJUSTE EN COLOR AZUL CLARO, FALD?N CURVO, DOS BOTONES DE REPUESTO, BOLSILLO A LA ALTURA DEL PECHO LADO IZQUIERDO, SEGÚN MUESTRA CV15.",,PZA,,,concentrado,,"2026-03-31 11:49:44","2026-03-31 12:17:52"
476,47,1,,"CAMISA DE VESTIR MANGA LARGA PARA CABALLERO COLOR BLANCO, ESTAMPADO A CUADROS EN COLOR AZULES DEGRADADOS, COMPOSICIÓN 60% POLIESTER 40%  ALGODÓN, CUELLO FUSIONADO, PU?OS FUSIONADOS CON DOBLE BOTÓN DE AJUSTE, SIETE BOTONES DE AJUSTE EN COLOR AZUL MARINO, FALD?N CURVO, DOS BOTONES DE REPUESTO, BOLSILLO A LA ALTURA DEL PECHO LADO IZQUIERDO, SEGÚN MUESTRA CV28.",,PZA,,,concentrado,,"2026-03-31 11:49:44","2026-03-31 12:17:52"
477,47,1,,"CAMISA DE VESTIR MANGA LARGA PARA CABALLERO COLOR AZUL, CON DISEÑO DE RAYAS VERTICALES EN COLOR BLANCO, COMPOSICIÓN 60% POLIESTER 40%  ALGODÓN, CUELLO FUSIONADO, PU?OS FUSIONADOS CON DOBLE BOTÓN DE AJUSTE, SIETE BOTONES DE AJUSTE EN COLOR AZUL MARINO, FALD?N CURVO, DOS BOTONES DE REPUESTO, BOLSILLO A LA ALTURA DEL PECHO LADO IZQUIERDO, SEGÚN MUESTRA CV30.",,PZA,,,concentrado,,"2026-03-31 11:49:44","2026-03-31 12:17:52"
478,97,1,,"CAMISA DE VESTIR MANGA LARGA PARA CABALLERO COLOR AZUL MARINO, ESTAMPADO DE LINEAS COLOR BLANCO Y ROJO, COMPOSICIÓN 60% POLIESTER 40%  ALGODÓN, CUELLO FUSIONADO CON DOS BOTONES DE AJUSTE, PU?OS FUSIONADOS CON DOBLE BOTÓN DE AJUSTE, SIETE BOTONES DE AJUSTE EN COLOR BLANCO, FALD?N CURVO, DOS BOTONES DE REPUESTO, BOLSILLO A LA ALTURA DEL PECHO LADO IZQUIERDO, SEGÚN MUESTRA CV41.",,PZA,,,concentrado,,"2026-03-31 11:49:44","2026-03-31 12:17:52"
479,121,1,,"FILIPINA PARA CABALLERO MANGA CORTA CON CON LINEAS EN AZUL TURQUEZA, COLOR BLANCO, COMPOSICIÓN 65% POLIESTER 35% ACRILICO, CUELLO TIPO MAO, CIERRE DE CARRO METALICO AL FRENTE CON BIES COLOR TURQUEZA, DOS BOLSAS AL FRENTE A LA ALTURA DEL ABDOMEN, UNA BOLSA A LA ALTURA DEL PECHO CON DETALLES COLOR TURQUEZA . SEGÚN MUESTRA FL04.",,PZA,,,concentrado,,"2026-03-31 11:49:44","2026-03-31 12:17:52"
480,121,1,,"FILIPINA PARA CABALLERO MANGA CORTA COLOR AZUL CLARO JASPEADO, COMPOSICIÓN 65% POLIESTER 35% ACRILICO, CUELLO TIPO MAO, CINCO BOTONES AL FRENTE COLOR AZUL, DOS BOLSAS AL FRENTE A LA ALTURA DEL ABDOMEN, UNA BOLSA A LA ALTURA DEL PECHO . SEGÚN MUESTRA FL01.",,PZA,,,concentrado,,"2026-03-31 11:49:44","2026-03-31 12:17:52"
481,122,1,,"FILIPINA PARA DAMA,  MANGA CORTA COLOR MENTA, COMPOSICIÓN 65% POLIESTER 35% ACRILICO, CUELLO TIPO MAO, ESCOTE EN V, CIERRE DE CARRO METALICO AL FRENTE, TRES BOLSAS AL FRENTE, DOS  A LA ALTURA DEL ABDOMEN, Y UNA A LA ALTURA DEL PECHO LADO IZQUIERDO,  CINTA DECORATIVA EN ESPALDA, CORTE CON SILUETA, APERTURA EN LATERALES INFERIORES.  SEGÚN MUESTRA FL07.",,PZA,,,concentrado,,"2026-03-31 11:49:44","2026-03-31 12:17:52"
482,122,1,,"FILIPINA PARA DAMA,  MANGA 3/4 COLOR BLANCO, COMPOSICIÓN 65% POLIESTER 35% ACRILICO, CUELLO TIPO SPORT, ESCOTE EN V, CINCO BOTONES AL COLOR BLANCO,  DOS BOLSAS AL FRENTE A LA ALTURA DEL ABDOMEN,  CINTA DECORATIVA EN ESPALDA, CORTE CON SILUETA, BIES COLOR ROSA EN MANGAS Y BOLSAS.  SEGÚN MUESTRA FL07.",,PZA,,,concentrado,,"2026-03-31 11:49:44","2026-03-31 12:17:52"
483,122,1,,"FILIPINA PARA DAMA,  MANGA CORTA COLOR MELON, COMPOSICIÓN 65% POLIESTER 35% ACRILICO, CUELLO MAO, ESCOTE EN V, CIERRE DE CARRO METALICO AL FRENTE, DOS BOLSAS AL FRENTE A LA A LTURA DEL ABDOMEN  Y UNA A LA ALTURA DEL PECHO, UNA CINTA DECORATIIVA EN ESPALDA, CORTE CON SILUETA. SEGÚN  MUESTRA FL06.",,PZA,,,concentrado,,"2026-03-31 11:49:44","2026-03-31 12:17:52"
484,122,1,,"FILIPINA  PARA DAMA, MANGA CORTA CON DETALLE EN COLOR AZUL MARINO, COLOR AZUL CIELO, COMPOSICIÓN 65% POLIESTER 35% ACRILICO, CUELLO  REDONDO , CINCO BOTONES  DE AJUSTE  CRUZADO AL FRENTE  CON DETALLE DE BIES EN COLOR AZUL MARINO , DOS BOLSAS AL FRENTE A LA ALTURA DEL ABDOMEN CON FILO EN COLOR AZUL MARINO, DOS PINZAS  EN LA PARTE DE ATRAS, CORTE CON SILUETA. SEGÚN MUESTRA FL05.",,PZA,,,concentrado,,"2026-03-31 11:49:44","2026-03-31 12:17:52"
485,49,1,,"FALDA DE VESTIR PARA DAMA COLOR GRIS OXFORD, COMPOSICIÓN 65% POLIESTER 35% ACRILICO, CORTE RECTO,  DOS PINZAS AL FRENTE Y ATRAS, ABERTURA TRASERA, CIERRE  DE CARRO METALICO CON BOTON PASTICO COLOR NEGRO, EN LA PARTE DE ATRÁS, BOLSAS EN DIAGONALES LATERALES . SEGÚN MUESTRA FV02.",,PZA,,,concentrado,,"2026-03-31 11:49:44","2026-03-31 12:17:52"
486,50,1,,"JUEGO DEPORTIVO PARA CABALLERO COMPOSICIÓN EN TELA 100% POLIESTER; COMPUESTO DE CHAMARRA EN COLOR GRIS, CON DOS BOLSAS AL FRENTE A LA ALTURA DEL ABDOMEN TIPO OJAL, CIERRE AL FRENTE,GORRO; PANTS COLOR  GRIS, DOS BOLSAS LATERALES, RESORTE EN LA CINTURA,CORTE RECTO. SEGUN MUESTRA JPC01",,PZA,,,concentrado,,"2026-03-31 11:49:44","2026-03-31 12:17:52"
